who_wrote_the_piece,subject,relevant_text,paragraphs,words,keywords,path
,"Conjecture, Media Summaries, Barron's Summary, Published Reports","Sexual harassment needs to be seen as a serious investment risk. Companies that tolerate or cover up sexual harassment, perpetuate a culture that fosters it, or fail to provide avenues for employees to report concerns or incidents, could see their bottom lines take a hit from difficulties attracting and retaining talented employees, customer defections, or ruined deals. In addition, research from Morgan Stanley shows that companies with greater gender diversity, and policies that support it, tend to deliver better risk-adjusted stock returns (link).",1,83,sexual harassment,"000660, 008770, 086790... - Barron's Summary - 04-Nov-17 - SA.pdf"
John Hancock Financial,"Corporate Social Responsibility, Human Interest Groups","""John Hancock is honored once again to be recognized among the companies receiving a perfect score for LGBT workplace equality,"" said Sandeep Tatla, Assistant Vice President and Global Head of Diversity and Inclusion, Manulife. Having a diverse and inclusive workforce is critical to John Hancock.  We work to foster an environment that attracts and retains a top talent and reflects the customers and communities we serve."" | the efforts of its PROUD (Professionals Reaching Out for Unity and Diversity) employee community to promote an inclusive workplace the company's commitment to offer the same benefits coverage to same sex and heterosexual couples the sponsorship of local organizations that aim to make a difference to the LGBT community",2,"66, 49","diversity, Diversity and Inclusion","002MSS, MFC.PRH, 071MGK - John Hancock Earns Top Marks in 2017 Corporate Equality Index - 05-Dec-16 - PRN.pdf"
Brooklyn Candle Studio,"Contracts, Corporate Social Responsibility, New Products & Services, Human Interest Groups","In an effort to contribute to the fight for gender equality and women's autonomy, ten percent of proceeds from each candle will be donated to three different female-centric charitable organizations every quarter. Those organizations include Planned Parenthood, Equality Now, and the Center for Health and Gender Equity (CHANGE).",1,48,gender equality,"0687X1, LULU - Brooklyn Candle Studio Announces Collaboration With Artist Allison Kunath - 28-Jan-20 - PRN.pdf"
Autograph Collection Hotels,New Products & Services,"have resulted in over 325 diverse feature films. Films that have originated from Black List screenplays have earned over $26 billion worldwide and have received 45 Oscars. Leonard is sought after to speak on diversity and inclusion in Hollywood. He chose The Black List as the umbrella title for his ventures because it references his own African American heritage as well as the Hollywood blacklist denying employment to a generation of American entertainment professionals during the McCarthy era. | BETHESDA, Md., Oct. 19, 2016 /PRNewswire/ -- Autograph Collection, Marriott International's distinctive portfolio of one-of-a-kind hotels, is launching the Independent Film Initiative.  Launching in January 2017, this dynamic, experiential cultural program will celebrate independent film ""ì an art form that shares Autograph Collection Hotels' goals of championing individuality and diversity. The initiative will be curated by respected names working at the forefront of independent cinema including Franklin Leonard, Founder & CEO of The Black List, and digital entertainment distributor, FilmBuff.",2,"78, 80","diversity, Diversity and Inclusion","0CNXZJ, MAR - Autograph Collection Hotels Launches Unprecedented Cultural Program Focusing On Independent Film - 19-Oct-16 - PRN.pdf"
"Kahn Swick & Foti, LLC",,"During a period of time spanning 2010 to 2016, the Company received over 200 internal complaints filed by female workers claiming gender discrimination or sexual harassment, according to disclosures recently made by the Company.  Further, the Company's internal review process resulted in a denial of approximately 93% of the claims, finding merit in only one gender discrimination claim and 15 sexual harassment or assault claims.  The alleged culture of sexual bias and mistreatment has been the basis of significant negative media exposure for the Company as well as several lawsuits brought by former employees in state and federal courts.  In one such ongoing case, the plaintiffs charge that based on data from Microsoft, discriminatory treatment cost female workers up to $238 million in compensation and more than 500 promotions during a four-year period, and are seeking to have the case certified as a class action, which, if granted could potentially include more than 8000 women.",1,155,sexual harassment,"0FCNPT, MSFT - MICROSOFT INVESTIGATION INITIATED BY FORMER LOUISIANA ATTORNEY GENERAL Kahn Swick & Foti, LLC Investigates the Officers and Direc... - 27-Apr-18 - PRN.pdf"
"Kahn Swick & Foti, LLC",Lawsuit,"During a period of time spanning 2010 to 2016, the Company received over 200 internal complaints filed by female workers claiming gender discrimination or sexual harassment, according to disclosures recently made by the Company. Further, the Company's internal review process resulted in a denial of approximately 93% of the claims, finding merit in only one gender discrimination claim and 15 sexual harassment or assault claims. The alleged culture of sexual bias and mistreatment has been the basis of significant negative media exposure for the Company as well as several lawsuits brought by former employees in state and federal courts. In one such ongoing case, the plaintiffs charge that based on data from Microsoft, discriminatory treatment cost female workers up to $238 million in compensation and more than 500 promotions during a four-year period, and are seeking to have the case certified as a class action, which, if granted could potentially include more than 8000 women.",1,155,sexual harassment,"0FCNPT, MSFT - MICROSOFT INVESTIGATION INITIATED by Former Louisiana Attorney General Kahn Swick & Foti, LLC Investigates the Officers and Direct... - 11-May-18 - BW.pdf"
"Kahn Swick & Foti, LLC",Lawsuit,"During a period of time spanning 2010 to 2016, the Company received over 200 internal complaints filed by female workers claiming gender discrimination or sexual harassment, according to disclosures recently made by the Company. Further, the Company's internal review process resulted in a denial of approximately 93% of the claims, finding merit in only one gender discrimination claim and 15 sexual harassment or assault claims. The alleged culture of sexual bias and mistreatment has been the basis of significant negative media exposure for the Company as well as several lawsuits brought by former employees in state and federal courts. In one such ongoing case, the plaintiffs charge that based on data from Microsoft, discriminatory treatment cost female workers up to $238 million in compensation and more than 500 promotions during a four-year period, and are seeking to have the case certified as a class action, which, if granted could potentially include more than 8000 women.",1,155,sexual harassment,"0FCNPT, MSFT - MICROSOFT INVESTIGATION INITIATED by Former Louisiana Attorney General Kahn Swick & Foti, LLC Investigates the Officers and Direct... - 13-Apr-18 - BW.pdf"
John Hancock Retirement Plan Services,"Contracts, New Products & Services","About EverFi, Inc. EverFi, Inc. is the education technology innovator that empowers K-12, higher education, and adult learners with the skills needed to be successful in life. Its comprehensive critical skills platform is focused on Financial Education, Digital Citizenship, STEM Career Readiness, Diversity and Inclusion, Entrepreneurship, Character Education, and Health and Wellness. The EverFi Education Network is powered by more than 3,300 partner organizations across all 50 states and Canada, and annually reaches 6 million learners. Learn more at everfi.com.",1,80,Diversity and Inclusion,"0FJPRG, MFC.PRH, 0B0D8Z - John Hancock Retirement Plan Services Introduces New Financial Wellness Tool, Expands Partnership with EverFi - 01-Nov-16 - PRN.pdf"
,"Media Summaries, Sunday NYT Summary","Tech firms don't do enough to prevent proliferation of child sexual abuse imagery | Tech companies ban child sexual abuse imagery from their platforms, but search engines, social networks, and cloud storage are rife with gaps for criminals to result. For victims, the trauma of constantly recirculating photos and videos can be devastating. Companies mentioned: GOOGL, DBX, MSFT, FB, AMZN, AAPL, SNAP",2,"13, 48",sexual abuse,"AAL, AAPL, AMZN... - New York Times Sunday Edition Summary - 10-Nov-19 - SA.pdf"
,"Media Summaries, Economist Summary","On 26-Jan WSJ published an investigation detailing several allegations that amount to a decades-long spree of sexual misconduct by Wynn Resorts (WYNN) CEO Steve Wynn. The company's board has appointed a special committee to investigate the reports, the accuracy of which Wynn denies. Wynn's control over Wynn Resorts is near-absolute, and the outcome of the inquiry may significantly impact the business.",1,61,sexual misconduct,"AAPL, AMZN, BRK.B... - StreetAccount Summary The Economist print edition - 01-Feb-18 - SA.pdf"
MarketNewsUpdates.com,Investment Opinions,"Market analysts are forecasting steady growth for the Global Condom Industry based on such factors as rise in sexually transmitted diseases, HIV/Aids, incorrect use of contraceptives, unprotected sexual intercourse, contraceptive failures, or sexual assaults which can lead to unplanned pregnancies. According to Global Market Insights, the Global Contraceptives Market is poised cross USD $35 Billion by 2024 on the heels of rising prevalence of sexually transmitted diseases, favorable regulatory scenario in developed nations. The increasing use of contraceptive in under developed countries and rising awareness towards disease prevention will further boost the business size. In the news today includes: RESTANCE, Inc. (OTC: ANCE), Church & Dwight Co., Inc. (NYSE: CHD), Reckitt Benckiser Group plc (OTC: RBGLY), Pfizer Inc. (NYSE: PFE), Pfizer Inc. (NYSE: PFE)",1,124,sexual assault,"ANCE, CHD, LLY... - Global Condom Industry Growing at a Rapid Pace on Rising Awareness Towards Disease Prevention - 28-Nov-17 - PRN.pdf"
,,"With 64,000 employees in 69 countries, 523 production sites on five continents and over  30,000 suppliers, Essilor has a significant global 'footprint'. Across the world, employees  at  each  Group  entity  contribute  to  the  key  priorities  of  the  company's  sustainability  approach:  innovating  to  improve  access  to  visual  health;  reducing  water  and  energy  consumption;  promoting  diversity  and  inclusion;  ensuring  safe  and  quality  working  conditions; and connecting suppliers and customers to its mission.",1,70,diversity,EL - DJSI - FTSE4GOOD 2 major recognitions of Essilor's leadership in sustainability - 21-Sep-17 - NEWS_CR.pdf
,,"ÔÇ∑  Essilor ranks 62nd out of 700 companies in new annual listing of diversity and inclusion  | towards greater diversity and inclusion within the Company    | (Charenton-le-Pont, 20 November 2019) ""ì Essilor has been awarded the title of ""Diversity Leader  2020""ù by the Financial Times, recognized in the publication's new annual ranking of diversity  and  inclusion  in  the  workplace.  The  Group  is  listed  62nd  out  of  a  total  of  10,000  companies  scanned  as  part  of  this  first-of-its-kind  ranking  which  assesses  companies'  success  in  promoting all types of diversity.    This  award  is  an  endorsement  of  Essilor's  continuous  commitment  and  concrete  initiatives  towards  greater diversity and inclusion within the Company. At Essilor, diversity is defined and fostered across  multiple  areas,  ranging  from  gender  balance,  integration  of  people  with  disabilities,  openness  to  all  forms of sexual orientation to generational and cultural diversity.  With 7 nationalities represented in its management committee, Essilor's efforts in the field of diversity  are driven by both Group policies and a strong network of internal diversity ambassadors, promoting a  diverse and inclusive workforce across regions. Essilor is an official sponsor and active participant in  the  EVE  programme  whose  ambition  is  to  tackle  the  issue  of  women's  progression  within  the  professional world and has launched W.I.L (Women In Leadership), an internal initiative to help develop  more women into leadership positions in the Asia-Pacific-Middle-East-Africa scope of the Group.  When recruiting, the Group also makes sure that at least 50%  of candidates are women, and when  hiring at executive level that at least one woman is on the shortlist.   This latest recognition by the Financial Times follows on from a strong score of 94 points out of 100 in  the  Gender  Equality  Index  by  Essilor,  which  the  Company  measured  earlier  this  year  based  on  the  methodology defined by the French government.    Laurent Vacherot, CEO of Essilor, declared: ""We receive Financial Times' award with pride. Diversity  has been a key value for Essilor from the very beginning, shaping both our culture and identity and  contributing to our continued success. For us, promoting diversity and inclusion is not only an ethical  obligation, it is also one of our fundamental convictions: to achieve our ambition to provide better vision  and  protection  to  7.7  billion  people  on  the  planet,  we  need  a  full  diversity  of  talents.  Diversity  and  inclusion  are  key  vectors  of  our  ability  to  innovate  as  they  nourish  our  creativity  and  bring  together  varied perspectives, thereby creating value. With more than 69,000 employees worldwide, the diversity  of our talents and culture is one of our greatest strengths.""ù     The  Financial  Times'  ""Diversity  Leaders""ù  ranking  was  established  based  on  an  independent  survey  from a vast sample of more than 80,000 employees. In addition, the opinions of human resources and  recruitment experts have been considered to refine the analysis. The participants evaluated listed and  privately-held companies across 10 European countries1  and 26 industry sectors on various diversity  dimensions such as general diversity, gender, ethnicity, sexual orientation, age and disability. The 700  companies receiving the highest total scores were recognized as the Diversity Leaders 2020. For more  information about the Financial Times' ""Diversity Leaders""ù ranking, please click here.      |   Essilor recognized as a ""Diversity Leader 2020""ù by the Financial  Times",4,"16, 8, 494, 11","diversity, Diversity and Inclusion",EL - ESSILOR INTERNATIONAL SA  Press Release - 20-Nov-19 - NEWS_CR.pdf
,,"About BPP    Engaging  the  private  sector  is  at  the  cornerstone  of  Australia's  modernised  aid  program,  supporting  economic growth, incomes and jobs. The Business Partnerships  Platform (BPP) contributes directly to  accelerating  Australia's  collaboration  with  business  to  address  development  challenges  in  the  Asia- Pacific region. For more information, please visit BPP's website.     About Eye Mitra    Essilor's inclusive business arm, 2.5 New Vision Generation (2.5 NVG), launched its Eye Mitra program in  2013 in India as part of its strategy of increasing awareness and access to vision care for underserved  populations and at the same time improving their livelihood. Eye Mitra (Hindi for ""friend of the eyes""ù)  addresses  unmet  needs  for  vision  care  by  recruiting  and  training  unemployed  and  underemployed  young people to become primary vision care providers.    Essilor's  inclusive  business  programmes  impact  seven  out  of  17  UN  Sustainable  Development  Goals.  These include no poverty, quality educations, gender equality and decent work and economic growth.",1,152,gender equality,EL - ESSILOR INTERNATIONAL SA  Press Release - 23-Jan-18 - NEWS_CR.pdf
,,,0,0,,EL - ESSILOR INTERNATIONAL SA  Press Release - 29-May-18 - NEWS_CR.pdf
,,"Note to Editors     About 2.5 New Vision Generation and the Eye Mitra program    In 2013, Essilor, leading ophthalmic optics company, established its inclusive business 2.5 New Vision  Generation (2.5 NVG), to create awareness, develop infrastructure and bring affordable eye care to low  income countries which count for 90 per cent of the 2.5 billion people who suffer from uncorrected poor  vision globally. Essilor's inclusive business programs impact seven out of 17 UN Sustainable  Development Goals. These include no poverty, quality educations, gender equality and decent work and  economic growth.    2.5 NVG launched its flagship inclusive business program Eye Mitra in India in 2013 as part of its strategy  of increasing awareness and access to vision care for underserved populations and at the same time  improving their livelihood. Eye Mitra (Hindi for ""friend of the eyes""ù) addresses unmet needs for vision care  by recruiting and training unemployed and underemployed young people to become primary vision care  providers. Similar programs have been launched in Bangladesh and Kenya in 2018 and are known locally  as Eye Mitra and Eye Rafiki respectively.    For more information, please visit www.essilorseechange.com.      About Essilor",1,186,gender equality,EL - Essilor's inclusive business 2.5 NVG celebrates equipping over 10 million people in India with affordable eye care at annual Eye Mitra C... - 09-May-19 - NEWS_CR.pdf
,"Articles, Reports, Media Summaries","WSJ's Heard on the Street column applauds companies' dropping arbitration as means of addressing alleged sexual harassment  Monday, November 12, 2018 05:08:22 AM (GMT)",1,24,sexual harassment,"FB, GOOGL, MSFT... - WSJ's Heard on the Street column applauds companies' dropping arbitration as means of addressing alleged sexual harassment - 12-Nov-18 - SA.pdf"
,Company Announcement,"In  2018,  135  honorees  were  recognized,  spanning  23  countries  and  57  industries.  The  twelfth  class  of honorees  had  record  levels  of  involvement  with  their  stakeholders  and  their  communities  around  the  world. Measuring  and  improving  culture,  leading  authentically  and  committing  to  transparency,  diversity  and inclusion were all priorities for honorees.",1,49,diversity,LECO - Lincoln Electric Named One of the 2018 World's Most Ethical Companies¬Æ by the Ethisphere Institute - 12-Feb-18 - PMZ.pdf
,Company Announcement,"CLEVELAND, Feb. 25, 2019 (GLOBE NEWSWIRE) -- Lincoln Electric Holdings, Inc. (Nasdaq: LECO) (""Company""ù), announced today that Michele R. Kuhrt will serve as Executive Vice President, Chief Human Resources Officer (CHRO), effectively immediately. In this role, Kuhrt will be responsible for leading the global human resources team, with an emphasis on employee engagement and development, diversity and inclusion, and enhancing HR systems and processes. She will report to Christopher L. Mapes, Chairman, President and Chief Executive Officer.",1,77,Diversity and Inclusion,"LECO - Lincoln Electric Names Michele R. Kuhrt as Executive Vice President, Chief Human Resources Officer - 25-Feb-19 - PMZ.pdf"
Eli Lilly and Company,"Corporate Social Responsibility, Financing Agreements, Licensing & Marketing Agreements, Not For Profit Organizations","""Lumina Foundation's work has long been driven by our 'equity imperative,' a focus on justice for Black, Hispanic, and Native American students that we build into all of our efforts to increase the nation's educational attainment,"" said Timothy P. Robinson, assistant vice president, operations, and grants administration at Lumina. ""To strengthen those efforts, we have forged a new commitment to what we call Equity and Justice Intelligence ""ì our capacity to address diversity, inclusion and racial justice in all of our work.""",1,82,diversity,LLY - Central Indiana Racial Equity Fund Launches with more than $2.2 Million in Initial Commitments - 25-Jun-20 - PRN.pdf
Eli Lilly and Company,"Corporate Social Responsibility, Human Interest Groups","""We believe diversity is critical to innovation. Our inclusion on the  DiversityInc list is a great honor and validation of our efforts to create an environment where innovation can flourish,"" said Shaun Hawkins, chief diversity officer. ""Embracing diversity is at the core of our long-held value of respect for people. It is the lens through which we understand and respond to the unique needs of the millions of individuals who depend on our medicines. | DiversityInc Names Lilly a Top Company for Diversity   Wednesday, April 25, 2012 05:30:00 PM (GMT) | INDIANAPOLIS, April 25, 2012 /PRNewswire/ -- Eli Lilly and Company (NYSE: LLY) has been named to the 2012 DiversityInc Top 50 Companies for Diversity list. Lilly ranked 29th, an increase from its 2011 rating of 39. | DiversityInc's ""Top 50 Companies for Diversity"" is known as the leading assessment of diversity management globally. To make the list, participating companies must have more than 1,000 employees and demonstrate strength in key diversity areas: CEO commitment, human capital, corporate and organizational communications, and supplier diversity ""ì while also showing year-to-year progress in diversity initiatives. | ""Our diversity commitment extends through the full spectrum of our business, including our supply chain, clinical trial strategy and marketing. We also work to ensure that diversity is embedded in our global practices, policies and training, and in recent years, we have increased our leaders' accountability for developing diverse talent,"" Hawkins said. | Methodology A total of 587 companies participated in the 2012  DiversityInc Top 50 competition, up 11 percent from last year. The evaluation for placement consists of more than 300 empirical questions across four areas: CEO commitment, human capital, corporate and organizational communications, and supplier diversity. | The results are determined by statistical analysis. It is an independent editorial process and there is no fee to enter the competition and no requirement to conduct business with DiversityInc. | The top 50 companies, selected from among 587 submissions, were announced April 24 in New York . To see the full list, visit http://diversityinc.com/the-diversityinc-top-50-companies-for-diversity-2012/. | To learn more about diversity at Lilly, visit www.lilly.com/about/diversity/Pages/diversity.aspx.",9,"74, 15, 36, 55, 52, 45, 30, 24, 9","Chief Diversity Officer, diversity",LLY - DiversityInc Names Lilly a Top Company for Diversity - 25-Apr-12 - PRN.pdf
Eli Lilly and Company,"Corporate Social Responsibility, Human Interest Groups","""We must have a diverse group of employees who understand the varying needs of the diverse people we serve. Ensuring a nondiscriminatory work environment and a culture of inclusion for these employees is a key priority for Lilly, because we believe that diversity empowers us to generate unique insights and ideas, create solutions and deliver innovation to improve outcomes for individual patients,"" said Shaun Hawkins, chief diversity officer. | DiversityInc Names Lilly the Top Company for Working Families   Wednesday, October 10, 2012 01:00:00 PM (GMT) | INDIANAPOLIS, Oct. 10, 2012 /PRNewswire/ -- Eli Lilly and Company (NYSE: LLY) has been named DiversityInc's 2012 Top Company for Working Families. | Known as a leading assessor of diversity management globally,  DiversityInc has presented special awards to companies on its ""Top 50 Companies for Diversity"" list for exceptional diversity-management achievements since 2009. | ""We recognize the critical importance of work-life programs to address the diverse needs, expectations, lifestyles, and work styles of employees that allow them to be the most effective,"" said Steve Fry, senior vice president of human resources and diversity. ""Family-friendly work schedules and benefits are about having lower stress levels, maintaining better health, and enabling a stronger focus when at work""ì""ìall leading to enhanced engagement, increased innovation and ultimately better results."" | Lilly has received several workplace honors in 2012 for its commitment to diversity. These include being a finalist for Best in Class Employers of Asian Pacific American Professionals and Out & Equal's Workplace Awards. Additional honors include Top Companies for Executive Women, Top 100 Best Places to Work/Working Mother  magazine, Best Adoption Friendly Workplaces and receiving a perfect score of 100 on the Human Rights Campaign Best Places to Work Corporate Equality Index. | For more information,  http://www.lilly.com/about/diversity/Pages/diversity.aspx",7,"68, 16, 22, 30, 71, 73, 4","Chief Diversity Officer, diversity",LLY - DiversityInc Names Lilly the Top Company for Working Families - 10-Oct-12 - PRN.pdf
,,,0,0,,LLY - Eli Lilly & Co.(LLY-US) Schedules Annual General Meeting for 4-May-2020 1100 AM ET - 23-Mar-20 - FCSTEV.pdf
,,,0,0,,LLY - Eli Lilly & Co.(LLY-US) Schedules Q2 2020 Earnings Call for 30-July-2020 900 AM ET - 11-Nov-19 - FCSTEV.pdf
