who_wrote_the_piece,subject,relevant_text,paragraphs,words,keywords,path
"Marriott International, Inc.",,"Marriott's success in the diversity and inclusion space is based on a 360-degree cultural approach encompassing results-oriented metrics and initiatives supporting associates, customers, suppliers and owners.  This approach had led to signature accomplishments such as collaborating with leading human rights nonprofits on human trafficking prevention training and leveraging TakeCare, its award-winning employee wellbeing program, to advance the practice of diversity and inclusion in the modern workplace. | Marriott has consistently championed diversity and inclusion, maintaining one of the most diverse and inclusive workforces as a strategic business priority. The company has been recognized for its talent development programs with a long list of notable and lifetime achievement awards, including - Working Mother 100 Best Companies Quarter Century and Hall of Fame, Black Enterprise Best Companies for Diversity, a repeat LATINA Style Company of the Year, Asia Society Best Companies for Asian Pacific Americans, National Association for Female Executives (NAFE) Top Companies for Executive Women Hall of Fame, a Fortune 100 Best Companies to Work For¬Æ, and have received a 100 percent score on the Human Rights Campaign's Corporate Equality Index for many years. For more information on Marriott's global diversity and inclusion initiatives: www.marriott.com/diversity. | Marriott International Ranks #1 On DiversityInc Top 50 List   Wednesday, May 06, 2020 02:16:00 PM (GMT) | BETHESDA, Md., May 6, 2020 /PRNewswire/ -- Marriott International, Inc. was recognized as the #1 company for diversity across industries on the 2020 DiversityInc Top 50 Companies for Diversity list. The ranking also makes Marriott the highest-ranking hospitality company on the list for more than ten years and the only one to have achieved the top ranking.  The company was also ranked on specialty ""Top Companies"" lists for Board of Directors (#4), Supplier Diversity (#5), and LGBT efforts (unranked list). | ""Being named #1 for diversity at this moment in history feels especially meaningful,"" said Dr. David  Rodriguez, Marriott International Global Chief Human Resources Officer. ""It takes generations of inclusive leadership, deep commitment and conviction to create a culture of belonging where all associates are treated with dignity and respect. This culture has always been the foundation for our business of hospitality. Even during these incredibly challenging times, our associates have intensified their inspirational efforts to take care of their communities, guests and each other."" | The DiversityInc rankings are determined by an objective methodology calculating factors such as Talent Pipeline, Equitable Talent Development (including commitments to mentorship and philanthropy), CEO/Leadership Commitment, and Supplier Diversity. The empirical data for the rankings is provided by a 300-question survey filled out by personnel at the participating companies. | international-ranks-1-on-diversityinc-top-50-list-301054010.html",7,"66, 127, 16, 80, 84, 49, 1","diversity, Diversity and Inclusion",MAR - Marriott International Ranks #1 On DiversityInc Top 50 List - 06-May-20 - PRN.pdf
"Marriott International, Inc.","Corporate Social Responsibility, Human Interest Groups","""Our founders created a business with simple, yet powerful principles: Put people first in every decision and open doors to opportunity for everyone,"" said David Rodriguez, Executive Vice President & Global Chief Human Resources Officer at Marriott International. ""Our commitment to diversity and inclusion is at the heart of our pledge to extend this important legacy and to drive our business forward. It is how we will ensure that Marriott remains the place where everyone belongs.""  | Marriott is committed to providing associates, customers, suppliers, owners and many other key stakeholders with meaningful and impactful diversity and inclusion programs in place, including: | The Emerging Leader Program ""ì A key pillar of Marriott's Americas Diversity and Inclusion strategy is to increase the numbers of women and minorities in leading roles. More than 1,300 leaders have completed or are currently enrolled in this program. Overall, women have represented 56% of participants and minorities have represented 36%. Since the program's inception in 2014, 60% of participants have been promoted at least once.  | Marriott has consistently championed diversity and inclusion. The company has been recognized for its talent development programs in the past and has landed on several best places lists. Previous awards include Working Mother 100 Best Companies Quarter Century Hall of Fame, Black Enterprise Best Companies for Diversity, LATINA Style Company of the Year, National Association for Female Executives Top Companies for Executive Women Hall of Fame, 100 percent score on Human Rights Campaign's Corporate Equality Index, Asia Society Best Companies for Asian Pacific Americans Awards and Fortune 100 Best Companies to Work For¬Æ.  For more information on Marriott's diversity and inclusion initiatives, please visit www.marriott.com/diversity. | Marriott International Ranks #2 on 2019 DiversityInc Top 50 Companies for Diversity List   Thursday, May 09, 2019 07:57:00 PM (GMT) | BETHESDA, Md., May 9, 2019 /PRNewswire/ -- Marriott International, Inc. was recognized on the 2019 DiversityInc Top 50 Companies for Diversity list in the #2 spot, once again making it the highest-ranking hospitality company on the list for more than ten years . The company was also ranked on ten specialty ""Top Companies"" lists including Diverse Leadership (#2), Diversity Councils (#5), Executive Women (#5), Philanthropy (#6), Supplier Diversity (#10), Talent Acquisition (#11), and LGBT efforts (unranked list).  | The Diversity Ownership Initiative ""ì This program introduces successful women and diverse business owners to the opportunity of hotel ownership as a possible investment vehicle.  Today, more than 1,300 open hotels are owned by diverse and women entrepreneurs. | The DiversityInc rankings are determined by an objective methodology that calculates factors such as Talent Pipeline, Equitable Talent Development (including commitments to mentorship and philanthropy), CEO/Leadership Commitment, and Supplier Diversity. The empirical data for the rankings is provided by a 300-question survey filled out by personnel at the participating companies. | international-ranks-2-on-2019-diversityinc-top-50-companies-for-diversity-list-300847650.html",9,"76, 25, 67, 105, 20, 77, 38, 50, 1","diversity, Diversity and Inclusion",MAR - Marriott International Ranks #2 on 2019 DiversityInc Top 50 Companies for Diversity List - 09-May-19 - PRN.pdf
"Marriott International, Inc.",Human Interest Groups,"BETHESDA, Md., April 5, 2013 /PRNewswire/ -- Marriott International, Inc. (NYSE: MAR) boosted its longstanding history of embracing differences recently during the Straight for Equality Gala. Apoorva Gandhi, Marriott's vice president of multicultural markets and alliances co-hosted this year's gala along with Jimmie Paschall, executive vice president of enterprise diversity and inclusion at Wells Fargo. The event put on by the national chapter of Parents and Friends of Lesbians and Gays (PFLAG) honored straight allies in the fields of sports, literature and entertainment for their work in championing equal rights for all.",1,92,Diversity and Inclusion,MAR - Marriott International Shines at Straight for Equality Gala - 05-Apr-13 - PRN.pdf
,Company Announcement,"Pullins of Truman Medical Centers introduced creative employee benefits to engage with employees and fight high turnover rates, particularly among nurses in the competitive health care region of Kansas City. With such programs as paid sabbaticals for senior leaders and weekly HR rounds, Pullins brought innovation to the organization and redefined HR for the CEO. Other efforts included hiring a diversity and inclusion officer and developing a related strategy that resulted in national recognition and forging a coaching culture that increased employee promotions. | Harte, formerly a senior HR leader at Yahoo!, has driven high employee engagement and significantly lengthened employee tenure, no small feat for a company built on freelancers. She successfully led a distributed workforce through a challenging transition that included a rebranding and an IPO by creating a culture focused on trust, diversity and belonging, breaking down silos and regularly working to ensure employees are learning, engaged and motivated. | Danaher's Lalor focused her efforts on building on the company's strengths while expanding HR's strategic business focus and improving employee engagement. Since joining the global science and technology innovations company seven years ago, she and her team built tools to improve the science behind engagement and driven improvement around diversity, both internally and externally. She collaborated with the leadership team and the HR operation throughout, also developing the leadership pipeline and creating an environment for innovation.",3,"83, 68, 76","diversity, Diversity and Inclusion",MAR - Marriott International's David Rodriguez Named 2019 HR Executive of the Year - 26-Sep-19 - PMZ.pdf
"Marriott International, Inc.",Human Interest Groups,"The EncouragHERS luncheon will recognize the influence and brilliance of women who use their energy to uplift and empower women leaders from across all industries of business, entertainment, sports, politics and more. Each attendee has demonstrated support for the African American community or made impactful contributions to NMAAHC, which reflects Marriott International's 80+ year commitment to diversity and inclusion.",1,59,Diversity and Inclusion,"MAR - Marriott International, In Partnership With The Smithsonian National Museum Of African American History And Culture Celebrates The Women Wh... - 22-Sep-16 - PRN.pdf"
"Marriott International, Inc.","Corporate Social Responsibility, Human Interest Groups","Marriott is consistently honored for being a top company for diversity and inclusion. It was recently named by the National Association for Female Executives as one of the top corporations for employing executive women.  Great Places to Work Institute¬Æ also recognized the company for being one of the 2015 World's Best Multinational Workplaces and the National Gay and Lesbian Chamber of Commerce named the company its 2014 Corporation of the Year.  Marriott has also been listed as the #1 company for supplier diversity by DiversityInc, and has been honored by Hispanic Association on Corporate Responsibility, Black Enterprise and Latina STYLE for diversity & inclusion efforts in workforce, board membership and supplier diversity. | ""We are honored to continue to be recognized for our passionate dedication to women-owned businesses globally,"" said Dominica Groom, Senior Director, Global Sustainability & Supplier Diversity at Marriott International.  ""Our commitment aims to incorporate and further develop WBEs within Marriott's global supply chain.  In addition to our extensive efforts across the U.S., we continue to place increased emphasis on the global expansion of this platform, proactively supporting women-owned businesses around the world."" | Marriott International is committed to responsible global business operations inside and beyond its hotels. For more information about our commitment to social responsibility and supplier diversity visit the 2015 Sustainability Report.",3,"112, 72, 31","diversity, Diversity and Inclusion",MAR - Marriott Named a Top Corporation for Supporting Women-Owned Businesses - 28-Mar-16 - PRN.pdf
Marriott International,Human Interest Groups,"Marriott has a longstanding commitment to diversity and inclusion and has strategic partnerships with organizations that share the same vision and goals.  The company was the first in the travel industry to establish a formal diversity and inclusion program in 1989 and the first to introduce a formal supplier diversity program in 1997.  These programs have expanded to support the communities where Marriott does business. For more about Marriott's diversity and inclusion efforts, visit www.marriott.com/diversity.",1,75,Diversity and Inclusion,MAR - Marriott Rewards Goes to Bat for New Movie About Baseball Legend Jackie Robinson - 05-Apr-13 - PRN.pdf
"Marriott International, Inc.",,"Marriott has a longstanding commitment to diversity and inclusion and has strategic partnerships with organizations that share the same vision and goals.  The company was the first in the travel industry to establish a formal diversity and inclusion program in 1989 and the first to introduce a formal supplier diversity program in 1997.  These programs have expanded to support the communities where Marriott does business. For more about Marriott's diversity and inclusion efforts, visit www.marriott.com/diversity.",1,75,Diversity and Inclusion,MAR - Marriott Rewards Goes to Bat for New Movie About Baseball Legend Jackie Robinson - 11-Mar-13 - PRN.pdf
,Company Announcement,"Marriott has consistently been recognized for its outstanding workplace and  diversity and inclusion programs.  For a comprehensive list of accomplishments, click Awards and Recognition.",1,24,Diversity and Inclusion,MAR - Marriott Scores 100% Perfect Ranking on 2016 Corporate Equality Index - 19-Nov-15 - PMZ.pdf
"Marriott International, Inc.","Corporate Social Responsibility, Human Interest Groups","""We are proud of this campaign and of our long-standing reputation for our commitment to diversity and inclusion,"" says Joanna Todd, vice president, segment strategy.  ""Our core strength lies in our ability to embrace differences and make everyone feel respected and valued when they visit and stay in our hotels.  Later this year, we will also launch new campaigns to reach African American and Latino audiences."" | For more information about Marriott's global diversity and inclusion initiatives, visit www.marriott.com/diversity.",2,"66, 12",Diversity and Inclusion,"MAR - Marriott Welcomes LGBT Guests to Be You, With Us - 07-Jun-12 - PRN.pdf"
"Marriott International, Inc.",Human Interest Groups,"As Marriott grows globally, its commitment to diversity and inclusive environment helps attract, engage and retain associates who deliver exceptional service.  The company plans to double its presence in Europe by 2015, double its portfolio in China in the next five years, and increase hotels in India to 100 hotels across seven brands by 2015.  Extensive growth is also planned in the Middle East and Africa.",1,66,diversity,MAR - Marriott's Core Values Translate Around the World - 14-Nov-12 - PRN.pdf
"Marriott International, Inc.","Corporate Social Responsibility, Not For Profit Organizations","Diversity & Inclusion and Youth Employment | Implementing a foundational cross-cultural workshop and Intercultural Development Inventory (IDI), a leadership tool designed to promote diversity awareness by measuring an individual's or group's fundamental orientation to cultural differences. Promoting women's empowerment through training programs for leaders. Women represented 42 percent of participants in our Leadership Excellence Program, 18 percent of participants in the General Managers One Week Program, 33 percent of participants in the Executive Development Program, and 46 percent in the newly launched Professional Leadership Program. Supporting youth hospitality career development through programs such as Youth Career Initiative (YCI), and Marriott's World of Opportunity Europe initiative that works with charitable partners that received ‚Ç¨300,000 (approximately $400,000) cash, ‚Ç¨100,000 (approximately $130,000) in-kind, and nearly 4,000 hours of volunteerism for sponsoring more than 250 young people across Europe.",2,"6, 128","diversity, Diversity & Inclusion",MAR - Marriott's Sustainable Hotel Development Boosts Economies and Creates Jobs - 30-Jul-13 - PRN.pdf
"Marriott International, Inc.",Human Interest Groups,"Marriott is being recognized for its  Global Diversity and Inclusion Council , which ensures women's development and advancement in revenue-generating and global leadership roles, and the Women's Leadership Development Initiative, which focuses on three pillars:  Leadership and Development, Networking and Mentoring, and Workforce Effectiveness.",1,44,Diversity and Inclusion,MAR - Marriott's Women Executives Help Lead the Way - 08-Feb-12 - PRN.pdf
,,"MUNICH, GERMANY--(Marketwired - Jul 24, 2013) - As a multinational FORTUNE 500 company, Marriott focuses on five global social issues: poverty alleviation, the environment, community workforce development, the well-being of children, and global diversity and inclusion. In a shining example of Marriott's Spirit to Serve, associates from the Courtyard Munich City Center joined associates from 13 other European Marriott properties in Romania to help add improvements to a local children's home.",1,71,Diversity and Inclusion,MAR - Munich Marriott Associates Hit the Road for a Good Cause - 24-Jul-13 - INW.pdf
"Marriott International, Inc.","Corporate Social Responsibility, Human Interest Groups","BETHESDA, Md., Dec. 6, 2016 /PRNewswire/ -- Nearly 30 years ago, Marriott International established one of the first corporate diversity and inclusion programs. Today, the company is one of the most diverse in the U.S. with 64 percent of its associates representing minority groups. Opportunities are abundant with more than half of its managers starting their Marriott careers as front-line associates. | ""At Marriott, we want everyone to feel that they belong""îthat they are family; it's the true heart of an inclusive work environment,"" said David Rodriguez, executive vice president and global chief human resources officer. ""Our concept of diversity and inclusion promotes a sense of unity, with each of us having the power to be the best at our jobs and to make a positive difference for one another. This recognition from Great Place to Work and Fortune, which considers feedback from our associates, affirms that we are on the right path."" | Our culture resonates strongly with associates across the company.  Dexter Daniel, senior event services supervisor said, ""As a company, we are truly blessed to have great visionary leadership who genuinely care about associates and our valued guests. Our diversity and inclusion core values truly unite us as ""Family"" around the world in service to one another for a greater quality of life!"" | Putting People First Elevates Marriott as a Best Workplace for Diversity & Inclusion   Tuesday, December 06, 2016 04:33:00 PM (GMT) | TakeCare Movement focusing on wellbeing and happiness Emerging Leader Program for front-line and mid-level managers Talent Network Teams addressing associate-recommended business challenges with innovative solutions Diversity & Inclusion Councils promoting diverse perspectives on the business and workplace Paid parental leave, financial assistance for adoption, infertility coverage and progressive healthcare benefits Workplace and scheduling flexibility options | Today, Marriott was recognized by Great Place to Work¬Æ and Fortune as one of the 50 Best Workplaces for Diversity, 10 Best Workplaces for Latinos and 10 Best Workplaces for African Americans. | Other recognition this year included LATINA  Style Company of the Year. DiversityInc Top 10 Companies for Diversity and Black Enterprise 50 Best Companies for Diversity. The company also scored 100 percent on the Human Rights Campaign Corporate Equality Index and has placed on the FORTUNE 100 Best Companies to Work For¬Æ list each year since its inception in 1998. Similar recognition has been received in countries across the globe. | To view the original version on PR Newswire, visit: http://www.prnewswire.com/news-releases/putting-people- first-elevates-marriott-as-a-best-workplace-for-diversity--inclusion-300373761.html",8,"61, 91, 62, 20, 55, 32, 69, 11","diversity, Diversity & Inclusion, Diversity and Inclusion",MAR - Putting People First Elevates Marriott as a Best Workplace for Diversity & Inclusion - 06-Dec-16 - PRN.pdf
,,"Renaissance Dupont Circle Hotel is a property managed by Marriott International. Marriott has consistently received high scores on the Human Rights Campaign's Corporate Equality Index. As winners of the 2011 Capital Area Gay & Lesbian Chamber of Commerce ""Corporate Ally of the Year"" award and recipient of a perfect diversity score from the Human Rights Campaign, Marriott prides itself on having all TAG Approved¬Æ listings and fostering a long-term commitment to diversity and inclusion. For more information on Marriott's diversity initiatives, travel partners, and other unique hospitality packages, please visit, www.marriottgaytravel.com.",1,91,Diversity and Inclusion,MAR - Renaissance Dupont Circle Hotel Shows Its Capital Pride as an Official Hotel Sponsor of LGBTA Pride Festival in Nation's Capital  - 04-Jun-12 - INW.pdf
"Marriott International, Inc.",Human Interest Groups,"Hamm's athletic career is the stuff of legends. Born with a clubfoot, she wore corrective shoes as a toddler. Yet Hamm's soccer prowess kicked in at a young age, despite the many schools she attended as the daughter of an Air Force pilot. In 1987, at age 15, Hamm became the youngest soccer player on the national team.  She won the Women's World Cup in 1991 and 1999, and took Olympic gold medals in 1996 and 2004. Elected Soccer USA's ""Female Athlete of the Year"" five years in a row (1994-98), Hamm was named MVP of the Women's Cup (1995) and was the winner of three ESPY Awards, including  ""Soccer Player of the Year"" and ""Female Athlete of the Year."" In 2004, along with teammate Michelle Akers , Hamm was named to FIFA's list of the ""125 Greatest Living Soccer Players,"" the only women and only Americans to be named to the list at that time.  An outspoken pioneer for gender equality in sports, Hamm was named the greatest female athlete of the last 40 years by ESPN in 2012.",1,180,gender equality,MAR - Soccer Superstar Mia Hamm Kicks Off Residence Inn's Search for the Ultimate Soccer Mom - 06-May-14 - PRN.pdf
"Marriott International, Inc.","Accounting Issues, Corporate Social Responsibility","Executive-level approval of Human Rights & the Protection of Children training for all employees worldwide with a specific training module for security officers An on-going commitment to the Youth Career Initiative (YCI), a program that helps empower young people with the life and vocational skills they need to stave off the effects of poverty, crime and exploitation.  Marriott was instrumental in securing a $200,000 grant from the U.S. Department of State for the program Tracking and reporting the company's global carbon footprint and publicly disclosing through the Carbon Disclosure Project An equal employment opportunity (EEO) policy and global commitment to diversity & inclusion that is overseen by the Board of Directors Cash and in-kind contributions to charitable (nonprofit) organizations in 2010 that exceeded $28 million Publically stated environmental goals and performance results",1,132,Diversity & Inclusion,MAR - The Financial Times Stock Exchange (FTSE) Recognizes Marriott for Social Responsibility Leadership - 11-May-11 - PRN.pdf
"Marriott International, Inc.",Human Interest Groups,"Thought Leadership Platform to Join the Gender Equality Conversation in a Big Way with Expanded Lineup of Thought-Provoking Events Kicking off with Director Ava DuVernay at W Hollywood | NEW YORK , Feb. 23, 2018 /PRNewswire/ -- It's time for women to speak up as never before. And, perhaps, most importantly, it's time for people to LISTEN to What She Said . W Hotels today announces an exciting next step for What She Said , the brand's popular initiative that celebrates femininity ""ì in all its forms, nuances and glory. Here, femininity is defined by experience, not confined by gender. Since launching in 2016, What She Said  has given a platform to icons of culture like  Diane von Furstenberg, Jenna Lyons , Rachel Zoe, LeToya Luckett , Tig Notaro, Cheryl Hines, and NIIA, among others, with over 40 well-attended and stimulating What She Said  events to date. Now, as conversations in our society evolve, so too will the What She Said  platform, which will focus on providing safe spaces for conversation to drive progress in the gender equality movement by bringing in provocative speakers, cultivating community, and sparking conversation that inspires, educates, and enlightens. In addition to panels hosted with experts of industry around the world, W will host at least one intimate dinner each month, bringing captivating, behind-closed- doors conversations about modern issues of equality to the global stage through curated podcasts, videos and livestreamed content. | ""W Hotels has always been a bold advocate and active participant in global conversations around equality,"" said Anthony Ingham, Global Brand Leader, W Hotels Worldwide. ""The next iteration of  What She Said  will once again offer a global platform for essential conversations to be heard, navigating the challenges and triumphs of work, love, play and everything in between. This is a defining time for gender equality, not just in the U.S., and our global presence gives us the opportunity to foster meaningful discussions in a safe space, rooted in the idea that change comes from a place of understanding and positivity.""",3,"28, 208, 101",gender equality,MAR - W Hotels Re-Ignites The What She Said Conversation - 23-Feb-18 - PRN.pdf
