who_wrote_the_piece,subject,relevant_text,paragraphs,words,keywords,path
IBM,,The lack of a consistent CSIRP is a persistent trend each year despite a key finding from IBM's  2017 Cost of a Data Breach Study. The cost of a data breach was nearly  $1 million lower on average when organizations were able to contain the breach in less than thirty days – highlighting the value and importance of having a strong CSIRP. | The General Data Protection Regulation (GDPR) takes effect in  May 2018 and will mandate that organizations have an incident response plan in place. 77 percent of respondents do not have an incident response plan that is applied consistently across the entire enterprise. Most countries surveyed do not report confidence in their ability to comply with GDPR.,2,"62, 56","data breach, General data protection regulation",IBM - IBM Study Responding to Cybersecurity Incidents Still a Major Challenge for Businesses - 14-Mar-18 - PRN.pdf
IBM,,"Overall, all security leaders today are under intense pressure, charged with protecting some of their firm's most valuable assets – money, customer data, intellectual property and brand.  Nearly two-thirds of Chief Information Security Executives (CISOs) surveyed say their senior executives are paying more attention to security today than they were two years ago, with a series of high-profile hacking and data breaches convincing them of the key role that security has to play in the modern enterprise. More than half of respondents cited mobile security as a primary technology concern over the next two years.  Nearly two- thirds of respondents expect information security spend to increase over the next two years and of those, 87 percent expect double-digit increases.",1,119,data breach,IBM - IBM Study Reveals Critical Shift in the Role of Chief Information Security Executives Globally - 03-May-12 - PRN.pdf
IBM,,"While security response planning is slowly improving, the vast majority of organizations surveyed (74%) are still reporting that their plans are either ad-hoc, applied inconsistently, or that they have no plans at all. This lack of planning can impact the cost of security incidents, as companies that have incident response teams and extensively test their incident response plans spend an average of $1.2 million less on data breaches than those who have both of these cost-saving factors in place.1 | 1 IBM Security and Ponemon Institute: 2019 Cost of a Data Breach Report",2,"79, 13",data breach,"IBM - IBM Study Security Response Planning on the Rise, But Containing Attacks Remains an Issue - 30-Jun-20 - PRN.pdf"
IBM,Conference Call Announcements,"IBM Study Shows Data Breach Costs on the Rise; Financial Impact Felt for Years   Tuesday, July 23, 2019 04:00:00 AM (GMT) | CAMBRIDGE, Mass., July 23, 2019 /PRNewswire/ -- IBM (NYSE: IBM) Security today announced the results of its annual study examining the financial impact of data breaches on organizations. According to the report, the cost of a data breach has risen 12% over the past 5 years1 and now costs  $3.92 million on average. These rising expenses are representative of the multiyear financial impact of breaches, increased regulation and the complex process of resolving criminal attacks.2 | The financial consequences of a data breach can be particularly acute for small and midsize businesses. In the study, companies with less than 500 employees suffered losses of more than $2.5 million on average – a potentially crippling amount for small businesses, which typically earn $50 million or less in annual revenue. | For the first time this year, the report also examined the longtail financial impact of a data breach, finding that the effects of a data breach are felt for years. While an average of 67% of data breach costs were realized within the first year after a breach, 22% accrued in the second year and another 11% accumulated more than two years after a breach. The longtail costs were higher in the second and third years for organizations in highly-regulated environments, such as healthcare, financial services, energy and pharmaceuticals. | ""Cybercrime represents big money for cybercriminals, and unfortunately that equates to significant losses for businesses,"" said Wendi Whitmore, Global Lead for IBM X-Force Incident Response and Intelligence Services. ""With organizations facing the loss or theft of over 11.7 billion records in the past 3 years alone, companies need to be aware of the full financial impact that a data breach can have on their bottom line –and focus on how they can reduce these costs."" | Sponsored by IBM Security and conducted by the Ponemon Institute, the annual Cost of a Data Breach Report is based on in-depth interviews with more than 500 companies around the world that suffered a breach over the past year.3 The analysis takes into account hundreds of cost factors including legal, regulatory and technical activities to loss of brand equity, customers, and employee productivity. Some of the top findings from this year's report include: | Malicious Breaches – Most Common, Most Expensive:  Over 50% of data breaches in the study resulted from malicious cyberattacks and cost companies $1 million more on average than those originating from accidental causes. ""Mega Breaches"" Lead to Mega Losses:  While less common, breaches of more than 1 million records cost companies a projected $42 million in losses; and those of 50 million records are | projected to cost companies $388 million. Practice Makes Perfect: Companies with an incident response team that also extensively tested their incident response plan experienced $1.23 million less in data breach costs on average than those that had neither measure in place. U.S. Breaches Cost Double: The average cost of a breach in the U.S. is  $8.19 million, more than double the worldwide average. Healthcare Breaches Cost the Most: For the 9th year in a row, healthcare organizations had the highest cost of a breach – nearly $6.5 million on average (over 60% more than other industries in the study). | Malicious Breaches Pose a Growing Threat; Accidental Breaches Still Common The study found that data breaches which originated from a malicious cyberattack were not only the most common root cause of a breach, but also the most expensive. | Malicious data breaches cost companies in the study  $4.45 million on average – over  $1 million more than those originating from accidental causes such as system glitch and human error. These breaches are a growing threat, as the percentage of malicious or criminal attacks as the root cause of data breaches in the report crept up from 42% to 51% over the past six years of the study (a 21% increase). | That said, inadvertent breaches from human error and system glitches were still the cause for nearly half (49%) of the data breaches in the report, costing companies $3.50 and $3.24 million respectively. These breaches from human and machine error represent an opportunity for improvement, which can be addressed through security awareness training for staff, technology investments, and testing services to identify accidental breaches early on. One particular area of concern is the misconfiguration of cloud servers, which contributed to the exposure of 990 million records in 2018, representing 43% of all lost records for the year according to the IBM X-Force Threat Intelligence Index5. | A focus on incident response can help reduce the time it takes companies to respond, and the study found that these measures also had a direct correlation with overall costs. Having an incident response team in place and extensive testing of incident response plans were two of the top three greatest cost saving factors examined in the study. Companies that had both of these measures in place had $1.23 million less total costs for a data breach on average than those that had neither measure in place ($3.51 million vs. $4.74 million). | Number of compromised records: Data breaches cost companies around  $150 per record that was lost or stolen. Companies that fully deployed security automation technologies experienced around half the cost of a breach ($2.65 million average) compared to those that did not have these technologies deployed ($5.16 million average). Extensive use of encryption was also a top cost saving factor, reducing the total cost of a breach | Regional and Industry  Trends The study also examined the cost of data breaches in different industries and regions, finding that data breaches in the U.S. are vastly more expensive – costing $8.19 million, or more than double the average for worldwide companies in the study. Costs for data breaches in the U.S. increased by 130% over the past 14 years of the study; up from $3.54 million in the 2006 study. | For the 9th year in a row, healthcare organizations in the study had the highest costs associated with data breaches. The average cost of a breach in the healthcare industry was nearly $6.5 million - over 60% higher than the cross-industry average. | Download Full Reports & Register for the Webinar Click here to view the full  2019 Cost of a Data Breach Report .   | An infographic with key findings from the report is available: Infographic - 2019 Cost of a Data Breach | 1 Comparison of the average global cost of a data breach from the 2014 Cost of a Data Breach Report to the 2019 report. 2 IBM analysis based on Cost of a Data Breach Report data. 3 The limitations of the report and methodologies employed can be found in the full Cost of a Data Breach Report.   4 Mega breach cost calculations are based on an analysis of 14 companies, applying a  Monte-Carlo analytic approach to simulate results of greater statistical significance.     5 IBM X-Force Threat Intelligence Index 2019 | data-breach-costs-on-the-rise-financial-impact-felt-for-years-300889090.html",19,"21, 75, 52, 89, 75, 73, 64, 99, 38, 71, 104, 92, 66, 71, 42, 22, 18, 89, 1","data breach, data-breach",IBM - IBM Study Shows Data Breach Costs on the Rise Financial Impact Felt for Years - 23-Jul-19 - PRN.pdf
IBM,New Products & Services,"Advanced threats are attacking organizations at an alarming and ever more costly rate. Data breaches caused by such threats have cost on average $9.4 million in brand equity alone per an IBM Trusteer- commissioned Ponemon study on Advanced Persistent Threats. The same study says targeted attacks are the greatest threat with only 31 percent of respondents believing adequate resources are available to prevent, detect and contain these threats. Organizations are faced with a myriad of point products that do not provide complete protection and also create manageability challenges. Java applications are particularly targeted and carry a high risk as a pervasive part of the corporate environment.  | The Trusteer Apex endpoint protection software blocks attempts by cyber criminals to exploit vulnerabilities on the endpoint that lead to data breaches. It provides an easy to deploy automated threat analysis capability to prevent attacks that is less burdensome than the many, disparate point solutions in the market. Since the product is easy to manage and maintain, it helps the Chief Security Officer and the IT Security team be more resourceful and effective.",2,"106, 73",data breach,IBM - IBM Tackles Advanced Malware with Expanded Endpoint Protection Software - 21-May-14 - PRN.pdf
IBM,New Products & Services,"Explanations are provided in easy to understand terms, showing which factors weighted the decision in one direction vs. another, the confidence in the recommendation, and the factors behind that confidence. Also, the records of the model's accuracy, performance and fairness, and the lineage of the AI systems, are easily traced and recalled for customer service, regulatory or compliance reasons – such as GDPR compliance.",1,64,GDPR compliance,IBM - IBM Takes Major Step in Breaking Open the Black Box of AI - 19-Sep-18 - PRN.pdf
IBM,New Products & Services,"""Building the world's most advanced stadium would not be possible without harnessing the best technology available – working with IBM has allowed us to do that,"" said Jared Miller, Chief Digital Officer and Senior Vice President, Analytics and Technology, AMBSE. ""Everything we're doing from a tech perspective is with an eye toward enhancing the 360-degree experience for our fans on game days. IBM's track record in that area is helping us accomplish that objective.""",1,74,Chief digital officer,IBM - IBM to Deliver Personalized Fan Experience Through the IBM Cloud at Atlanta's New Mercedes-Benz Stadium - 15-Aug-17 - PRN.pdf
IBM,New Products & Services,"""Machine learning is incredibly powerful, but many of today's data professionals lack the skills to fully exploit it for business and the ability to effectively collaborate on datasets,"" said Bob Picciano, Senior Vice President, IBM Analytics. ""Watson Data Platform applies cognitive assistance for creating machine learning models, making it far faster to get from data to insight. It also, provides one place to access machine learning services and languages, so that anyone, from an app developer to the Chief Data Officer, can collaborate seamlessly to make sense of data, ask better questions, and more effectively operationalize insight.""",1,97,chief data officer,IBM - IBM Unleashes the Power of Machine Learning with Watson-enabled Data Platform - 25-Oct-16 - PRN.pdf
IBM,New Products & Services,"Some of the IBM Dynamic Cloud Security portfolio's new offerings help secure user access to cloud services as organizations extend their data centers to public cloud environments. They can centralize the granting of correct privileges to users and provide extra security around users who have administrator access to sensitive data. These offerings can monitor and track access to applications with the right level of authentication controls, including multi-factor authentication. Another portfolio offering can also help developers build single-sign-on security into their applications using APIs.",1,84,Multi-factor authentication,IBM - IBM Unveils Industry's First Intelligent Cloud Security Portfolio for Global Businesses - 05-Nov-14 - PRN.pdf
IBM,Corporate Development,"IBM's global cloud footprint is especially critical as clients look to gain greater control of their data in the face of tightening data regulations, such as the European Union's new General Data Protection Regulation (GDPR).",1,35,General data protection regulation,"IBM - IBM Unveils Major Expansion of Cloud Capabilities Industry Leaders ExxonMobil, Bausch + Lomb and Westpac Shift to IBM Cloud - 11-Jun-18 - PRN.pdf"
IBM,New Products & Services,"IBM Multi-factor Authentication for z/OS (MFA) is now available on z/OS. The solution adds another layer of security by requiring privileged users to enter a second form of identification, such as a PIN or randomly generated token, to gain access to the system. This is the first time MFA has been tightly integrated in the operating system, rather than through an add-on software solution. This level of integration is expected to deliver more streamlined configuration and better stability and performance.",1,80,Multi-factor authentication,IBM - IBM Unveils New Mainframe for Encrypted Hybrid Clouds - 16-Feb-16 - PRN.pdf
IBM,New Products & Services,"The movement of data between partners and third parties is often the root cause of data breaches. In fact, 60 percent of businesses reported they suffered a data breach caused by a vendor or third party in 20181. With the growing adoption of hybrid multicloud environments, the importance of maintaining data security and privacy only grows more acute and challenging.",1,60,data breach,IBM - IBM Unveils z15 With Industry-First Data Privacy Capabilities - 12-Sep-19 - PRN.pdf
"IDC, Key Battles —and Strategies —for Dominance on the 3rd Platform  Mar 2014 Doc #",New Products & Services,"IBM's recently announced Watson Health Cloud platform is a prime example where a hybrid cloud environment is crucial for innovation. The Watson Health Cloud will help advance the quality and effectiveness of personal health care by allowing heath data to be anonymized, shared and combined with a dynamic and constantly growing aggregated view of clinical, research and social heath data.  The approach addresses patient privacy and data confidentiality, while providing a flexible platform for mining data for insights and innovation.",1,80,data confidentiality,IBM - IBM Watson Establishes Hybrid Cloud Capabilities To Accelerate New Insights For The Enterprise - 05-May-15 - PRN.pdf
IBM Corporation,New Products & Services,"Security professionals also said that the top benefit they expect to see from cognitive technologies is improved detection and incident response decision-making capabilities, which was indicated by 40 percent of respondents. Currently, the average data breach takes organizations an average of 201 days to identify and an average of 70 days to contain.2 Security professionals expect cognitive to play a big part in reducing this time by providing them with better data to make fast decisions. | 1 IBM Institute of Business Value Study: Cybersecurity in the Cognitive Era   2 IBM / Ponemon Cost of a Data Breach study, 2016",2,"76, 23",data breach,IBM - IBM Watson for Cyber Security Beta Program Launches with 40 Clients Globally - 06-Dec-16 - PRN.pdf
IBM,,"IBM X-Force Threat Intelligence Index comprises insights and observations from monitoring 70 billion security events per day in more than 130 countries. In addition, data is gathered and analyzed from multiple sources including X-Force IRIS, X-Force Red, IBM Managed Security Services, and publicly disclosed data breach information. IBM X-Force also runs thousands of spam traps around the world and monitors tens of millions of spam and phishing attacks daily while analyzing billions of web pages and images to detect fraudulent activity and brand abuse. | The report features data IBM collected between  January 1, 2018 and December 31, 2018, to deliver insightful information about the global threat landscape and inform security professionals about the threats most relevant to their organizations. To download a copy of the 2019 IBM X-Force Threat Index please visit: https://www.ibm.com/security/data-breach/threat-intelligence.",2,"84, 49","data breach, data-breach",IBM - IBM X-Force Report Ransomware Doesn't Pay in 2018 as Cybercriminals Turn to Cryptojacking for Profit - 26-Feb-19 - PRN.pdf
IBM,,"IBM X-Force conducted its analysis based on insights and observations from monitoring 70 billion security events per day in more than 130 countries. In addition, data is gathered and analyzed from multiple sources including X-Force IRIS, X-Force Red, IBM Managed Security Services, and publicly disclosed data breach information. IBM X-Force also runs thousands of spam traps around the world and monitors tens of millions of spam and phishing attacks daily while analyzing billions of web pages and images to detect fraudulent activity and brand abuse. | ""The amount of exposed records that we're seeing today means that cybercriminals are getting their hands on more keys to our homes and businesses. Attackers won't need to invest time to devise sophisticated ways into a business; they can deploy their attacks simply by using known entities, such as logging in with stolen credentials,"" said Wendi Whitmore, Vice President, IBM X-Force Threat Intelligence. ""Protection measures, such as multi-factor authentication and single sign-on, are important for the cyber resilience of organizations and the protection and privacy of user data.""",2,"85, 88","data breach, Multi-factor authentication",IBM - IBM X-Force Stolen Credentials and Vulnerabilities Weaponized Against Businesses in 2019 - 11-Feb-20 - PRN.pdf
IBM Security,,"IBM X-Force conducted its analysis based on insights and observations from monitoring 70 billion security events per day in more than 130 countries. In addition, data is gathered and analyzed from multiple sources including X-Force IRIS, X-Force Red, IBM Managed Security Services, and publicly disclosed data breach information. IBM X-Force also runs thousands of spam traps around the world and monitors tens of millions of spam and phishing attacks daily while analyzing billions of web pages and images to detect fraudulent activity and brand abuse. | ""The amount of exposed records that we're seeing today means that cybercriminals are getting their hands on more keys to our homes and businesses. Attackers won't need to invest time to devise sophisticated ways into a business; they can deploy their attacks simply by using known entities, such as logging in with stolen credentials,"" said Wendi Whitmore, Vice President, IBM X-Force Threat Intelligence. ""Protection measures, such as multi-factor authentication and single sign-on, are important for the cyber resilience of organizations and the protection and privacy of user data.""",2,"85, 88","data breach, Multi-factor authentication",IBM - IBM X-Force Stolen Credentials and Vulnerabilities Weaponized Against Businesses in 2019 - 18-Feb-20 - PRNA.pdf
IBM,,"IBM's Global Chief Data Officer to Discuss How Businesses Will ""Connect Everything"" in a Data- Driven World in a live Churchill Club Event  Wednesday, May 03, 2017 01:14:00 AM (GMT) | SAN FRANCISCO, May 2, 2017 /PRNewswire/ -- Tonight, IBM (NYSE: IBM) Global Chief Data Officer Inderpal Bhandari will join Anthony Scriffignano, Dun & Bradstreet Senior Vice President & Chief Data Scientist, in a Churchill Club discussion about ""Connecting Everything While Everything is in Motion"" in front of a sold out audience. | Who:   Inderpal Bhandari, Global Chief Data Officer, IBM  Anthony Scriffignano, Senior Vice President & Chief Data Scientist, Dun & Bradstreet | To view the original version on PR Newswire, visit: http://www.prnewswire.com/news-releases/ibms-global- chief-data-officer-to-discuss-how-businesses-will-connect-everything-in-a-data-driven-world-in-a-live-churchill- club-event-300450249.html",4,"30, 51, 20, 12","chief-data-officer, chief data officer",IBM - IBM's Global Chief Data Officer to Discuss How Businesses Will Connect Everything in a Data-Driven World in a live Churchill Club Event - 02-May-17 - PRN.pdf
,,,,,,IBM - International Business Machines Corp.(IBM-US) Schedules Investor Briefing for 7-March-2017 830 AM ET - 07-Mar-17 - FCSTEV.pdf
,,,,,,IBM - International Business Machines Corp.(IBM-US) Schedules Investor Meeting for 14-June-2018 1100 AM ET - 07-Jun-18 - FCSTEV.pdf
,,,,,,IBM - International Business Machines Corp.(IBM-US) Schedules Investor Meeting for 28-February-2013 1045 AM ET - 28-Feb-13 - FCSTEV.pdf
,,,,,,IBM - International Business Machines Corp.(IBM-US) Schedules Q2 2017 Earnings Call for 18-July-2017 500 PM ET - 04-Jul-17 - FCSTEV.pdf
,,,,,,IBM - International Business Machines Corp.(IBM-US) Schedules Q3 2017 Earnings Call for 17-October-2017 500 PM ET - 10-Oct-17 - FCSTEV.pdf
,,,,,,IBM - International Business Machines Corp.(IBM-US) Schedules UBS Global TMT Conference for 9-December-2019 330 PM ET - 06-Dec-19 - FCSTEV.pdf
,,,,,,IBM - International Business Machines Corp.(IBM-US) Schedules Wells Fargo Event Information & Logistics Tech Summit for 5-December-2017 100 P... - 22-Nov-17 - FCSTEV.pdf
IBM,Legal Issues,"""Global businesses today face significant challenges in protecting personal data and keeping up with regulations in an environment where cross-border flows of information are more important than ever,"" said Christina Peters , chief privacy officer, IBM. ""Our new invention provides a privacy technique that could help businesses navigate an increasingly complex landscape and help companies proactively manage risk.""",1,58,Chief Privacy Officer,IBM - Made in IBM Labs Protecting Personal Data in the Cloud - 19-Nov-14 - PRN.pdf
IBM,,"""As a global integrator of container logistics with the ambition to digitize global trade, we are excited about this cooperation and its potential to bring substantial efficiency and productivity gains to global supply chains, while decreasing fraud and increasing security,"" said Ibrahim Gokcen, chief digital officer, Maersk. ""The projects we are doing with IBM aim at exploring a disruptive technology such as blockchain to solve real customer problems and create new innovative business models for the entire industry. We expect the solutions we are working on will not only reduce the cost of goods for consumers, but also make global trade more accessible to a much larger number of players from both emerging and developed countries.""",1,116,Chief digital officer,IBM - Maersk and IBM Unveil First Industry-Wide Cross-Border Supply Chain Solution on Blockchain - 05-Mar-17 - PRN.pdf
IBM,New Products & Services,"said Stephanie Trunzo, COO and Chief Digital Officer at PointSource LLC, a mobile strategy company. ""Design Thinking has been especially effective at helping our clients transform their customer engagement experience – before we start building mobile apps.""",1,37,Chief digital officer,IBM - MEDIA ALERT IBM Launches Bluemix Garage Method to Speed Cloud Development - 31-Mar-16 - PRN.pdf
"The State Of Customer Experience Management, 2013, Forrester Research, Inc.,  March 22, 2013",New Products & Services,"In order to meet these rising demands, CMOs, CHROs and other executives are joining forces with the emergence of the Chief Digital Officer to create comprehensive digital strategies across all lines of the business including marketing, product development, customer service, human resources and more. Businesses that are seeing the benefit of this digital transformation include Performance Bicycle, Amadori and Omron Europe.",1,61,Chief digital officer,IBM - New IBM Software Helps Companies Reinvent Relationships with Exceptional Digital Experiences - 24-Jul-13 - PRN.pdf
