who_wrote_the_piece,subject,relevant_text,paragraphs,words,keywords,path
IBM,New Products & Services,"The average corporate IT infrastructure is cyber-attacked nearly 60,000 times every day(4) and the average total organizational cost of a data breach is $5.5 million,(5)  making security one of the top priorities of enterprise organizations. To enhance data security and regulatory compliance, IBM PowerSC security and compliance software along with Trusted Surveyor has been updated and now provides real-time security alerts and delivers improved compliance reporting. | (1) IBM lab testing showed clients have a denser compute node with 20 to 30 percent per core performance improvement and the new POWER7+ processors deliver improved application performance. Expectations are as much as 40 percent improvement with Java based workloads and as much as 30 percent with traditional OLTP and ERP environments compared to POWER7. (2) IBM, ""IBM System Storage DS8870 Performance Whitepaper,"" October 2012. (3) IBM lab testing showed Live Partition Mobility performance improvements will enable clients to migrate a single partition up to 3 times faster and concurrently migrate partitions up to 4.7 times faster than previous releases of PowerVM. Actual results will vary depending on network capacity, partition size, workload and number of VIOS servers. (4) IBM Managed Security Services, 2010. Based on IBM X-Force Data and Analysis. (5) Ponemon Institute, ""2011 Cost of Data Breach Study:  United States,"" March 2012. (6) Storage Performance Council, ""SPC Benchmark 2™ Full Disclosure Report IBM Corporation, IBM System Storage DS8870,"" October 2012. For more on the SPC ranking please visit: http://www.storageperformance.org/results/benchmark_results_spc2#b00062 (7) Based on mathematical calculations of moving data to IBM DB2 Analytics Accelerator V3.",2,"66, 186",data breach,"IBM - IBM Boosts Security, Cloud and Analytics Capabilities With New Power Systems, Storage and Mainframe Technologies - 03-Oct-12 - PRN.pdf"
IBM,"Corporate Social Responsibility, Human Interest Groups","Co., Ltd., Japan 20.  Sara Hines, Director of Provider Experience & Connectivity,  Humana, USA 21.  Seema Gaur,  Executive VP & Head IT, IFFCO Tokio General Insurance Company, India 22.  Elenita Elinon, Executive Director Quantitative Research,  JP Morgan Chase & Company, USA 23.  Kelly Combs, Director, Emerging Technology Risk, KPMG LLP, USA 24.  Hye-young Kim, Director of Artificial Intelligence,  LOTTE Shopping, South Korea 25.  Carmen Suarez, Assistant Director, Miami-Dade County, Florida, USA 26.  Yimei Guo, Managing Director, Global Head of Research Technology, Morgan Stanley, USA 27.  Gail Blum, Manager, Talent Acquisition Operations,  NBCUniversal, USA  28.  Sandra Cascadden, Associate Deputy Minister/CIO, Government of Nova Scotia , Canada 29.  Pat Maqetuka,  Chief Data Architecture & Operations Officer,  Nedbank, South Africa 30.  Severine Marquay, AI experience, digital support & innovation,  Orange France, France 31.  Rachel Cordrey, Pharmacy Supervisor, Peninsula Regional Medical Center, USA 32.  MaryAnn Fleming, Head of Services, Home Buying and Ownership, RBS, UK 33.  Erin Oles, Senior Director, R+F Virtual Live,  Rodan + Fields, USA 34.  Carolyn Staats, Director of Innovation, Information Systems Department,  Sonoma County,  USA 35.  Jennifer Edgin, CTO, Deputy Commandant Information, U.S. Marine Corps, USA 36.  Lee Hatton, CEO, UBank, Australia 37.  Tanja Richter, Director, Consumer Products and Services,  Vodafone, UK  38.  Laura Bellamy , Director, Information Experience, VMWare, USA  39.  Yu Ching Lan, Department Manager, Walsin Lihwa Corp.,  Taiwan 40.  Shelley Kalms, Chief Digital Officer, Woodside Energy, Australia",1,230,Chief digital officer,IBM - IBM Celebrates Women Business Pioneers In Artificial Intelligence - 11-Jun-19 - PRN.pdf
IBM,,"IBM Chief Digital Officer, Bob Lord To Keynote At The Chief Digital Officer Summit In New York City   Monday, May 22, 2017 09:30:00 PM (GMT) | NEW YORK , May 22, 2017 /PRNewswire/ -- CDO Summit – IBM (NYSE: IBM) Chief Digital Officer, Bob Lord, will give the opening keynote at the Chief Digital Officer Summit in  New York City  at 9:00 a.m. EDT on Wednesday, May 24. | Chief Digital Officer NYC Summit Opening Keynote | Where:   Chief Digital Officer NYC Summit | Bob Lord, Chief Digital Officer at IBM | To view the original version on PR Newswire, visit: http://www.prnewswire.com/news-releases/ibm-chief- digital-officer-bob-lord-to-keynote-at-the-chief-digital-officer-summit-in-new-york-city-300461741.html",6,"25, 42, 7, 6, 7, 11","Chief-digital-officer, Chief digital officer","IBM - IBM Chief Digital Officer, Bob Lord To Keynote At The Chief Digital Officer Summit In New York City - 22-May-17 - PRN.pdf"
IBM,New Products & Services,1.   Verizon 2013 Data Breach Investigations Report,1,7,data breach,"IBM - IBM Delivers Disaster Recovery, Security Services to SoftLayer Clients - 14-Apr-14 - PRN.pdf"
IBM,,"""IBM has helped to create an innovative technology architecture solution for our Atlanta United soccer franchise,"" says Jared Miller, chief digital officer, AMB Sports and Entertainment. ""We are proud to have them as our partners for both our Children's Healthcare of Atlanta Training Ground as well as Mercedes- Benz Stadium.""",1,50,Chief digital officer,IBM - IBM Elevates Team Experience at Children's Healthcare of Atlanta Training Ground Home of Atlanta United Football Club - 21-Sep-17 - PRN.pdf
IBM,Corporate Development,"London, England: The two new cloud data centers that opened in  London, England, bring IBM's footprint to five data centers in the country. One additional data center is set to launch this year to keep pace with growing client demand. The new facilities are part of the investment IBM announced in 2016 to triple the company's cloud data center capacity in the UK and reinforces its commitment to the country where clients are continuing to move to the cloud to transform their business operations. To help clients as they prepare for implementation of the General Data Protection Regulations (GDPR), IBM's cloud data centers are designed to be state of the art in terms of privacy and security, providing greater flexibility, transparency and control.",1,123,General data protection regulation,IBM - IBM Expands Global Cloud Data Center Presence with Four New Facilities - 19-Jul-17 - PRN.pdf
IBM Corporation,,"With mobile adoption on the rise, and expected to surpass the human population, data regulations and requirements create complex business scenarios.  For example, requirements for handling mobile data vary by country and region, sometimes creating complex governance scenarios for corporate data moving across borders including the processing of personal data for remote access and storage. One recent example is the new General Data Protection Regulation (GDPR) adopted by the European Union which is expected to be applicable as of May 2018.",1,81,General data protection regulation,IBM - IBM Expands Global Footprint for Mobile Security and Management via the Cloud - 14-Sep-16 - PRN.pdf
IBM,New Products & Services,"""We are always looking for new ways to gain a more holistic view of our clients' campaign data, and design tailored approaches for each ad and marketing tactic,"" said Michael Kaushansky, Chief Data Officer at Havas, a global advertising and marketing consultancy. ""The Watson Data Platform is helping us do just that by quickly connecting offline and online marketing data. For example, we recently kicked off a test for one of our automotive clients, aiming to connect customer data, advertising information in existing systems, and online engagement metrics to better target the right audiences at the right time.""",1,98,chief data officer,IBM - IBM Expands Watson Data Platform to Help Unleash AI for Professionals - 02-Nov-17 - PRN.pdf
IBM,,"The evolving threat and technology landscape has created widely-known challenges with traditional log-in methods that rely heavily on passwords and personal information to authenticate our identities online. In 2017, data breaches exposed personal information, passwords, and even social security numbers for millions of consumers. Additionally, the average internet user in America is managing over 150 online accounts that require a password, which is expected to rise to over 300 accounts in coming years. 5 | ""In the wake of countless data breaches of highly sensitive personal data, there's no longer any doubt that the very information we've used to prove our identities online in the past is now a shared secret in the hands of hackers,"" said Limor Kessem, Executive Security Advisor, IBM Security. ""As consumers are acknowledging the inadequacy of passwords and placing increased priority on security, the time is ripe to adopt more advanced methods that prove identity on multiple levels and can be adapted based on behavior and risk.""",2,"74, 87",data breach,IBM - IBM Future of Identity Study Millennials Poised to Disrupt Authentication Landscape - 29-Jan-18 - PRN.pdf
IBM,,"""Nedbank has a long tradition of using analytics on internal, structured data,"" Patricia Maqetuka, Chief Data Officer, Nedbank Ltd. ""More data is available now than has ever been available before and analytical tooling has undergone rapid evolution in order to keep up. Nedbank has embarked on a journey to start leveraging both internal and external data, creating new data driven business models and new sources of revenue. Thanks to the first IBM Analytics University Live we were exposed to the guidance and counsel of IBM's Elite team. This team helped us to unlock new paradigms about how we think about our analytics and change the way we look at use cases to unlock business value.""",1,115,chief data officer,"IBM - IBM Helps Accelerate AI with Fast New Data Platform, Elite Team - 16-Mar-18 - PRN.pdf"
IBM,Human Interest Groups,"In addition to ranking the most trusted companies, the Ponemon study reported that only 41 percent of consumers feel they have control over their personal information, down from 45 last year and an overall drop from 56 percent in 2006.  The survey also noted that identity theft is a top area of concern among consumers with fifty-nine percent of the respondents indicating that fear of identity theft was a major factor in brand trust diminishment, while 50 percent said notice of a data breach was a factor. | ""IBM is honored to be recognized by consumers as a company that can be trusted to protect the security and privacy of their personal information,"" said Christina Peters , chief privacy officer at IBM. ""As individuals embrace advances in technology and social media, they are increasingly concerned with exposing and sharing their sensitive information. IBMers around the world are committed to developing and applying new techniques and best practices that protect privacy while enabling organizations to derive insight and value from their data."" | IBM has pioneered many privacy advancements, including being the first company to adopt a global privacy code of conduct; first to adopt a genetic non-discrimination policy; and first major corporation to appoint a Chief Privacy Officer. IBM has long been a leading supporter of balanced commercial privacy policy frameworks that enable organizations to analyze and share information responsibly.",3,"87, 83, 58","data breach, Chief Privacy Officer",IBM - IBM Honored Among Most Trusted Companies for Privacy According to Consumer Survey - 28-Jan-13 - PRN.pdf
IBM Corporation,,"A new Ponemon Institute study on Cyber Resilience, sponsored by IBM and also  announced today, found 75 percent of IT and security professionals surveyed say their organization does not have a modern incident response plan applied across the entire enterprise. This lack of planning and coordination can make it difficult to respond quickly and contain the costs of an incident. For example, in 2018, companies in the UK must report data breaches to regulators within 72 hours or face fines up to 4 percent of their global annual turnover.",1,89,data breach,IBM - IBM Invests $200M to Help Clients Respond to Cybersecurity Incidents - 16-Nov-16 - PRN.pdf
IBM,"New Products & Services, Small Business Services","""As a founder of security and privacy solutions addressing the cost and complexity of complying with regulatory requirements such as the EU's new General Data Protection Regulation, the guidance and support that IBM provided us in bringing DataPassports to market was invaluable in accelerating the development and delivery of our blockchain based services,"" said Kevin Ellison, CEO, Schedule1.",1,58,General data protection regulation,IBM - IBM Launches Accelerator Program to Kickstart Blockchain Adoption for Enterprises - 18-May-17 - PRN.pdf
IBM,,"As blockchain grows in influence and organizations begin to evaluate cloud-based production environments for their first blockchain projects, they are exploring ways to maximize the security and compliance of the technology for business-critical applications. The average total cost of a data breach for enterprises reached $4 million last year, and with security incidents up by 64 percent in 2015, the risks are higher than ever.2 Security is critical – not just within the blockchain itself but with all the technology touching the ledger. | 2 Based on ""2016 Ponemon Cost of Data Breach Study """,2,"83, 11",data breach,IBM - IBM Launches Cloud Services for Blockchain on Industry's Most Secure Server - 14-Jul-16 - PRN.pdf
IBM,New Products & Services,"IBM is partnering with more than 1,000 universities across the globe to develop curriculum that reflects the mix of business, technical and problem-solving skills necessary to prepare students for Big Data and analytics careers, across all industries. The goal: prepare students for jobs ranging from front-line analytics contributors to leadership roles such as Chief Data Officers. Through these collaborations, which span a variety of majors from business to health services, IBM provides schools with access to IBM Big Data and analytics software, curriculum materials, case study projects, IBM data scientists who visit classes as guest lecturers, and faculty grants that fuel new curriculum.",1,103,chief data officer,IBM - IBM Launches Talent Assessment to Help Aspiring Data Crunchers and Academia Gauge and Enhance Skills - 12-Nov-13 - PRN.pdf
IBM,New Products & Services,"""At IBM, we harness the power of technologies like AI, blockchain, IoT and cloud to address some of the biggest opportunities and challenges in business,"" said Bob Lord, IBM chief digital officer. ""Now, with Call for Code, we are calling on all developers to join us and use these same leading edge technologies to help people, their communities and society.""",1,60,Chief digital officer,"IBM - IBM Leads 'Call for Code' to Use Cloud, Data, AI, Blockchain for Natural Disaster Relief - 24-May-18 - PRN.pdf"
"""Pervasive Encryption: A New Paradigm for Protection,""  K. R. E. Lind, Chief Systems",New Products & Services,"-- Addresses global data breach epidemic; helps automate compliance for EU General Data Protection Regulation, Federal Reserve and other emerging regulations | IBM Z's new data encryption capabilities are designed to address the global epidemic of data breaches, a major factor in the $8 trillion cybercrime impact on the global economy by 2022. Of the more than nine billion data records lost or stolen since 2013, only four percent were encrypted, making the vast majority of such data vulnerable to organized cybercrime rings, state actors and employees misusing access to sensitive information. | Technology Breakthrough:  Industry-First Pervasive Encryption for the Cloud Era A recent  study found that extensive use of encryption is a top factor in reducing the business impact and cost of a data breach. To put that in context, the IBM X-Force Threat Intelligence Index reported that more than four billion records were leaked in 2016 (a 556 percent increase from 2015).  | Designed for Tough New Data Protection Regulations  The IBM Z also helps clients build trust with consumers and comply with new standards such as the EU's General Data Protection Regulation (GDPR) that will increase data protection requirements for organizations doing business in Europe starting next year. GDPR will require organizations to report data breaches to the",4,"21, 70, 61, 56",data breach,IBM - IBM Mainframe Ushers in New Era of Data Protection - 17-Jul-17 - PRN.pdf
IBM,New Products & Services,"built into them: today's apps require more than static IDs and passwords. aPersona is an app security start- up providing multi-factor authentication to websites, e-commerce, cloud portals, utility networks and more. Deploying their products onto Bluemix in just two days, aPersona's developers were able to quickly create multiple development and test environments, and built a tokenless, invisible authentication solution which scales and supports apps of all sizes.",1,67,Multi-factor authentication,"IBM - IBM Makes it Easier for Clients to Develop Software in the Cloud with Bluemix, DevOps - 02-Jun-14 - PRN.pdf"
IBM,,"institutions from deploying a cloud-based infrastructure, encryption capabilities offset the concerns that come with relinquishing data control in light of the high data breach response and notification costs. | key enabler for banks looking to simplify and accelerate the discovery of actionable insights. 4.  Access management. Improved user experience via multi-factor authentication and enhanced",2,"28, 25","data breach, Multi-factor authentication",IBM - IBM Names Top Security Elements for Hybrid Cloud Adoption in Banks - 10-May-17 - PRN.pdf
IBM,Corporate Development,"The key areas of focus for the IBM X-Force Command Center in  Poland are supporting clients in responding to cybersecurity incidents and serving as the hub in the company's global network for GDPR expertise and specialized services. Through the center, IBM will be able to offer clients the option of managing their security data via IBM staff and infrastructure in Europe. IBM X-Force analysts and experts will also help clients with expedited incident response reporting, which could aid clients with the data breach notification requirement of the GDPR. | According to the 2017 IBM X-Force Threat Intelligence Index, which surveys cyber security trends, 2016 saw a dramatic increase in records compromised, from 600 million to more than 4 billion  incidents of illegally acquired records, climbing 566% from 2015.  Analysts warn that the problem will be exacerbated, as the number of incidents within the next 5 years is expected to double. These statistics expose the companies to hefty potential losses, with the average total cost of a data breach amounting to $4 million.1 | 1 https://www.ibm.com/security/infographics/data-breach/",3,"88, 83, 2","data breach, data-breach",IBM - IBM Opens European X-Force Command Center in Poland - 19-Jun-17 - PRN.pdf
IBM,"Corporate Social Responsibility, Public Safety","""IBMers are committed to helping educate people on ways to safely and securely use the Internet,"" said Harriet Pearson, IBM Security Counsel and Chief Privacy Officer. ""The resources we are donating will help teachers and parents raise awareness that most Internet-based threats to individual and computer security can significantly be reduced by actions that informed users take themselves.""",1,58,Chief Privacy Officer,"IBM - IBM Releases Free Internet Security Training Tools to Educate Students, Teachers and Parents on Digital Responsibility - 07-Feb-12 - PRN.pdf"
"comScore MMX, December 2012, Worldwide 15+",New Products & Services,"""Identity Mixer enables users to choose precisely which data to share, and with whom,"" said  Christina Peters, IBM's Chief Privacy Officer. ""Now web service providers can improve their risk profile and enhance trust with customers, and it's all in the cloud, making it easy for developers to program.""",1,48,Chief Privacy Officer,IBM - IBM Research Announces Cloud Breakthrough For Protecting Personal Data - 28-Jan-15 - PRN.pdf
"Gartner, ""Forecast: Information Security, Worldwide, 2016-2022, 2Q18 Update,"" Aug 2018",New Products & Services,"Historically, cybersecurity teams have been focused on detection and protection against cybersecurity incidents. However, as the threat landscape has evolved, organizations are now recognizing the need to plan and rehearse their response to security incidents as well. The 2018 Cost of a Data Breach Study 1 found that companies that are able to respond to incidents effectively and remediate the event within 30 days can save over $1 million on the total cost of a data breach – yet less than 25% of professionals  surveyed say their company has a coordinated incident response plan applied across the organization. | 1 2018 Cost of as Data Breach Study, sponsored by IBM and conducted by Ponemon Institute 2 Source: Gartner, ""Forecast: Information Security, Worldwide, 2016-2022, 2Q18 Update,"" Aug 2018 3 Global Information Security Workforce Study 2017, ISC2 / Frost & Sullivan",2,"98, 40",data breach,IBM - IBM Rolls Out Industry's First Cybersecurity Operations Center on Wheels - 15-Oct-18 - PRN.pdf
IBM,,"Session: GDPR & Personal Data Stewardship: Implications on the Future of Self-Sovereign Identity When: Thursday, May 11, 2017 at 3:30pm   Speaker: Dr. Sridhar Muppidi, IBM Fellow and CTO for IAM, IBM Security",1,32,Data Stewardship,IBM - IBM Security Executives to Present at KuppingerCole European Identity & Cloud Conference - 06-May-17 - PRN.pdf
IBM,,"Who owns Security in the Cloud?  A survey from IBM Institute for Business Value found that responding organizations that relied heavily on cloud providers to own security in the cloud, despite the fact that configuration issues – which are typically users' responsibility – were most often to blame for data breaches (accounting for more than 85% of all breached records in 2019 for surveyed organizations).4 | The survey from IBM Institute for Business Value found that responding organizations who ranked high maturity in both Cloud and Security evolution were able to identify and contain data breaches faster than colleagues who were still in early phases of their cloud adoption journey. In terms of data breach response time, the most mature organizations surveyed were able to identify and contain data breaches twice as fast as the least mature organizations (average threat lifecycle of 125 days vs. 250 days).",2,"65, 81",data breach,IBM - IBM Security in the Cloud Remains Challenged by Complexity and Shadow IT - 10-Jun-20 - PRN.pdf
