who_wrote_the_piece,subject,relevant_text,paragraphs,words,keywords,path
,,,,,,"0011C0 - The Men's Wearhouse, Inc.(0011C0-E) Schedules Q1 2015 Earnings Call for 11-June-2015 900 AM ET - 18-May-15 - FCSTTS.pdf"
,"Conjecture, Media Summaries, Barron's Summary, Published Reports","International Trader (Europe):  Positive on Hapag-Lloyd (HLAG.GR), as the container shipping industry appears to be enjoying its best conditions in nearly a decade. Global trade volume is up 4.3% this year, even as protectionism re-emerges as a threat. The 2016 bankruptcy filing of Hanjin Shipping took vessels off the market and sparked more consolidation and alliances. Hapag-Lloyd's relatively low valuation and strong fleet make it a promising way to play the revival. International Trader (Asia):  Positive on Tencent Holdings (700.HK), whose shares have climbed 125% this year to become the world's fifth-largest listed company. Shares could continue to surge as long as the company can continue to deliver on earnings and widen its moat, with its growing financial-technology business leading the way. Morningstar analyst Chelsey Tam has a current price target of $62.99, or 18% upside after Friday's comeback. Current Yield:  Emerging market bonds have had an impressive recovery after selling off after the U.S. presidential election. The selloff was driven by fears of inflation, rising rates, and a more isolationist trade policy. Markets have shrugged off these concerns, and the trend could continue into 2018, helped by improving global growth, benign inflation, and central banks that continue to suppress interest rates. The Striking Price:  Shares of Cboe Global Markets (CBOE) and CME Group (CME) set 52- week highs last week, likely reflecting expectations that the launch of Bitcoin futures will be lucrative for the exchanges. Barron's is concerned over the decision to pursure Bitcoin futures, as it may not be in the interest of the derivatives market. Until it is known if Bitcoin futures will be segregated at clearing firms to protect the stability of the markets, Barron's doesn't recommend Cboe or CME as anything but momentum trades. Commodities Corner: A cold spell in December could lift winter wheat prices higher than $5 a bushel, up more than a dollar from recent prices. A rally would aid the ailing farm economy, which has been hurt by steadily falling wheat prices since 2012. Fertilizer makers Mosaic (MOS) and Agrium (AGU) are two ways to wager such a move. Insider Transactions:  A list of recent purchases and sales of U.S. companies made by insiders. Up And Down Wall Street:  Janet Yellen last week expressed concern that inflation might continue to fall short of the Fed's 2% target. But a new leading indicator of inflation shows prices rising at nearly a 3% yearly pace, which raises the question: is Yellen concerned about prices that consumers pay, or does she fear a slide in inflated asset prices resulting from the Fed's tightening policy? The Fed faces a conundrum, as it must weigh rising inflation pressures against the risk posed by high -- and arguably inflated -- asset prices. Streetwise: Last week, +UBER said it had suffered a data breach resulting in the theft of information of about 57 million customers; worse yet, the company sat on the information for a year, and paid a $100k ransom for the hackers to hide the breach. Uber has a history of playing by its own set of private rules, free from the onus of public company disclosures. If a private company as large as Uber is serious about transparency and honesty, it should choose to report like a public company. Technology Trader:  Cloud technology is rapidly evolving in a way that could either cement or erode the oligarchy of Amazon (AMZN), Microsoft (MSFT),  and Alphabet (GOOGL). A new way of writing software called ""serverless software"" makes it easier for programmers to use cloud computing generally, which is good for these companies; but it can also weaken a programmer's loyalty to any one cloud, which could weaken the grip of the oligarchs. The three leaders are trailed by IBM (IBM) and Oracle (ORCL). Speaking of Dividends:  Tax inversions enable a U.S. corporation to acquire a foreign company and then reincorporate overseas. A recent bill that made it out of the Senate Finance Committee would tax the dividends of inverted companies at a much higher rate than currently. Among U.S. companies that have done inversions are Medtronic (MDT), Eaton (ETN), Allergan (AGN), Johnson Controls International (JCI), Mylan (MYL), and Endo International (ENDP).",1,694,data breach,"002508, 005930, 1088... - Barron's Summary - 25-Nov-17 - SA.pdf"
Datacastle,Licensing & Marketing Agreements,"Datacastle protects enterprises from mobile data loss and data breach with simplified and scalable hybrid cloud endpoint backup and data protection. Datacastle RED provides secure and auditable access to enterprise data on critical devices, anytime, anywhere. Datacastle RED is available through a global network of partners. To learn more about Datacastle RED, visit http://www.datacastlered.com, follow on Twitter @Datacastle, or call 425.996.9684.",1,61,data breach,"00BDMF, IBM - Datacastle Brings Enterprise Endpoint Backup to the IBM Cloud Platform - 28-Apr-14 - PRN.pdf"
,Corporate Development,"SEATTLE, June 25, 2013 /PRNewswire/ -- Datacastle®, a market leader for protecting enterprises from endpoint data loss and data breaches, today announced that its flagship product, Datacastle RED is now certified for the IBM SmartCloud and available worldwide through the IBM Partner Network . | Datacastle protects enterprises from mobile data loss and data breach with simplified and scalable endpoint backup and data protection. Datacastle RED provides secure and auditable access to enterprise data on critical devices, anytime, anywhere. Profiled in Gartner's Hype Cycle for Storage Technologies, 2012 , published July 5, 2012, Pushan Rinnen, Dave Russell et al. Datacastle RED is available through a global network of partners. To learn more about Datacastle RED, visit http://www.datacastlered.com, follow on Twitter @Datacastle, or call 425.996.9684.",2,"44, 79",data breach,"00BDMF, IBM - Datacastle brings enterprise-grade endpoint data protection to the IBM SmartCloud - 25-Jun-13 - PRNE.pdf"
Syncsort,Merger/Acquisition,"Townsend Security creates data privacy solutions that help organizations meet evolving compliance requirements and mitigate the risk of data breaches and cyber-attacks. Over 3,000 companies worldwide trust Townsend Security’s NIST and FIPS 140-2 compliant solutions to meet the encryption and key management requirements in PCI DSS, GDPR, HIPAA/HITECH, and other regulatory compliance requirements. Learn more at www.townsendsecurity.com.",1,57,data breach,"0652TD, IBM - Syncsort Advances Security Strategy with Acquisition of Townsend Security's IBM i Data Privacy Products - 21-May-18 - BW.pdf"
IBM,"Acquisitions, Mergers & Takeovers","About Trusteer Trusteer is a leading provider of endpoint cybercrime prevention solutions that help protect organizations against financial losses and data breaches. Hundreds of organizations and millions of end users rely on Trusteer to protect managed and unmanaged endpoints against exploitation and compromise by online threats often invisible to legacy security solutions. Trusteer was founded in 2006 by Mickey Boodaei, Rakesh Loonkar, Amit Klein, Shmulik Regev, and Eldan Ben-Haim and is backed by U.S. Venture Partners and Shlomo Kramer.",1,79,data breach,"07FW5S, IBM - IBM to Acquire Trusteer to Help Companies Combat Financial Fraud and Advanced Security Threats - 15-Aug-13 - PRN.pdf"
JPMorgan Chase,Product/Service,"“Data security is a great concern for retailers. Safetech Encryption will ultimately help protect merchants and their customers from the increasing risks associated with global fraud and data breaches at the point of sale,” said Sam Jawad, president, Chase Paymentech Canada. “Our ultimate vision is to protect every single transaction originating from Chase Paymentech point-of-sale devices.”",1,56,data breach,"081PDJ, JPM, V... - Chase Paymentech Helps Protect Merchants and Consumers from Payment Card Fraud and Data Theft - 26-Oct-11 - BW.pdf"
IBM,"Acquisitions, Mergers & Takeovers","The challenges of data access have been exacerbated by the digital world where companies are struggling to protect company information, including employee and customer identity, as they are stored beyond the traditional enterprise. Rather than managing a single point of entry to this information, businesses must now be able to verify who is accessing their systems, data and network, and whether they are entitled to do so, from multiple points including cloud and mobile devices. In this new era, identity and access management has become the first line of defense from potential data breaches.",1,94,data breach,"0C6MF9, 064TTG, IBM - IBM Acquires Cloud Security Services Provider Lighthouse Security Group - 11-Aug-14 - PRN.pdf"
IBM,New Products & Services,"Building Essential Skills for the Cognitive Era The explosion of data-driven content has sparked a new wave of career opportunities for today's college students, from business analytics professionals to Chief Data Officers. Today's announcement from the IBM Watson Group extends the conversation about data-driven skills to highlight the need for professionals with expertise in fields such as natural language processing, machine learning and content lifecycle management. These skills are the building blocks for a new class of cognitive apps and services that deliver fast, evidence-based advice, by combing though millions of pages of data within seconds for discoveries that fuel smarter decisions and unleash creativity.",1,105,chief data officer,"0DNZ2B, IBM - Seven of the Nation's Leading Technology Institutions Unveil Cognitive Computing Courses Leveraging IBM Watson - 07-May-14 - PRN.pdf"
Tailored Brands & WHP Global,"Photo/Multimedia, Merger/Acquisition","This press release contains forward-looking information, including the Company’s statements regarding its plans to apply the proceeds of the sale towards debt repayment and to close the transaction by the end of March. In addition, words such as “expects,” “anticipates,” “envisions,” “targets,” “goals,” “projects,” “intends,” “plans,” “believes,” “seeks,” “estimates,” “guidance,” “may,” “projections,” and “business outlook,” variations of such words and similar expressions are intended to identify such forward-looking statements. The forward-looking statements are made pursuant to the Safe Harbor provisions of the Private Securities Litigation Reform Act of 1995. Any forward-looking statements that we make herein are not guarantees of future performance and actual results may differ materially from those in such forward-looking statements as a result of various factors. Factors that might cause or contribute to such differences include, but are not limited to: actions or inactions by governmental entities; domestic and international macro-economic conditions; inflation or deflation; the loss of, or changes in, key personnel; success, or lack thereof, in formulating or executing our internal strategies and operating plans including new store and new market expansion plans; cost reduction initiatives and revenue enhancement strategies; changes to our capital allocation policy; changes in demand for our retail clothing or rental products; market trends in the retail or rental business; customer confidence and spending patterns; changes in traffic trends in our stores; customer acceptance of our merchandise strategies, including custom clothing; performance issues with key suppliers; disruptions in our supply chain; severe weather; foreign currency fluctuations; government export and import policies, including the enactment of duties or tariffs; advertising or marketing activities of competitors; the impact of cybersecurity threats or data breaches; legal proceedings and the impact of climate change.",1,280,data breach,"0L8861, TLRD - Tailored Brands to Sell the Joseph Abboud Trademarks to WHP Global for $115 Million - 17-Jan-20 - BW.pdf"
,"Articles, Reports, Conjecture, Media Summaries, Other Regulatory, Published Reports, Regulatory","In a front-page article, the WSJ observes that the General Data Protection Regulation has affected hundreds of thousands of companies, far beyond the Facebook/Google tech giants that have gotten the headlines. Privacy lawyers and consultants tell the WSJ that many companies simply aren't ready; the chief compliance officer for First Solar tells the WSJ that the company underestimated what the law would require of it. Allianz's chief privacy officer tells the WSJ that complying, which has cost the company tens of millions of euros, has been a ""mammoth task;"" Accor's data-protection officer tells the WSJ that listing how the company gathers and processes information will be a ""never-ending process."" A US airline executive, who appointed himself chief data-protection officer, since the law requires one, tells the WSJ that the focus has been on inventorying the personal data for frequent fliers; it's not clear if he's referring to his airline specifically or speaking on behalf of all American airlines. The co-founder of a reservation and guest-information service tells the WSJ that the requirements of the law have surprised some smaller US restaurants, who have information on European tourists who visit and the restaurants therefore need to manage their data as they are tech companies. Editor's note: Though this article seems set to appear in the 25-May print edition of the WSJ, it was published online at 05:30 ET 24-May.",1,228,Chief Privacy Officer,"AAL, AC, ALGT... - Ready or not, GDPR takes effect 25-May - WSJ - 24-May-18 - SA.pdf"
,"Conjecture, Media Summaries, Barron's Summary, Published Reports","International Trader (Europe):  The increasing frequency of data breaches, along with the EU’s soon-to-hit General Data Protection Regulation, should boost demand for Beazley (BEZ.LN), which insures companies in the event of cyberattacks; The company's valuation does not",1,37,data breach,"AAPL, ABBV, AMZN... - Barron's Summary - 03-Feb-18 - SA.pdf"
Alcon Inc. Investors,"Webcast, Conference Call, Earnings, Dividend","Forward-looking statements are neither historical facts nor assurances of future performance. Instead, they are based only on Alcon’s current beliefs, expectations and assumptions regarding the future of its business, future plans and strategies, and other future conditions. Because forward-looking statements relate to the future, they are subject to inherent uncertainties and risks that are difficult to predict. Such forward-looking statements are subject to various risks and uncertainties facing Alcon, including: the commercial success of its products and its ability to maintain and strengthen its position in its markets; the success of its research and development efforts, including its ability to innovate to compete effectively; its success in completing and integrating strategic acquisitions; pricing pressure from changes in third party payor coverage and reimbursement methodologies; global economic, financial, legal, tax, political, and social change; the ability to obtain regulatory clearance and approval of its products as well as compliance with any post-approval obligations, including quality control of its manufacturing; ongoing industry consolidation; its ability to properly educate and train healthcare providers on its products; changes in inventory levels or buying patterns of its customers; its reliance on sole or limited sources of supply; ability to service its debt obligations; the need for additional financing through the issuance of debt or equity; its reliance on outsourcing key business functions; its ability to protect its intellectual property; the impact on unauthorized importation of its products from countries with lower prices to countries with higher prices; the effects of litigation, including product liability lawsuits; its ability to comply with all laws to which it may be subject; effect of product recalls or voluntary market withdrawals; data breaches; the implementation of its enterprise resource planning system; its ability to attract and retain qualified personnel; the accuracy of its accounting estimates and assumptions, including pension plan obligations and the carrying value of intangible assets; legislative and regulatory reform; the ability of Alcon Pharmaceuticals Ltd. to comply with its investment tax incentive agreement with the Swiss State Secretariat for Economic Affairs in Switzerland and the Canton of Fribourg, Switzerland; its ability to operate as a stand-alone company; whether the transitional services Novartis has agreed to provide Alcon are sufficient; the impact of being listed on two stock exchanges; the ability to declare and pay dividends; the different rights afforded to its shareholders as a Swiss corporation compared to a US corporation; and the effect of maintaining or losing its foreign private issuer status under US securities laws. Additional factors are discussed in Alcon’s filings with the United States Securities and Exchange Commission, including its Form 20-F. Should one or more of these uncertainties or risks materialize, or should underlying assumptions prove incorrect, actual results may vary materially from those anticipated. Therefore, you should not rely on any of these forward-looking statements.",1,464,data breach,"ACL, NWL, ALC... - Alcon Reports Full Year 2019 Results - 25-Feb-20 - BW.pdf"
,Directors and Officers,,,,,"AEO, EXPE, JBLU... - RLHC Appoints Two New Independent Board Members - 22-Mar-17 - PMZ.pdf"
IBM,"Contracts, Small Business Services","""IBM will take our groundbreaking collaboration with Indiegogo to a whole new level, helping us reach more entrepreneurs and get their innovative products to market quickly and cost-effectively,"" said Arrow's Chief Digital Officer Matt Anderson. ""As one of the world's largest providers of electronic and IT products and services in the world, Arrow has the breadth of resources and depth of expertise to successfully shepherd promising entrepreneurs along their path to market. Arrow engineers around the world are eager to collaborate with Indiegogo entrepreneurs on cutting-edge tech designs that incorporate the best that IBM's Watson IoT and cloud services have to offer.""",1,102,Chief digital officer,"ARW, IBM - IBM, Indiegogo and Arrow Electronics Partner to Fuel the Next Generation of Internet of Things Startups - 16-Feb-17 - PRN.pdf"
,"Media Summaries, Economist Summary","On 28-Sep, Facebook (FB) announced that an attack on its systems had exposed the personal information of 50M users -- the biggest data breach in the company's history. The company notified European regulators of the breach in order to comply with the | General Data Protection Regulation (GDPR), the EU's new privacy law. For the first time in a major case, regulators will have to determine whether Facebook did this within 72 hours of an attack being discovered, and whether the firm had done enough to avoid the breach. European regulators have already targeted Facebook for how it obtains and uses personal data, meaning the social network is likely to face more constraints.",2,"42, 70","data breach, General data protection regulation","BMW, CAG, FB... - StreetAccount Summary The Economist print edition - 04-Oct-18 - SA.pdf"
IBM,,"Rometty also established IBM as the industry's leading voice in technology ethics and data stewardship, working relentlessly to usher new technologies safely into society, and enabling people of diverse backgrounds and education levels to participate in the digital future.  She has been committed to building talent and skills around the world.  She created thousands of New Collar jobs and championed the reinvention of education around the world, including the explosive growth of the six-year Pathways in Technology Early College High Schools, or P-TECHs, which are helping prepare the workforce of the future, serving hundreds of thousands of students in 200 schools and 24 countries. | ""Ginni has provided outstanding leadership for IBM, substantially transforming the company and ushering in a new cloud and cognitive era,"" said Michael Eskew, Lead Director of the IBM Board of Directors.  ""She has taken bold strategic actions to reposition IBM for the future, shedding businesses and growing new units organically and through acquisition, all while achieving record diversity and employee engagement and setting the industry standard for responsible technology ethics and data stewardship.""",2,"104, 73",Data Stewardship,IBM - Arvind Krishna Elected IBM Chief Executive Officer - 30-Jan-20 - PRN.pdf
"Gemalto's Breach Level Index, http://breachlevelindex.com/",,"Related resources Images IBM Mainframe Ushers in New Era of Data Protection July 17, 2017: The IBM Z mainframe is a breakthrough in data protection technology designed to tackle the epidemic of data breaches. IBM hardware engineer Rhonda Sundlof  (top) and senior engineer  Karl Casserly test the IBM Z which is manufactured In Poughkeepsie, NY. (Photo Credit: Connie Zhou for IBM) Infographic: Why the data protection paradigm is broken and how to fix it IBM Z - pervasive encryption, all the time. (Credit: IBM) | By using a platform capable of encrypting 100 percent of the data, CAIXA will be able to offer an unprecedented level of data security and compliance to its more than 80 million customers - inside and outside of Brazil. In addition, IBM Z is an essential component to ensure CAIXA is compliant with the rules of the European Data Protection Act, known as General Data Protection Regulation (GDPR).",2,"84, 68","data breach, General data protection regulation",IBM - CAIXA Commits to IBM Z Following Unprecedented Growth - 01-Nov-18 - PRN.pdf
IBM,Licensing & Marketing Agreements,"""Catalina is immersed in data, managing and extracting insights via data science from ever increasing volumes,"" said Seth Dobrin, Vice President and Chief Data Officer, IBM Analytics. ""And its work with the IIAS is a great example of how the system can help streamline their analytics work today, and easily scale to support future growth.""",1,55,chief data officer,IBM - Catalina Taps IBM Analytics to Aid in Digital Transformation - 17-Dec-18 - PRN.pdf
CULedger,"Contract/Agreement, Product/Service","Credit union members worldwide will also have access to a CULedger issued digital credential, called MyCUID that adheres to the privacy-by-design requirements of self-sovereign identity supported by the Sovrin Foundation. MyCUID will help credit unions support shared financial services which allows members to conduct transactions among any credit union on the network.",1,52,privacy-by-design,IBM - CULedger and IBM Announce Collaboration to Deliver Blockchain Services for Financial Cooperatives and Credit Unions Worldwide - 11-Mar-19 - BW.pdf
IBM,Licensing & Marketing Agreements,"""Our collaboration with Apple and IBM is an important building block in our digital transformation,"" says  Katri Harra-Salonen, Chief Digital Officer, Finnair. ""We want to link our employees with the insights they need to make better decisions. This collaboration enables a user focused, high quality, yet cost effective way of developing digital solutions, helping us to improve the way we operate as an airline.""",1,64,Chief digital officer,IBM - Finnair Adopts iOS Enterprise Apps from IBM to Accelerate Digital Transformation - 30-Nov-16 - PRN.pdf
IBM,Contracts,"""With IBM Watson Health, we will be leveraging progress made under the initial liver collaboration for the purposes of this second project dedicated to prostate cancer, with the same aim of delivering augmented intelligence to help radiologists and oncologists. This partnership is in line with Guerbet's commitment to developing ambitious medical solutions to speed up diagnosis, improve the patient experience, and reduce clinical risks and costs,"" said François Nicolas, Chief Digital Officer for Guerbet.",1,74,Chief digital officer,IBM - Guerbet and IBM Watson Health announce a second co-development project as part of their strategic partnership for leveraging artificial int... - 24-Sep-19 - PRN.pdf
IBM and Hu-manity.co,"Contract/Agreement, Photo/Multimedia","""IBM has long been focused on providing data stewardship which supports our belief that your data is your data,"" said Bridget van Kralingen, senior vice president, IBM Global Industries, Platforms and Blockchain. “With new digital business models driving data sharing to unprecedented levels, we believe that blockchain can serve as a key ingredient to enhance trust and responsibility with regard to data. Our work with Hu- manity.co is a pioneering example of how permissioned blockchain can help balance individual rights with distributed data access at scale.”",1,86,Data Stewardship,IBM - Hu-manity.co Collaborates with IBM Blockchain on Consumer App to Manage Personal Data Property Rights - 06-Sep-18 - BW.pdf
