who_wrote_the_piece,subject,relevant_text,paragraphs,words,keywords,path
The Clorox Company,"Conference Call Announcements, Earnings, Dividends & Forecasts","dependence on key customers and risks related to customer consolidation and ordering patterns; risks related to the company's use of and reliance on information technology systems, including potential security breaches, cyber-attacks, privacy breaches or data breaches that result in the unauthorized disclosure of consumer, customer, employee or company information, or service interruptions; the company's ability to maintain its business reputation and the reputation of its brands and products; risks relating to acquisitions, new ventures and divestitures, and associated costs, including the potential for asset impairment charges related to, among others, intangible assets and goodwill; and the ability to complete announced transactions and, if completed, integration costs and potential contingent liabilities related to those transactions; lower revenue, increased costs or reputational harm resulting from government actions and regulations; the ability of the company to successfully manage global, political, legal, tax and regulatory risks, including changes in regulatory or administrative activity; worldwide, regional and local economic and financial market conditions; risks related to international operations and international trade, including foreign currency fluctuations, such as devaluations, and foreign currency exchange rate controls, including periodic changes in such controls; changes in U.S. immigration or trade policies, including the imposition of new or additional tariffs; labor claims and labor unrest; inflationary pressures, particularly in Argentina; political instability and the uncertainty regarding the outcome of Brexit; government-imposed price controls or other regulations; potential negative impact and liabilities from the use, storage and transportation of chlorine in certain international markets where chlorine is used in the production of bleach; and the possibility of nationalization, expropriation of assets or other government action; the ability of the company to innovate and to develop and introduce commercially successful products, or expand into adjacent categories and countries; the impact of product liability claims, labor claims and other legal or tax proceedings, including in foreign jurisdictions; the ability of the company to implement and generate cost savings and efficiencies; the success of the company's business strategies; risks related to additional increases in the estimated fair value of The Procter & Gamble Company's interest in the Glad® business; the company's ability to attract and retain key personnel; supply disruptions and other risks inherent in reliance on a limited base of suppliers; environmental matters, including costs associated with the remediation and monitoring of past contamination, and possible increases in costs resulting from actions by relevant regulators, and the handling and/or transportation of hazardous substances; increased focus by governmental and non- governmental organizations, customers, consumers and investors on sustainability issues, including those related to climate change; the facilities of the company and its suppliers being subject to disruption by events beyond the company's control, including work stoppages, cyber-attacks, natural disasters and terrorism; the company's ability to maximize, assert and defend its intellectual property rights; any infringement or claimed infringement by the company of third-party intellectual property rights; the accuracy of the company's estimates and assumptions on which its financial projections are based; the effect of the company's indebtedness and credit rating on its business operations and financial results; the company's ability to pay and declare dividends or repurchase its stock in the future; uncertainties relating to tax positions, tax disputes and changes in the company's tax rate, and any additional effects of the Tax Cuts and Jobs Act on the company; the company's ability to maintain an effective system of internal controls; the impacts of potential stockholder activism; and risks related to the company's discontinuation of operations in Venezuela.",1,574,data breach,"CLX - Clorox Reports Q2 Fiscal Year 2020 Results, Updates Fiscal Year Outlook - 04-Feb-20 - PRN.pdf"
The Clorox Company,"Earnings, Dividends & Forecasts","This press release contains ""forward-looking statements"" within the meaning of Section 27A of the Securities Act of 1933, as amended, and Section 21E of the Securities Exchange Act of 1934, as amended, and such forward-looking statements involve risks and uncertainties. Except for historical information, statements about future volumes, sales, foreign currencies, costs, cost savings, margins, earnings, earnings per share, diluted earnings per share, foreign currency exchange rates, cash flows, plans, objectives, expectations, growth, or profitability are forward-looking statements based on management's estimates, beliefs, assumptions and projections. Words such as ""could,"" ""may,"" ""expects,"" ""anticipates,"" ""targets,"" ""goals,"" ""projects,"" ""intends,"" ""plans,"" ""believes,"" ""seeks,"" ""estimates,"" ""predicts"" and variations on such words, and similar expressions that reflect our current views with respect to future events and operational, economic and financial performance, are intended to identify such forward-looking statements. These forward-looking statements are only predictions, subject to risks and uncertainties, and actual results could differ materially from those discussed. Important factors that could affect performance and cause results to differ materially from management's expectations are described in the sections entitled ""Risk Factors"" and ""Management's Discussion and Analysis of Financial Condition and Results of Operations"" in the company's Annual Report on Form 10-K for the fiscal year ended June 30, 2016, as updated from time to time in the company's SEC filings. These factors include, but are not limited to: intense competition in the company's markets; worldwide, regional and local economic conditions and financial market volatility; the ability of the company to drive sales growth, increase prices and market share, grow its product categories and achieve favorable product and geographic mix; volatility and increases in commodity costs such as resin, sodium hypochlorite and agricultural commodities, and increases in energy, transportation or other costs; dependence on key customers and risks related to customer consolidation and ordering patterns; risks related to reliance on information technology systems, including potential security breaches, cyber-attacks, privacy breaches or data breaches that result in the unauthorized disclosure of consumer, customer, employee or company information, or service interruptions; lower revenue or increased costs resulting from government actions and regulations, including with respect to the Aplicare business, despite the write down of Aplicare assets in the second quarter ended December 31, 2016; the ability of the company to successfully manage global, political, legal, tax and regulatory risks, including changes in regulatory or administrative activity; risks related to international operations, including political instability; government- imposed price controls or other regulations; foreign currency exchange rate controls, including periodic changes in such controls, fluctuations and devaluations; labor claims, labor unrest and inflationary pressures, particularly in Argentina; potential harm and liabilities from the use, storage and transportation of chlorine in certain international markets where chlorine is used in the production of bleach; and the possibility of nationalization, expropriation of assets or other government action in foreign jurisdictions; risks relating to acquisitions, new ventures and divestitures, and associated costs, including the potential for asset impairment charges related to, among others, intangible assets and goodwill; the ability of the company to develop and introduce commercially successful products; supply disruptions and other risks inherent in reliance on a limited base of suppliers; the impact of product liability claims, labor claims and other legal proceedings, including in foreign jurisdictions; the success of the company's business strategies; the ability of the company to implement and generate anticipated cost savings and efficiencies; the company's ability to attract and retain key personnel; the company's ability to maintain its business reputation and the reputation of its brands; environmental matters, including costs associated with the remediation and monitoring of past contamination, and possible increases in those costs resulting from actions by relevant regulators, and the handling and/or transportation of hazardous substances; the impact of natural disasters, terrorism and other events beyond the company's control; the company's ability to maximize, assert and defend its intellectual property rights; any infringement or claimed infringement by the company of third-party intellectual property rights; risks related to the potential increase in the company's purchase price for The Procter & Gamble Company's (P&G) interest in the Glad® business and the impact from the decision on whether or not to extend the term of the related agreement with P&G; the effect of the company's indebtedness and credit rating on its business operations and financial results; risks related to the company's discontinuation of operations in Venezuela; the company's ability to pay and declare dividends or repurchase its stock in the future; the company's ability to maintain an effective system of internal controls, including after completing acquisitions; uncertainties relating to tax positions, tax disputes and changes in the company's tax rate; the accuracy of the company's estimates and assumptions on which its financial projections are based; and the impacts of potential stockholder activism.",1,785,data breach,CLX - Clorox Reports Q3 Fiscal Year 2017 Results Updates Fiscal Year 2017 Outlook - 03-May-17 - PRN.pdf
The Clorox Company,"Earnings, Dividends & Forecasts","This press release contains ""forward-looking statements"" within the meaning of Section 27A of the Securities Act of 1933, as amended, and Section 21E of the Securities Exchange Act of 1934, as amended, and such forward-looking statements involve risks and uncertainties. Except for historical information, statements about future volumes, sales, foreign currencies, costs, cost savings, margins, earnings, earnings per share, including as a result of the Nutranext acquisition, diluted earnings per share, foreign currency exchange rates, tax rates, cash flows, plans, objectives, expectations, growth or profitability are forward-looking statements based on management's estimates, beliefs, assumptions and projections. Words such as ""could,"" ""may,"" ""expects,"" ""anticipates,"" ""targets,"" ""goals,"" ""projects,"" ""intends,"" ""plans,"" ""believes,"" ""seeks,"" ""estimates,"" ""predicts,"" and variations on such words, and similar expressions that reflect our current views with respect to future events and operational, economic and financial performance are intended to identify such forward-looking statements. These forward-looking statements are only predictions, subject to risks and uncertainties, and actual results could differ materially from those discussed. Important factors that could affect performance and cause results to differ materially from management's expectations are described in the sections entitled ""Risk Factors"" and ""Management's Discussion and Analysis of Financial Condition and Results of Operations"" in the Company's Annual Report on Form 10-K for the fiscal year ended June 30, 2017, as updated from time to time in the Company's Securities and Exchange Commission filings, including the Company's Quarterly Report on Form 10-Q for the fiscal quarter ended December 31, 2017. These factors include, but are not limited to: intense competition in the Company's markets; volatility and increases in commodity costs such as resin, sodium hypochlorite and agricultural commodities, and increases in energy, transportation or other costs; the ability of the Company to drive sales growth, increase prices and market share, grow its product categories and manage favorable product and geographic mix; dependence on key customers and risks related to customer consolidation and ordering patterns; the impact of increases in sales of consumer products through alternative retail channels; risks related to reliance on information technology systems, including potential security breaches, cyber-attacks, privacy breaches or data breaches that result in the unauthorized disclosure of consumer, customer, employee or Company information, or service interruptions; lower revenue or increased costs resulting from government actions and regulations; the ability of the Company to successfully manage global political, legal, tax and regulatory risks, including changes in regulatory or administrative activity and as a result of the Nutranext acquisition; risks relating to acquisitions, new ventures and divestitures, and associated costs, including the potential for asset impairment charges related to, among others, intangible assets and goodwill; and the ability to complete announced transactions and, if completed, integration costs and potential contingent liabilities related to those transactions, including those related to the Nutranext acquisition; worldwide, regional and local economic and financial market conditions; risks related to international operations and international trade, including political instability; government-imposed price controls or other regulations; foreign currency exchange rate controls, including periodic changes in such controls, fluctuations and devaluations; changes in trade, tax or U.S. immigration policies, labor claims, labor unrest and inflationary pressures, particularly in Argentina; potential negative impact and liabilities from the use, storage and transportation of chlorine in certain international markets where chlorine is used in the production of bleach; and the possibility of nationalization, expropriation of assets or other government action; the ability of the Company to innovate and to develop and introduce commercially successful products; the ability of the Company to implement and generate cost savings and efficiencies; the success of the Company's business strategies; the Company's ability to maintain its business reputation and the reputation of its brands; risks related to the effects of the Tax Cuts and Jobs Act (Tax Act) on the Company as the Company continues to assess and analyze such effects as well as its current interpretation, assumptions and expectations relating to the Tax Act, and the possibility that the final impact of the Tax Act on the Company may be materially different from the Company's current estimates based on the Company's actual results for future periods, the Company's further assessment and analysis of the Tax Act, any additional Congressional, administrative and FASB",1,693,data breach,"CLX - Clorox Reports Q3 Fiscal Year 2018 Results, Updates Fiscal Year 2018 Outlook - 02-May-18 - PRN.pdf"
The Clorox Company,"Earnings, Dividends & Forecasts","pandemic, and the related responses of governments, consumers, customers, suppliers, employees and the company, on our business, operations, employees, financial condition and results of operations, and any such forward-looking statements, whether concerning the COVID-19 pandemic or otherwise, involve risks, assumptions and uncertainties. Except for historical information, statements about future volumes, sales, organic sales growth, foreign currencies, costs, cost savings, margins, earnings, earnings per share, diluted earnings per share, foreign currency exchange rates, tax rates, cash flows, plans, objectives, expectations, growth or profitability are forward-looking statements based on management's estimates, beliefs, assumptions and projections. Words such as ""could,"" ""may,"" ""expects,"" ""anticipates,"" ""targets,"" ""goals,"" ""projects,"" ""intends,"" ""plans,"" ""believes,"" ""seeks,"" ""estimates,"" ""will,"" ""predicts,"" and variations on such words, and similar expressions that reflect our current views with respect to future events and operational, economic and financial performance are intended to identify such forward-looking statements. These forward- looking statements are only predictions, subject to risks and uncertainties, and actual results could differ materially from those discussed. Important factors that could affect performance and cause results to differ materially from management's expectations, or could affect the company's ability to achieve its strategic goals, are described in the sections entitled ""Risk Factors"" and ""Management's Discussion and Analysis of Financial Condition and Results of Operations"" in the company's Annual Report on Form 10-K for the fiscal year ended June 30, 2019, as updated from time to time in the company's Securities and Exchange Commission filings. These factors include, but are not limited to, the uncertainties relating to the impact of COVID-19 on the company's business, operations, employees, financial condition and results of operations as well as: intense competition in the company's markets; the impact of the changing retail environment, including the growth of alternative retail channels and business models, and changing consumer preferences; volatility and increases in commodity costs such as resin, sodium hypochlorite and agricultural commodities, and increases in energy, transportation or other costs; the ability of the company to drive sales growth, increase prices and market share, grow its product categories and manage favorable product and geographic mix; dependence on key customers and risks related to customer consolidation and ordering patterns; risks related to the company's use of and reliance on information technology systems, including potential security breaches, cyber-attacks, privacy breaches or data breaches that result in the unauthorized disclosure of consumer, customer, employee or company information, or service interruptions; the company's ability to maintain its business reputation and the reputation of its brands and products; the impact of COVID-19 on the availability of, and efficiency of the supply, manufacturing and distribution systems for, the company's products, including any disruption to such systems; long-term changes in consumer preference or demand for our products as a result of any shortages or lack of availability of any products in the near-term; risks relating to acquisitions, new ventures and divestitures, and associated costs, including the potential for asset impairment charges related to, among others, intangible assets and goodwill; and the ability to complete announced transactions and, if completed, integration costs and potential contingent liabilities related to those transactions; lower revenue, increased costs or reputational harm resulting from government actions and regulations; the ability of the company to successfully manage global political, legal, tax and regulatory risks, including changes in regulatory or administrative activity; uncertain worldwide, regional and local economic and financial market conditions, including as a result of fear of exposure to or actual impacts of a widespread disease outbreak, such as COVID-19; risks related to international operations and international trade, including foreign currency fluctuations, such as devaluations, and foreign currency exchange rate controls, including periodic changes in such controls; changes in U.S. immigration or trade policies, including the imposition of new or additional tariffs; labor claims and labor unrest; inflationary pressures, particularly in Argentina; political instability and the uncertainty regarding the outcome of Brexit; government-imposed price controls or other regulations; potential negative impact and liabilities from the use, storage and transportation of chlorine in certain international markets where chlorine is used in the production of bleach; widespread health emergencies, such as COVID-19; and the possibility of nationalization, expropriation of assets or other government action; the ability of the company to innovate and to develop and introduce commercially successful products, or expand into adjacent categories and countries; the impact of product liability claims, labor claims and other legal or tax proceedings, including in foreign jurisdictions; the ability of the company to implement and generate cost savings and efficiencies; the success of the company's business strategies; risks related to additional increases in the estimated fair value of The Procter & Gamble Company's interest in the Glad® business; the company's ability to attract and retain key personnel; supply disruptions, including as a result of COVID-19 and governments' responses thereto, and other risks inherent in reliance on a limited base of suppliers; environmental matters, including costs associated with the remediation and monitoring of past contamination, and possible increases in costs resulting from actions by relevant regulators, and the handling and/or transportation of hazardous substances; increased focus by governmental and non-governmental organizations, customers, consumers and investors on sustainability issues, including those related to climate change; the facilities of the",1,857,data breach,"CLX - Clorox Reports Q3 Fiscal Year 2020 Results, Updates Fiscal Year Outlook - 01-May-20 - PRN.pdf"
The Clorox Company,"Earnings, Dividends & Forecasts","This press release contains ""forward-looking statements"" within the meaning of Section 27A of the Securities Act of 1933, as amended, and Section 21E of the Securities Exchange Act of 1934, as amended, and such forward-looking statements involve risks and uncertainties. Except for historical information, statements about future volumes, sales, foreign currencies, costs, cost savings, margins, earnings, earnings per share, diluted earnings per share, foreign currency exchange rates, cash flows, plans, objectives, expectations, growth, or profitability are forward-looking statements based on management's estimates, beliefs, assumptions and projections. Words such as ""could,"" ""may,"" ""expects,"" ""anticipates,"" ""targets,"" ""goals,"" ""projects,"" ""intends,"" ""plans,"" ""believes,"" ""seeks,"" ""estimates,"" ""predicts"" and variations on such words, and similar expressions that reflect our current views with respect to future events and operational, economic and financial performance, are intended to identify such forward-looking statements. These forward-looking statements are only predictions, subject to risks and uncertainties, and actual results could differ materially from those discussed. Important factors that could affect performance and cause results to differ materially from management's expectations are described in the sections entitled ""Risk Factors"" and ""Management's Discussion and Analysis of Financial Condition and Results of Operations"" in the company's Annual Report on Form 10-K for the fiscal year ended June 30, 2016, as updated from time to time in the company's SEC filings. These factors include, but are not limited to: intense competition in the company's markets; worldwide, regional and local economic conditions and financial market volatility; the ability of the company to drive sales growth, increase prices and market share, grow its product categories and achieve favorable product and geographic mix; volatility and increases in commodity costs such as resin, sodium hypochlorite and agricultural commodities, and increases in energy, transportation or other costs; dependence on key customers and risks related to customer consolidation and ordering patterns; risks related to reliance on information technology systems, including potential security breaches, cyber-attacks, privacy breaches or data breaches that result in the unauthorized disclosure of consumer, customer, employee or company information, or service interruptions; lower revenue or increased costs resulting from government actions and regulations, including with respect to the Aplicare business, despite the write down of Aplicare assets in the second quarter ended December 31, 2016; the ability of the company to successfully manage global, political, legal, tax and regulatory risks, including changes in regulatory or administrative activity; risks related to international operations, including political instability; government- imposed price controls or other regulations; foreign currency exchange rate controls, including periodic",1,410,data breach,CLX - Clorox Reports Q4 and Fiscal Year 2017 Results Provides Fiscal Year 2018 Outlook - 03-Aug-17 - PRN.pdf
