who_wrote_the_piece,subject,relevant_text,paragraphs,words,keywords,path
The Clorox Company,"Accounting Issues, Earnings, Dividends & Forecasts","similar expressions that reflect our current views with respect to future events and operational, economic and financial performance, are intended to identify such forward-looking statements. These forward-looking statements are only predictions, subject to risks and uncertainties, and actual results could differ materially from those discussed. Important factors that could affect performance and cause results to differ materially from management's expectations are described in the sections entitled ""Risk Factors"" and ""Management's Discussion and Analysis of Financial Condition and Results of Operations"" in the Company's Annual Report on Form 10-K for the fiscal year ended June 30, 2017, as updated from time to time in the Company's SEC filings. These factors include, but are not limited to: intense competition in the Company's markets; volatility and increases in commodity costs such as resin, sodium hypochlorite and agricultural commodities, and increases in energy, transportation or other costs; the ability of the Company to drive sales growth, increase price and market share, grow its product categories and manage favorable product and geographic mix; dependence on key customers and risks related to customer consolidation and ordering patterns; the impact of increase in sales of consumer products through alternative retail channels; risks related to reliance on information technology systems, including potential security breaches, cyber-attacks, privacy breaches or data breaches that result in the unauthorized disclosure of consumer, customer, employee or Company information, or service interruptions; lower revenue or increased costs resulting from government actions and regulations; the ability of the Company to successfully manage global political, legal, tax and regulatory risks, including changes in regulatory or administrative activity; risks relating to acquisitions, new ventures and divestitures, and associated costs, including the potential for asset impairment charges related to, among others, intangible assets and goodwill; worldwide, regional and local economic and financial market conditions; risks related to international operations and international trade, including political instability; government-imposed price controls or other regulations; foreign currency exchange rate controls, including periodic changes in such controls, fluctuations and devaluations; changes in trade, tax or U.S. immigration policies, labor claims, labor unrest and inflationary pressures, particularly in Argentina; potential negative impact and liabilities from the use, storage and transportation of chlorine in certain international markets where chlorine is used in the production of bleach; and the possibility of nationalization, expropriation of assets or other government action; the ability of the Company to innovate and to develop and introduce commercially successful products; the ability of the Company to implement and generate cost savings and efficiencies; the success of the Company's business strategies; the Company's ability to maintain its business reputation and the reputation of its brands; risks related to the potential increase in the Company's purchase price for The Procter & Gamble Company's (P&G) interest in the Glad® business and the impact from the decision on whether or not to extend the term of the related agreement with P&G; supply disruptions and other risks inherent in reliance on a limited base of suppliers; the impact of product liability claims, labor claims and other legal or tax proceedings, including in foreign jurisdictions; the Company's ability to attract and retain key personnel; environmental matters, including costs associated with the remediation and monitoring of past contamination, and possible increases in costs resulting from actions by relevant regulators, and the handling and/or transportation of hazardous substances; the impact of natural disasters, terrorism and other events beyond the Company's control; the Company's ability to maximize, assert and defend its intellectual property rights; any infringement or claimed infringement by the Company of third-party intellectual property rights; the effect of the Company's indebtedness and credit rating on its business operations and financial results; the Company's ability to pay and declare dividends or repurchase its stock in the future; the Company's ability to maintain an effective system of internal controls; uncertainties relating to tax positions, tax disputes and changes in the Company's tax rate; the accuracy of the Company's estimates and assumptions on which its financial projections are based; risks related to the Company's discontinuation of operations in Venezuela; and the impacts of potential stockholder activism.",1,674,data breach,CLX - Clorox Releases 2017 Integrated Annual Report - 25-Sep-17 - PRN.pdf
The Clorox Company,"Economic News, Trends & Analysis","This press release contains ""forward-looking statements"" within the meaning of Section 27A of the Securities Act of 1933, as amended, and Section 21E of the Securities Exchange Act of 1934, as amended, and such forward-looking statements involve risks and uncertainties. Except for historical information, statements about future volumes, sales, foreign currencies, costs, cost savings, margins, earnings, earnings per share, including as a result of the Nutranext acquisition, diluted earnings per share, foreign currency exchange rates, tax rates, cash flows, plans, objectives, expectations, growth or profitability are forward-looking statements based on management's estimates, beliefs, assumptions and projections. Words such as ""could,"" ""may,"" ""expects,"" ""anticipates,"" ""targets,"" ""goals,"" ""projects,"" ""intends,"" ""plans,"" ""believes,"" ""seeks,"" ""estimates,"" ""predicts,"" and variations on such words, and similar expressions that reflect our current views with respect to future events and operational, economic and financial performance are intended to identify such forward-looking statements. These forward-looking statements are only predictions, subject to risks and uncertainties, and actual results could differ materially from those discussed. Important factors that could affect performance and cause results to differ materially from management's expectations are described in the sections entitled ""Risk Factors"" and ""Management's Discussion and Analysis of Financial Condition and Results of Operations"" in the Company's Annual Report on Form 10-K for the fiscal year ended June 30, 2018, as updated from time to time in the Company's Securities and Exchange Commission filings. These factors include, but are not limited to: intense competition in the Company's markets; the impact of the changing retail environment, including the growth of e-commerce retailers, hard discounters and other alternative retail channels; volatility and increases in commodity costs such as resin, sodium hypochlorite and agricultural commodities, and increases in energy, transportation or other costs; the ability of the Company to drive sales growth, increase price and market share, grow its product categories and manage favorable product and geographic mix; dependence on key customers and risks related to customer consolidation and ordering patterns; risks related to reliance on information technology systems, including potential security breaches, cyber-attacks, privacy breaches or data breaches that result in the unauthorized disclosure of consumer, customer, employee or Company information, or service interruptions; the Company's ability to maintain its business reputation and the reputation of its brands; risks relating to acquisitions, new ventures and divestitures, and associated costs, including the potential for asset impairment charges related to, among others, intangible assets and goodwill; and the ability to complete announced transactions and, if completed, integration costs and potential contingent liabilities related to those transactions, including those related to the Nutranext acquisition; lower revenue or increased costs resulting from government actions and regulations; the ability of the Company to successfully manage global political, legal, tax and regulatory risks, including changes in regulatory or administrative activity and as a result of the Nutranext acquisition; worldwide, regional and local economic and financial market conditions; risks related to international operations and international trade, including political instability; government- imposed price controls or other regulations; foreign currency fluctuations, including devaluations, and foreign currency exchange rate controls, including periodic changes in such controls; changes in U.S. immigration or trade policies, including tariffs, labor claims, labor unrest and inflationary pressures, particularly in Argentina; potential negative impact and liabilities from the use, storage and transportation of chlorine in certain international markets where chlorine is used in the production of bleach; and the possibility of nationalization, expropriation of assets or other government action; the ability of the Company to innovate and to develop and introduce commercially successful products; the impact of product liability claims, labor claims and other legal or tax proceedings, including in foreign jurisdictions; the ability of the Company to implement and generate cost savings and efficiencies; the success of the Company's business strategies; risks related to additional increases in the estimated fair value of Procter & Gamble Co.'s (P&G's) interest in the Glad® business such as the significant increase over fiscal year 2018 primarily due to the recent Tax Cuts and Jobs Act (Tax Act) and the recent extension of the venture agreement with, and the related R&D support provided by, P&G; the Company's ability to attract and retain key personnel; supply disruptions and other risks inherent in reliance on a limited base of suppliers; environmental matters, including costs associated with the remediation and monitoring of past contamination, and possible increases in costs resulting from actions by relevant regulators, and the handling and/or transportation of hazardous substances; the impact of natural disasters, terrorism and other events beyond the Company's control; the Company's ability to maximize, assert and defend its intellectual property rights; any infringement or claimed infringement by the Company of third-party intellectual property rights; risks related to the effects of the Tax Act on the Company as the Company continues to assess and analyze such effects as well as its current interpretation, assumptions and expectations relating to the Tax Act, and the possibility that the financial impact of the Tax Act on the Company may be materially different from the Company's current estimates based on the Company's actual results for future periods, the Company's further assessment and analysis of the Tax Act, any additional Congressional, administrative or other actions, or other guidance related to the Tax Act and any actions that the Company may take as a result of the Tax Act; uncertainties relating to tax positions, tax disputes and changes in the Company's tax rate; the effect of the Company's indebtedness and credit rating on its business operations and financial results; the Company's ability to pay and declare dividends or repurchase its stock in the future; the Company's ability to maintain an effective system of internal controls; the impacts of potential stockholder activism; the accuracy of the Company's estimates and assumptions on which its financial projections are based; and risks related to the Company's discontinuation of operations in Venezuela.",1,966,data breach,CLX - Clorox Releases 2018 Integrated Annual Report - 02-Oct-18 - PRN.pdf
The Clorox Company,"Earnings, Dividends & Forecasts","This press release contains ""forward-looking statements"" within the meaning of Section 27A of the Securities Act of 1933, as amended, and Section 21E of the Securities Exchange Act of 1934, as amended, and such forward-looking statements involve risks and uncertainties. Except for historical information, statements about future volumes, sales, foreign currencies, costs, cost savings, margins, earnings, earnings per share, diluted earnings per share, foreign currency exchange rates, cash flows, plans, objectives, expectations, growth, or profitability are forward-looking statements based on management's estimates, assumptions and projections. Words such as ""could,"" ""may,"" ""expects,"" ""anticipates,"" ""targets,"" ""goals,"" ""projects,"" ""intends,"" ""plans,"" ""believes,"" ""seeks,"" ""estimates,"" ""predicts"" and variations on such words, and similar expressions that reflect our current views with respect to future events and operational and financial performance, are intended to identify such forward-looking statements. These forward-looking statements are only predictions, subject to risks and uncertainties, and actual results could differ materially from those discussed. Important factors that could affect performance and cause results to differ materially from management's expectations are described in the sections entitled ""Risk Factors"" and ""Management's Discussion and Analysis of Financial Condition and Results of Operations"" in the company's Annual Report on Form 10-K for the fiscal year ended June 30, 2016, as updated from time to time in the company's SEC filings. These factors include, but are not limited to: intense competition in the company's markets; worldwide, regional and local economic conditions and financial market volatility; the ability of the company to drive sales growth, increase prices and market share, grow its product categories and achieve favorable product and geographic mix; volatility and increases in commodity costs such as resin, sodium hypochlorite and agricultural commodities, and increases in energy, transportation or other costs; dependence on key customers and risks related to customer consolidation and ordering patterns; risks related to reliance on information technology systems, including potential security breaches, cyber-attacks, privacy breaches or data breaches that result in the unauthorized disclosure of consumer, customer, employee or company information, or service interruptions; costs resulting from government regulations; the ability of the company to successfully manage global, political, legal, tax and regulatory risks, including changes in regulatory or administrative activity; risks related to international operations, including political instability; government-imposed price controls or other regulations; foreign currency exchange rate controls, including periodic changes in such controls, fluctuations and devaluations; labor claims, labor unrest and inflationary pressures, particularly in Argentina; and potential harm and liabilities from the use, storage and transportation of chlorine in certain international markets where chlorine is used in the production of bleach; risks related to the possibility of nationalization,",1,429,data breach,"CLX - Clorox Reports Q1 Fiscal Year 2017 Results, Including Strong Sales Growth Updates Fiscal Year Tax-Rate Assumptions for EPS Outlook - 02-Nov-16 - PRN.pdf"
The Clorox Company,"Earnings, Dividends & Forecasts","""projects,"" ""intends,"" ""plans,"" ""believes,"" ""seeks,"" ""estimates,"" ""predicts"" and variations on such words, and similar expressions that reflect our current views with respect to future events and operational, economic and financial performance, are intended to identify such forward-looking statements. These forward-looking statements are only predictions, subject to risks and uncertainties, and actual results could differ materially from those discussed. Important factors that could affect performance and cause results to differ materially from management's expectations are described in the sections entitled ""Risk Factors"" and ""Management's Discussion and Analysis of Financial Condition and Results of Operations"" in the Company's Annual Report on Form 10-K for the fiscal year ended June 30, 2017, as updated from time to time in the Company's SEC filings. These factors include, but are not limited to: intense competition in the Company's markets; volatility and increases in commodity costs such as resin, sodium hypochlorite and agricultural commodities, and increases in energy, transportation or other costs; the ability of the Company to drive sales growth, increase price and market share, grow its product categories and manage favorable product and geographic mix; dependence on key customers and risks related to customer consolidation and ordering patterns; the impact of increase in sales of consumer products through alternative retail channels; risks related to reliance on information technology systems, including potential security breaches, cyber-attacks, privacy breaches or data breaches that result in the unauthorized disclosure of consumer, customer, employee or Company information, or service interruptions; lower revenue or increased costs resulting from government actions and regulations; the ability of the Company to successfully manage global political, legal, tax and regulatory risks, including changes in regulatory or administrative activity; risks relating to acquisitions, new ventures and divestitures, and associated costs, including the potential for asset impairment charges related to, among others, intangible assets and goodwill; worldwide, regional and local economic and financial market conditions; risks related to international operations and international trade, including political instability; government-imposed price controls or other regulations; foreign currency exchange rate controls, including periodic changes in such controls, fluctuations and devaluations; changes in trade, tax or U.S. immigration policies, labor claims, labor unrest and inflationary pressures, particularly in Argentina; potential negative impact and liabilities from the use, storage and transportation of chlorine in certain international markets where chlorine is used in the production of bleach; and the possibility of nationalization, expropriation of assets or other government action; the ability of the Company to innovate and to develop and introduce commercially successful products; the ability of the Company to implement and generate cost savings and efficiencies; the success of the Company's business strategies; the Company's ability to maintain its business reputation and the reputation of its brands; risks related to the potential increase in the Company's purchase price for The Procter & Gamble Company's (P&G) interest in the Glad® business and the impact from the decision on whether or not to extend the term of the related agreement with P&G; supply disruptions and other risks inherent in reliance on a limited base of suppliers; the impact of product liability claims, labor claims and other legal or tax proceedings, including in foreign jurisdictions; the Company's ability to attract and retain key personnel; environmental matters, including costs associated with the remediation and monitoring of past contamination, and possible increases in costs resulting from actions by relevant regulators, and the handling and/or transportation of hazardous substances; the impact of natural disasters, terrorism and other events beyond the Company's control; the Company's ability to maximize, assert and defend its intellectual property rights; any infringement or claimed infringement by the Company of third-party intellectual property rights; the effect of the Company's indebtedness and credit rating on its business operations and financial results; the Company's ability to pay and declare dividends or repurchase its stock in the future; the Company's ability to maintain an effective system of internal controls; uncertainties relating to tax positions, tax disputes and changes in the Company's tax rate; the accuracy of the Company's estimates and assumptions on which its financial projections are based; risks related to the Company's discontinuation of operations in Venezuela; and the impacts of potential stockholder activism.",1,687,data breach,CLX - Clorox Reports Q1 Fiscal Year 2018 Results Updates Fiscal Year 2018 Outlook - 01-Nov-17 - PRN.pdf
