who_wrote_the_piece,subject,relevant_text,paragraphs,words,keywords,path
The Clorox Company,"Earnings, Dividends & Forecasts","This press release contains ""forward-looking statements"" within the meaning of Section 27A of the Securities Act of 1933, as amended, and Section 21E of the Securities Exchange Act of 1934, as amended, and such forward-looking statements involve risks and uncertainties. Except for historical information, statements about future volumes, sales, foreign currencies, costs, cost savings, margins, earnings, earnings per share, diluted earnings per share, foreign currency exchange rates, cash flows, plans, objectives, expectations, growth, or profitability are forward-looking statements based on management's estimates, assumptions and projections. Words such as ""could,"" ""may,"" ""expects,"" ""anticipates,"" ""targets,"" ""goals,"" ""projects,"" ""intends,"" ""plans,"" ""believes,"" ""seeks,"" ""estimates,"" ""predicts"" and variations on such words, and similar expressions that reflect our current views with respect to future events and operational and financial performance, are intended to identify such forward-looking statements. These forward-looking statements are only predictions, subject to risks and uncertainties, and actual results could differ materially from those discussed. Important factors that could affect performance and cause results to differ materially from management's expectations are described in the sections entitled ""Risk Factors"" and ""Management's Discussion and Analysis of Financial Condition and Results of Operations"" in the company's Annual Report on Form 10-K for the fiscal year ended June 30, 2016, as updated from time to time in the company's SEC filings. These factors include, but are not limited to: intense competition in the company's markets; worldwide, regional and local economic conditions and financial market volatility; the ability of the company to drive sales growth, increase prices and market share, grow its product categories and achieve favorable product and geographic mix; volatility and increases in commodity costs such as resin, sodium hypochlorite and agricultural commodities, and increases in energy, transportation or other costs; dependence on key customers and risks related to customer consolidation and ordering patterns; risks related to reliance on information technology systems, including potential security breaches, cyber-attacks, privacy breaches or data breaches that result in the unauthorized disclosure of consumer, customer, employee or company information, or service interruptions; costs resulting from government regulations; the ability of the company to successfully manage global, political, legal, tax and regulatory risks, including changes in regulatory or administrative activity; risks related to international operations, including political instability; government-imposed price controls or other regulations; foreign currency exchange rate controls, including periodic changes in such controls, fluctuations and devaluations; labor claims, labor unrest and inflationary pressures, particularly in Argentina; and potential harm and liabilities from the use, storage and transportation of chlorine in certain international markets where chlorine is used in the production of bleach; risks related to the possibility of nationalization, expropriation of assets or other government action in foreign jurisdictions; risks relating to acquisitions, new ventures and divestitures, and associated costs, including the potential for asset impairment charges related to, among others, intangible assets and goodwill; the ability of the company to develop and introduce commercially successful products; supply disruptions and other risks inherent in reliance on a limited base of suppliers; the impact of product liability claims, labor claims and other legal proceedings, including in foreign jurisdictions; the success of the company's business strategies; the ability of the company to implement and generate anticipated cost savings and efficiencies; the company's ability to attract and retain key personnel; the company's ability to maintain its business reputation and the reputation of its brands; environmental matters, including costs associated with the remediation of past contamination and the handling and/or transportation of hazardous substances; the impact of natural disasters, terrorism and other events beyond the company's control; the company's ability to maximize, assert and defend its intellectual property rights; any infringement or claimed infringement by the company of third-party intellectual property rights; risks related to the potential increase in the company's purchase price for The Procter & Gamble Company's (P&G) interest in the Glad® business and the impact from the decision on whether or not to extend the term of the related agreement with P&G; the effect of the company's indebtedness and credit rating on its business operations and financial results; risks related to the company's discontinuation of operations in Venezuela; the company's ability to pay and declare dividends or repurchase its stock in the future; the company's ability to maintain an effective system of internal controls, including after completing",1,706,data breach,CLX - Evolve This Clorox 2016 Integrated Annual Report Highlights Fiscal Year Progress Against 2020 Strategy and More Than a Century of Evolutio... - 26-Sep-16 - PRN.pdf
"IRI Panel Data, Total U.S. All Outlets, NBD Weighted, 52 weeks ending  June 25, 2017.","Conference Call Announcements, Earnings, Dividends & Forecasts","sales growth, increase price and market share, grow its product categories and manage favorable product and geographic mix; dependence on key customers and risks related to customer consolidation and ordering patterns; the impact of increase in sales of consumer products through alternative retail channels; risks related to reliance on information technology systems, including potential security breaches, cyber-attacks, privacy breaches or data breaches that result in the unauthorized disclosure of consumer, customer, employee or Company information, or service interruptions; lower revenue or increased costs resulting from government actions and regulations; the ability of the Company to successfully manage global political, legal, tax and regulatory risks, including changes in regulatory or administrative activity; risks relating to acquisitions, new ventures and divestitures, and associated costs, including the potential for asset impairment charges related to, among others, intangible assets and goodwill; worldwide, regional and local economic and financial market conditions; risks related to international operations and international trade, including political instability; government-imposed price controls or other regulations; foreign currency exchange rate controls, including periodic changes in such controls, fluctuations and devaluations; changes in trade, tax or U.S. immigration policies, labor claims, labor unrest and inflationary pressures, particularly in Argentina; potential negative impact and liabilities from the use, storage and transportation of chlorine in certain international markets where chlorine is used in the production of bleach; and the possibility of nationalization, expropriation of assets or other government action; the ability of the Company to innovate and to develop and introduce commercially successful products; the ability of the Company to implement and generate cost savings and efficiencies; the success of the Company's business strategies; the Company's ability to maintain its business reputation and the reputation of its brands; risks related to the potential increase in the Company's purchase price for The Procter & Gamble Company's (P&G) interest in the Glad® business and the impact from the decision on whether or not to extend the term of the related agreement with P&G; supply disruptions and other risks inherent in reliance on a limited base of suppliers; the impact of product liability claims, labor claims and other legal or tax proceedings, including in foreign jurisdictions; the Company's ability to attract and retain key personnel; environmental matters, including costs associated with the remediation and monitoring of past contamination, and possible increases in costs resulting from actions by relevant regulators, and the handling and/or transportation of hazardous substances; the impact of natural disasters, terrorism and other events beyond the Company's control; the Company's ability to maximize, assert and defend its intellectual property rights; any infringement or claimed infringement by the Company of third-party intellectual property rights; the effect of the Company's indebtedness and credit rating on its business operations and financial results; the Company's ability to pay and declare dividends or repurchase its stock in the future; the Company's ability to maintain an effective system of internal controls; uncertainties relating to tax positions, tax disputes and changes in the Company's tax rate; the accuracy of the Company's estimates and assumptions on which its financial projections are based; risks related to the Company's discontinuation of operations in Venezuela; and the impacts of potential stockholder activism.",1,524,data breach,CLX - The Clorox Company Updates Investment Community on 2020 Strategy - 05-Oct-17 - PRN.pdf
The Clorox Company,"Environmental Conservation, Contracts, Corporate Social Responsibility","Forward-Looking Statements This press release contains ""forward-looking statements"" within the meaning of Section 27A of the Securities Act of 1933, as amended, and Section 21E of the Securities Exchange Act of 1934, as amended, and such forward-looking statements involve risks and uncertainties. Except for historical information, statements about future volumes, sales, organic sales growth, foreign currencies, costs, cost savings, margins, earnings, earnings per share, diluted earnings per share, foreign currency exchange rates, tax rates, cash flows, plans, objectives, expectations, growth or profitability are forward-looking statements based on management's estimates, beliefs, assumptions and projections. Words such as ""could,"" ""may,"" ""expects,"" ""anticipates,"" ""will,"" ""targets,"" ""goals,"" ""projects,"" ""intends,"" ""plans,"" ""believes,"" ""seeks,"" ""estimates,"" ""predicts,"" and variations on such words, and similar expressions that reflect our current views with respect to future events and operational, economic and financial performance, are intended to identify such forward- looking statements. These forward-looking statements are only predictions, subject to risks and uncertainties, and actual results could differ materially from those discussed. Important factors that could affect performance and cause results to differ materially from management's expectations, or could affect the company's ability to achieve its strategic goals, are described in the sections entitled ""Risk Factors"" and ""Management's Discussion and Analysis of Financial Condition and Results of Operations"" in the company's Annual Report on Form 10-K for the fiscal year ended June 30, 2019, as updated from time to time in the company's Securities and Exchange Commission filings.  These factors include, but are not limited to: intense competition in the company's markets; the impact of the changing retail environment, including the growth of alternative retail channels and business models, and changing consumer preferences; volatility and increases in commodity costs such as resin, sodium hypochlorite and agricultural commodities, and increases in energy, transportation or other costs; the ability of the company to drive sales growth, increase prices and market share, grow its product categories and manage favorable product and geographic mix; dependence on key customers and risks related to customer consolidation and ordering patterns; risks related to the company's use of and reliance on information technology systems, including potential security breaches, cyber-attacks, privacy breaches or data breaches that result in the unauthorized disclosure of consumer, customer, employee or company information, or service interruptions; the company's ability to maintain its business reputation and the reputation of its brands and products; risks relating to acquisitions, new ventures and divestitures, and associated costs, including the potential for asset impairment charges related to, among others, intangible assets and goodwill; and the ability to complete announced transactions and, if completed, integration costs and potential contingent liabilities related to those transactions; lower revenue, increased costs or reputational harm resulting from government actions and regulations; the ability of the company to successfully manage global, political, legal, tax and regulatory risks, including changes in regulatory or administrative activity; worldwide, regional and local economic and financial market conditions; risks related to international operations and international trade, including foreign currency fluctuations, such",1,491,data breach,"CLX, 06KDM7 - Clorox to Achieve About 50% of its Renewable Electricity Goal Through Agreement with Enel Green Power North America - 13-Nov-19 - PRN.pdf"
Comcast Cable Advertising,Product/Service,"President, Chief Data Officer, Viacom. “We’re happy to partner with Comcast on Blockgraph’s technology and platform to facilitate the valuable exchange of data insights as a necessary catalyst to scale our collective capabilities.”",1,33,chief data officer,CMCSA - Comcast Collaborates with Industry Partners on Blockgraph Software to Jumpstart the Use of Secure Data Sharing for Advanced TV Advertising - 21-Dec-18 - BW.pdf
Comcast Cable,Personnel,"Gerard J. Lewis, Jr. has been promoted to Chief Privacy Officer, Comcast Corporation and Senior Vice President, Deputy General Counsel. He leads the team within the Comcast Cable Law Department responsible for technology, licensing, non-patent intellectual property and business information and privacy matters. In his role as corporate Chief Privacy Officer, he will be responsible for providing coordination and guidance for the company’s overall privacy interests.",1,66,Chief Privacy Officer,"CMCSA, 0B2KGZ, CMCSA... - Comcast Cable Announces Promotions to Senior Level Positions - 10-Jun-13 - BW.pdf"
Comcast Advertising,"Contract/Agreement, Product/Service","“Data confidentiality is a necessity for addressable advertising to work at scale. Blockgraph is a platform that will make that easy to implement,” said John Halley, Chief Operating Officer, Advertising Revenue, and Executive Vice President, Advanced Marketing Solutions, ViacomCBS. “We are committed to solutions that enable us to better serve our advertising partners. Blockgraph has the right business approach and partnership framework to successfully move the video ecosystem forward.”",1,69,data confidentiality,"CMCSA, CHTR, VIAC - Comcast, Charter and ViacomCBS Announce Blockgraph Partnership - 29-May-20 - BW.pdf"
CNA,New Products & Services,"CNA Announces Lawyers' Data Breach and Network Security Endorsement   Wednesday, March 15, 2017 05:00:00 PM (GMT) | CHICAGO, March 15, 2017 /PRNewswire/ -- CNA today announced it has launched a new Lawyers' Data Breach and Network Security Endorsement. The new endorsement is available as part of CNA's Lawyers' Professional Liability (LPL) policy. | For law firms with five or fewer attorneys, the Lawyers' Data Breach and Network Security Endorsement covers: | For more information on the CNA Lawyers' Professional Liability policy and the new Lawyers' Data Breach and Network Security Endorsement, please contact Michael Furlong at 913-661-3159 or via email at Michael.Furlong@cna.com. | To view the original version on PR Newswire, visit: http://www.prnewswire.com/news-releases/cna- announces-lawyers-data-breach-and-network-security-endorsement-300424134.html",5,"16, 35, 17, 31, 11","data-breach, data breach",CNA - CNA Announces Lawyers' Data Breach and Network Security Endorsement - 15-Mar-17 - PRN.pdf
CNA,,"Williams joined CNA after 20 years of service to State Farm in varying counsel roles. Most recently, he served as leader of State Farm's Enterprise Compliance and Ethics department, AML/OFAC Officer and Chief Privacy Officer and was responsible for partnering with State Farm's Chief Information Security Officer to establish comprehensive information security and privacy governance.",1,55,Chief Privacy Officer,CNA - CNA Appoints Garrett Williams as Senior Vice President and Chief Compliance Officer - 06-Jun-18 - PRN.pdf
CNA,New Products & Services,"Identify current cybersecurity posture : Built from NIST guidelines, a select group of cybersecurity partners help insureds identify the strengths and weaknesses of their cybersecurity posture while also providing best practices. Mitigate potential cybersecurity risk : Cybersecurity recommendations, such as policy and procedure development and testing, password management and employee education, are put into action by sourced experts, helping insureds minimize the effects of cyber breaches on their organizations. Respond to cyber incident: Security incidents are often high-pressure situations. CNA's incident response vendors will bring a deep understanding of critical steps to manage an incident's impact and provide help after one occurs.",1,102,cyber breach,"CNA - CNA Introduces CNA CyberPrep, a Holistic Cyber Threat Program - 17-Jul-19 - PRN.pdf"
CNA,,"""Developing an effective plan to identify possible exposures and measures to minimize risk is vital to the success of any business. The potential consequences of a single data breach can range from sizable monetary penalties, negative publicity, interruption of daily operations and loss of public trust,"" Hallstrom added.",1,48,data breach,CNA - CNA Provides Five Steps To Strengthen Cyber Risk Management Strategy - 05-Jun-15 - PRN.pdf
CNA,,"CHICAGO, April 19, 2017 /PRNewswire/ -- Here's a scary statistic: One in four law firms with 10 to 49 attorneys have experienced a data breach, according to the American Bar Association's TechReport 2016 survey. And this security threat isn't just significant — it's growing. Last year, just 14 percent of firms of that same size say they suffered a data breach.",1,61,data breach,CNA - How Law Firms Can Implement a Cyber Security Program - 19-Apr-17 - PRN.pdf
CNA,Small Business Services,Cyberattacks and customer data breaches Observable threats such as slips and falls Break-ins and flooding,1,15,data breach,CNA - Price Check Could Your Retail Store Bounce Back From a Loss - 04-Mar-18 - PRN.pdf
CNA,,"The most recently published resources highlight emerging issues and trends in the healthcare industry, including Legionnaires’ Disease, telemedicine/telehealth (TMH), and cyber liability/data breach risks. As described below, these publications – including numerous client bulletins and risk management tools – may be accessed at www.cna.com/riskcontrol under “Client Materials,” click “Healthcare.” | AlertBulletin ® , ""Cyber Liability: Reducing the Risks of a Data Breach,” examines how data breaches occur, presents strategies to address the major hazards, and provides a listing of relevant resources.",2,"49, 31",data breach,"CNA, CNA - CNA Healthcare Publications Focus on Legionnaires' Disease, Cyber Liability and Telemedicine - 06-Aug-12 - BW.pdf"
Coty Inc.,Product/Service,"increasing dependency on information technology, including as a result of remote working in response to COVID-19, and the Company’s ability to protect against service interruptions, data corruption, cyber-based attacks or network security breaches, costs and timing of implementation and effectiveness of any upgrades or other changes to information technology systems, and the cost of compliance or the Company’s failure to comply with any privacy or data security laws (including the European Union General Data Protection Regulation and the California Consumer Privacy Act) or to protect against theft of customer, employee and corporate sensitive information;",1,94,General data protection regulation,COTY - Coty and Kim Kardashian West Announce Strategic Relationship to Expand Beauty Brands Globally - 29-Jun-20 - BW.pdf
Coty Inc.,"Sales, Divestiture","any change to Coty’s capital allocation and/or cash management priorities, including any change in its dividend reinvestment program and policy; any unanticipated problems, liabilities or integration or other challenges associated with a past or future acquired business which could result in increased risk or new, unanticipated or unknown liabilities, including with respect to environmental, competition and other regulatory, compliance or legal matters; Coty’s international operations and joint ventures, including enforceability and effectiveness of its joint venture agreements and reputational, compliance, regulatory, economic and foreign political risks, including difficulties and costs associated with maintaining compliance with a broad variety of complex local and international regulations; Coty’s dependence on certain licenses (especially in its Luxury division) and its ability to renew expiring licenses on favorable terms; Coty’s dependence on entities performing outsourced functions, including outsourcing of distribution functions, and third-party manufacturers, logistics and supply-chain suppliers and other suppliers, including third party software providers; administrative, development and other difficulties in meeting the expected timing of market expansions, product launches and marketing efforts; global political and/or economic uncertainties, disruptions or major regulatory or policy changes, and/or the enforcement thereof that affect Coty’s business, financial performance, operations or its products, including the impact of Brexit, the current U.S. administration, changes in the U.S. tax code, and recent changes and future changes in tariffs, retaliatory or trade protection measures, trade policies and other international trade regulations in the U.S., the European Union and Asia and in other regions where Coty operates; currency exchange rate volatility and currency devaluation; the number, type, outcomes (by judgment, order or settlement) and costs of any current or future legal, compliance, tax, regulatory or administrative proceedings, investigations and/or litigation, including litigation relating to the tender offer by Cottage Holdco B.V. (the “Cottage Tender Offer”); Coty’s ability to manage seasonal factors and other variability and to anticipate future business trends and needs; disruptions in operations, sales and in other areas, including due to disruptions in Coty’s supply chain, restructurings and other business alignment activities, the move of Coty’s headquarters to Amsterdam, manufacturing or information technology systems, labor disputes, extreme weather and natural disasters, and the impact of such disruptions on Coty’s ability to generate profits, stabilize or grow revenues or cash flows, comply with its contractual obligations and accurately forecast demand and supply needs and/or future results; restrictions imposed on Coty through its license agreements, credit facilities and senior unsecured bonds, or other material contracts, Coty’s ability to generate cash flow to repay, refinance or recapitalize debt and otherwise comply with its debt instruments, and changes in the manner in which Coty finances its debt and future capital needs; increasing dependency on information technology and Coty’s ability to protect against service interruptions, data corruption, cyber-based attacks or network security breaches, costs and timing of implementation and effectiveness of any upgrades or other changes to information technology systems, and the cost of compliance or its failure to comply with any privacy or data security laws (including the European Union General Data Protection Regulation (the “GDPR”) and the California Consumer Privacy Act) or to protect against theft of customer, employee and corporate sensitive information; Coty’s ability to attract and retain key personnel and the impact of senior management transitions and organizational structure changes, including the co-location of key business leaders and functions in Amsterdam; the distribution and sale by third parties of counterfeit and/or gray market versions of the Coty’s products; the impact of the Cottage Tender Offer and of Coty’s Turnaround Plan on its relationships with key customers and suppliers and certain material contracts; Coty’s relationship with Cottage Holdco B.V., as our majority stockholder, and its affiliates, and any related conflicts of interest or litigation; future sales of a significant number of shares by Coty’s majority stockholder or contractually by certain commercial banks on behalf of Coty’s majority stockholder, as may be required to satisfy obligations under such majority stockholder's credit agreement, or the perception that such sales could occur; and other factors described elsewhere in this document and in documents that Coty files with the SEC from time to time.",1,678,General data protection regulation,COTY - Coty Announces Intent to Explore Strategic Options for Its Professional Beauty Business as Part of Next Step in Its Ongoing Transformation - 21-Oct-19 - BW.pdf
