who_wrote_the_piece,subject,relevant_text,paragraphs,words,keywords,path
Diageo North America,"Corporate Social Responsibility, Human Interest Groups","- Global beverage leader announces ""Diageo Community Fund"" with $20 million of support for businesses, consumers and partners across the hospitality industry - Through targeted donations Diageo will help address the disproportionate social and economic impact of COVID-19 on Black communities and businesses - Company reinforces commitment to inclusivity, diversity and zero tolerance for racism and injustice. | https://www.diageo.com/en/news-and-media/features/ivan-menezes-champions-diversity-in-the- workplace/ https://www.diageo.com/en/news-and-media/press-releases/diageo-north-america-joins-more-than-350- ceos-in-commitment-to-advance-inclusion-and-diversity-in-the-workplace/ https://www.diageo.com/en/news-and-media/features/diageo-ranked-second-in-the-2019-refinitiv- diversity-inclusion-index/",2,"57, 6",diversity,"006TZX, DGE - Diageo Announces $20 Million Community Fund to Support Social Justice in America, Helping Black Communities and Businesses Recover ... - 12-Jun-20 - PRN.pdf"
Diageo North America,Human Interest Groups,"""At Diageo, we are particularly proud to be a champion of gender equality taking proactive steps in order to curb workplace inequality,"" said Laura Watt , HR Director, Diageo North America. ""We take great pride in our leadership in this space but acknowledge there is still a great deal of work to be done."" | 2019 ""ì  Bloomberg Gender Equality Index: Diageo has been named in the 2019 Bloomberg Gender- Equality Index (GEi), which distinguishes companies committed to transparency in gender reporting and advancing women's equality. | 2019 ""ì Equileap 2019 Global Gender Equality Report: Diageo has been ranked as the number one business globally for gender equality in the Equileap 2019 Global Gender Equality Report and Ranking | 2019 ""ì Refinitiv Top 100 Company Diversity & Inclusion Index:  In 2019, Diageo was recognized as the 2nd most diverse and inclusive workplace in the world on this index. | 2018 ""ì CEO Action for Diversity & Inclusion: Diageo, has joined the growing number of organizations pledging to advance inclusion and diversity in the workplace. Diageo North America is the first beverage alcohol company to make such a commitment. | Last summer, Diageo launched a groundbreaking parental leave program, offering six months leave to new parents regardless of gender or sexual orientation or how the employee came to be a parent through birth, adoption or foster care. Diageo has also just launched a robust Secondment policy in North America  which encourages all employees, women and men to expand their skill set by exploring new and different career opportunities within Diageo. | Inclusion and Diversity remains a core strategic objective for Diageo North America. Through the ongoing work of its nine business resource groups, Diageo continues to champion this effort where employees with common backgrounds, interests, heritage, or orientation connect to support each other. We strive to continuously engage with business and brand leadership on creating a vibrant place to work for our employees and better engage our consumers through Inclusion and Diversity efforts in the communities in which we work, live, source and sell. | This recognition from NAFE are part of a growing list of awards Diageo's business has earned for its commitment to inclusion and diversity. Additional recent honors include: | 2019 ""ì  Diversity MBA: For the 8th consecutive year, Diageo North America was named to Diversity MBA's 2019 ""50 Out Front for Diversity Leadership"" list of the best places in the country for women and diverse managers to work. Diversity MBA also recognized Diageo as Best in Class for Workplace Inclusion & Retention and Board Diversity. | 2019 ""ì Diversity Best Practices Inclusion Index:  A division of Working Mother Media, Diversity Best Practices (DBP) recognized Diageo North America as a ""Leading Organization having scored 75 percent or higher to be counted in its third-annual inclusion index.",10,"54, 31, 31, 29, 39, 70, 83, 27, 56, 39","gender equality, parental leave, diversity, Diversity & Inclusion","006TZX, DGE - Diageo North America Recognized as a Champion of Gender Parity - 03-Mar-20 - PRN.pdf"
Boomi,Human Interest Groups,"Over the past year, Boomi has expanded its pledge in diversity and inclusion. For example, through the Boomi Veteran Academy  ""ì a free, high-demand training developed to help guide and train veterans as they transition into the private workforce ""ì  veterans can either learn remotely or undergo an extensive internship at Boomi's Chesterbrook headquarters to become Boomi certified. Rachel Jimenez, veterans program coordinator at Boomi, is just one of the Veteran Academy success stories. After returning from service, she struggled to find the right job opportunity to support her family until she was accepted into the Veteran Academy. There, Jimenez became certified in the Boomi platform and now plays an integral role at the company advancing the very program that originally helped her.",1,123,Diversity and Inclusion,"00BBRL, DELL, DELL.XX1... - The Philadelphia Inquirer Names Boomi A Winner Of The Philadelphia Top Workplaces 2020 Award - 09-Mar-20 - PRN.pdf"
United States Hispanic Chamber of Commerce,"Corporate Social Responsibility, Human Interest Groups","WASHINGTON, Feb. 6, 2012 /PRNewswire-USNewswire/ -- The United States Hispanic Chamber of Commerce (USHCC) recognizes AT&T, which earned the highest rating from the Hispanic Association on Corporate Responsibility (HACR) 2011 Corporate Inclusion Index. The index rates Hispanic diversity and inclusion practices in the areas of workforce, procurement, philanthropy and governance.  AT&T was one of only two companies ""ì and the only telecommunications company nationwide ""ì to receive a 95 rating, the highest in HACR's index this year. | As a standing member of the Billion Dollar Roundtable, an accolade achieved by those spending over  $1 billion with minority and woman-owned suppliers, AT&T's commitment to Hispanic diversity and inclusion also includes: | ""This recognition of AT&T by HACR reaffirms the company's long standing position as a leader in diversity, especially as it relates to Hispanics,"" says USHCC President & CEO Javier Palomarez . ""Our Hispanic Business Enterprises (HBEs) have experienced this firsthand, benefiting from procurement opportunities with AT&T. Once again, this company demonstrates that it not only does what is right, but understands that diversity is smart business, too.""   | Palomarez points to the rising Hispanic population ""ì now 16% of the U.S. population ""ì an important statistic for corporations to keep in mind at a time when companies are being challenged to structure their leadership to reflect the wealth of diversity in America. | ""The USHCC congratulates AT&T for making diversity a part of its best practices and we look forward to continued commitment in this important segment of the company's business strategy,"" adds Palomarez. | A 12 percent representation of Hispanics in the AT&T  workforce.  Award-winning Employee Resource Group, HACEMOS (the Hispanic/Latino Employee Association of AT&T). A top-rated global  supplier diversity program  that spent more than $9.2 billion with minority, women and disabled-veteran suppliers in 2010. Strong focus on the Hispanic Consumer Market , which includes converting more than 700 retail stores in high-density Hispanic markets including California, Florida, New York  and Texas to a bilingual (Spanish/English) format. A strong advertising investment in Hispanic media . Support of the Hispanic community  by investing resources to advance education, strengthen communities and improve lives. In 2010, AT&T contributed more than $148 million to the diverse communities it serves through corporate, employee and AT&T Foundation giving. Significant representation of Hispanics in the company's  most senior ranks  including Ralph de la Vega, president and CEO of AT&T Mobility and Consumer Markets;  Thaddeus Arroyo, chief information officer; Jose Gutierrez, president, advertising and publishing; Carmen Nava, senior vice president-Consumer Marketing; Angie Wiskocil, senior vice president,  Wi-Fi services; and Jaime Chico Pardo, AT&T Board of Directors.",6,"77, 32, 67, 44, 31, 174","Diversity and Inclusion, diversity","0775LJ, T, 073FJL... - USHCC Applauds AT&T's Commitment to Hispanic Inclusion - 06-Feb-12 - PRN.pdf"
SMIRNOFF,"Corporate Social Responsibility, New Products & Services","The Smirnoff Sound Collective Fosters Diversity Within Electronic Music In Collaboration With Artists And Industry Leaders  Thursday, December 01, 2016 01:00:00 PM (GMT) | The Smirnoff Sound Collective is taking a stand against exclusivity and the lack of diversity within electronic music through the launch of a new artist mentorship program that will lead its push for electronic music industry leaders to be more inclusive of underrepresented communities and individuals. | ""Diversity in the electronic music community has been a topic of discussion within the industry, and a passion of SMIRNOFF for quite some time,"" said Justin Medcraft, SMIRNOFF Global Senior Brand Manager. ""It's quite astonishing to us that last year only 10% of electronic music headliners were women. When you look at other communities such as the African American community and the LGBTQ community, you find a similar lack of representation throughout the industry. That needs to change and we hope to put forth acts that do so this year and moving forward."" | Several of these artists attended, and performed at, the official launch event last night in celebration of the Smirnoff Sound Collective's mentorship program. They gathered with top industry professionals and electronic music legends and toasted over SMIRNOFF No. 21 cocktails to celebrate the beginnings of a new shift towards diversity. Many of the cocktails served were custom created by the artists as a way to show their appreciation for their new partnership with SMIRNOFF. Following the Smirnoff Sound Collective's program launch and pledge for diversity, Mixmag was the first industry leader to align with SMIRNOFF in creating a shift toward diversity. They announced their own plans to commit to 50% of their future magazine covers including a female artist.     | To view the original version on PR Newswire, visit: http://www.prnewswire.com/news-releases/the-smirnoff- sound-collective-fosters-diversity-within-electronic-music-in-collaboration-with-artists-and-industry-leaders- 300371184.html",5,"23, 46, 93, 119, 12",diversity,"0B1J15, DGE - The Smirnoff Sound Collective Fosters Diversity Within Electronic Music In Collaboration With Artists And Industry Leaders - 01-Dec-16 - PRN.pdf"
WarnerMedia,"Photo/Multimedia, Product/Service, Event","Directed and produced by Kirby Dick and Amy Ziering (The Hunting Ground, The Invisible War ), and first reported by the New York Times , On The Record  presents the powerful haunting story of music executive Drew Dixon (collaborator on hit records by Method Man and Mary J. Blige, Estelle and Kanye West, and Whitney Houston) as she grapples with her decision to become one of the first women of color, in the wake of #MeToo, to come forward and publicly accuse hip-hop mogul Russell Simmons of sexual assault. | The documentary, which premiered at the 2020 Sundance Film Festival to rave reviews, chronicles not only Dixon's story but that of several other accusers ""ì Sil Lai Abrams, Sheri Sher""ì delving deeply into the ways women of colors' voices are all too often silenced and ignored when they allege sexual assault; as well as",2,"89, 54",sexual assault,"0JMVQS, T, 05M27X - HBO Max to Launch May 27th - 21-Apr-20 - BW.pdf"
Food Lion,Survey,"""At Food Lion, we are proud of our diverse and inclusive workforce representative of the towns and cities we serve,""ù said Millette Granville, Vice President, Talent, Diversity & Inclusion & Organization Development at Food Lion. ""We're honored to receive a top score for the 10th year and remain committed to being a Best Place to Work for LGBTQ equality.""ù",1,59,Diversity & Inclusion,"AD, 05M83P - Food Lion Earns Top Marks in 2019 Corporate Equality Index - 05-Apr-19 - BW.pdf"
Food Lion,Contract/Agreement,"""Food Lion is honored to continue our partnership with the CIAA as a way to show our support to the communities in our footprint surrounding the 12 CIAA schools,""ù said Millette Granville, Director of Diversity for Food Lion. ""We have partnered with the CIAA for 24 years, and our partnership with the CIAA is a strategic alliance that supports their commitment to education, men's and women's athletics, and diversity and inclusion. We look forward to adding events for CIAA fans and our customers.""ù",1,83,Diversity and Inclusion,"AD, 05M83P, 07S81F - Food Lion Renews Three-Year Corporate Partner Agreement With CIAA - 21-Dec-17 - BW.pdf"
Ahold USA,Human Interest Groups,"""At Ahold  USA, we strive to represent the many diverse communities we serve, and we are proud to support the LGBTQ community throughout the entire organization,"" said Subarna Malakar , vice president, global diversity and inclusion. ""It's truly an honor to receive a perfect score on the Corporate Equality Index and we know our associates are proud of this important accomplishment.""",1,61,Diversity and Inclusion,"AD, 05MR69 - Ahold USA Earns Top Marks In 2018 Corporate Equality Index - 09-Nov-17 - PRN.pdf"
Food Lion,Product/Service,"Food Lion Announces New Six-Week Paid Parental Leave Benefit  Wednesday, September 11, 2019 01:30:00 PM (GMT) | Food Lion announced today that beginning Jan. 1, 2020, the retailer will offer a paid parental leave benefit to all full-time associates. | With this benefit, associates of any gender may take six weeks of paid parental leave within the first 12 months of a child's birth, adoption or other legal, custodial placements. | The paid parental leave benefit will be eligible to all full-time Food Lion associates with at least one year of continuous service with the company as of the date their child is born, adopted or placed with an associates' family or the date the placement was finalized.",4,"16, 22, 30, 47",parental leave,"AD, ADRNY - Food Lion Announces New Six-Week Paid Parental Leave Benefit - 11-Sep-19 - BW.pdf"
,"Conjecture, Media Summaries, Barron's Summary, Published Reports","Trader Extra:  Positive on Dollar Tree (DLTR), whose valuation is at a five-year low; The company looks likely to bounce back from its acquisition of Family Dollar, which has dragged on results; If not, an activist investor like Carl Ichan could get involved to force more drastic action. Trader Extra:  Former  Wynn Resorts (WYNN) CEO Steve Wynn, who resigned after sexual misconduct allegations, sold his entire $2.1B interest in the company in March; The well-timed sale saved him $900M.",1,79,sexual misconduct,"ARRS, BA, BATRA... - Barron's Summary  - - 10-Nov-18 - SA.pdf"
CVS Caremark,Human Interest Groups,"CVS Caremark, a Titanium Sponsor of the conference, will also be participating in a number of general sessions and panels and will highlight its efforts to ensure customers and patients receive quality care and guidance as they age. David Casey, the company's Vice President of Workforce Strategies and Chief Diversity Officer, will open the March 12 General Session: Mysteries of Population Aging .",1,63,Chief Diversity Officer,CVS - CVS Caremark Emphasizes Commitment to Older Americans at Annual American Society on Aging Conference - 12-Mar-13 - PRN.pdf
CVS Caremark,"Corporate Social Responsibility, Human Interest Groups","""As a nationwide employer focused on transforming the delivery of health care services, CVS Caremark is committed to providing job opportunities and attractive career paths for members of the military.  We value their experience and training as leaders, innovators and team builders and see many opportunities for veterans to make a seamless transition from the military to a career at CVS Caremark,"" said David Casey, Vice President, Workforce Strategies and Chief Diversity Officer, CVS Caremark.",1,75,Chief Diversity Officer,CVS - CVS Caremark Joins First Lady Michelle Obama and U.S. Chamber of Commerce in Supporting Employment Opportunities for Veterans and Military ... - 10-Nov-11 - PRN.pdf
CVS Caremark,Corporate Social Responsibility,"""Employers know what skills they want in their workforces, but they often lack full access to communities where they can identify and foster the talent they need for today and tomorrow,"" said David Casey, Vice President of Workforce Strategies and Chief Diversity Officer at CVS Caremark. ""A big part of the role of corporate talent acquisition is to deliver the right people in the right roles at the right time in the right places.  Given the rapidly changing dynamics of the communities from which we draw talent, diversity has to be top of mind for any company that wants to remain relevant and competitive."" | CVS Caremark Showcases Workplace and Marketplace Diversity at 2011 National Urban League Conference  Thursday, July 28, 2011 01:30:00 PM (GMT) | ""Like the Urban League, we value diversity and share a common belief in the importance of revitalizing local communities and creating a more diverse workforce,"" Merlo added.  ""That's why we are exploring a deeper partnership with the Urban League that will leverage their grassroots reach into multi-cultural communities with the goal of helping people build prosperous careers."" | CVS Caremark focuses its diversity strategy on a number of objectives including reflecting the marketplaces it serves, and leveraging workplace relationships by creating and sustaining an environment of inclusion. The Company also creates workplace policies, practices and programs that enable all colleagues to perform at their highest potential and ensure alignment with and engagement of all key external customers, clients, communities and constituents.",4,"104, 20, 57, 63","Chief Diversity Officer, diversity",CVS - CVS Caremark Showcases Workplace and Marketplace Diversity at 2011 National Urban League Conference - 28-Jul-11 - PRN.pdf
CVS Caremark,Human Interest Groups,"""CVS Caremark believes that mature workers are invaluable colleagues in the workplace and also play an instrumental role in our continuing commitment to provide innovative solutions for our mature customers,"" said David Casey, Vice President, Workforce Strategies and Chief Diversity Officer, CVS Caremark.",1,43,Chief Diversity Officer,CVS - CVS Caremark to Highlight Commitment to Older Americans at American Society on Aging Conference - 29-Mar-12 - PRN.pdf
CVS Caremark,,"""CVS Caremark is proud to partner with the National Urban League, a national leader in improving economic empowerment in urban communities,"" said David L. Casey, Vice President, Workforce Strategies and Chief Diversity Officer, CVS Caremark. ""Working together with the Urban League allows us to cultivate the relationships we have already established in the many multicultural communities we serve across the country."" | CVS Caremark to Highlight Diversity Initiatives at 2013 National Urban League Conference in Philadelphia  Wednesday, July 24, 2013 05:19:03 PM (GMT) | WOONSOCKET, R.I., July 24, 2013 /PRNewswire/ -- CVS Caremark (NYSE: CVS), the largest pharmacy health care provider in the United States, is an official sponsor of the National Urban League's 2013 Conference in Philadelphia this week. The company will exhibit at the conference, offering attendees a glimpse into the company's wide array of diversity programs, including workforce initiatives, health screenings and multicultural product offerings. | CVS Caremark currently employs 200,000 colleagues and was recently named one of DiversityInc's 25 Noteworthy companies for 2013 and a Top 10 Company for Veterans. | To follow CVS Caremark's participation in the Urban League conference, search for #CVSDiversity on Twitter.",5,"61, 21, 64, 25, 15","Chief Diversity Officer, diversity",CVS - CVS Caremark to Highlight Diversity Initiatives at 2013 National Urban League Conference in Philadelphia - 24-Jul-13 - PRN.pdf
CVS Caremark,"Labor Issues, Human Interest Groups","David Casey, Vice President and Chief Diversity Officer for CVS Caremark and a former United States Marine, and Alfredo Ruiz, a Supervisor in CVS Caremark's  Vero Beach, FL, Distribution Center and a retired U.S. Army soldier, attended today's announcement on behalf of the company.    CVS Caremark was recently recognized by DiversityInc as one of the Top 10 Companies for Veterans. The company also received the Pro Patria Award from the Rhode Island Employer Support of the Guard and Reserve (ESGR). The Pro Patria Award is presented to one small, one large and one public sector employer in each state that has demonstrated the greatest support to Guard and Reserve employees through their leadership and practices. Rhode Island ESGR also nominated CVS Caremark for a Secretary of Defense Employer Support Freedom Award. The Freedom Award is the highest recognition given by the U.S. Government to employers for their outstanding support of employees serving in the Guard or Reserve.",1,157,Chief Diversity Officer,CVS - CVS Caremark to Participate in White House Effort to Hire Veterans and Military Spouses - 30-Apr-13 - PRN.pdf
CVS Caremark,"Corporate Social Responsibility, Socially Responsible Investing","""Our partnership with the National Urban League helps create an even more impactful connection with the multicultural communities we serve,"" said David Casey, Vice President, Workforce Strategies and Chief Diversity Officer, CVS Caremark. ""Like us, the Urban League is an organization that has national reach, but they are also very committed to being involved on the local level."" | CVS Caremark to Showcase Commitment to Diversity at National Urban League 2012 Annual Conference in New Orleans  Thursday, July 26, 2012 04:00:00 PM (GMT) | Company will highlight diversity programs offer health screenings and distribute multicultural product samples | WOONSOCKET, R.I., July 26, 2012 /PRNewswire/ -- CVS Caremark (NYSE: CVS), the nation's largest pharmacy innovation company, will exhibit at the National Urban League's 2012 Annual Conference in New Orleans this week and engage attendees with information on the company's diversity programs, including workforce initiatives, health screenings focused on urban communities and multicultural product offerings. | The booth will feature a new video about CVS Caremark's commitment to diversity that can also be viewed at www.cvscaremarkfyi.com/diversity. | ""At CVS Caremark we pride ourselves on having a diverse workforce and on our commitment to serving multicultural populations,"" said Underwood, who is also a member of the CVS Caremark Diversity Management Leadership Council. ""We have championed a number of programs and policies that underscore our commitment to diversity, such as our support of colleague resource groups, direct support of the multicultural communities within which we do business and a robust and evolving supplier diversity program."" | CVS Caremark also has an active Diversity Management Executive Steering Committee and was recently named as one of DiversityInc's 25 Noteworthy Companies for 2012. | To follow CVS Caremark's participation in the Urban League event on Twitter, search for #CVSDiversity.",8,"58, 24, 13, 55, 20, 76, 24, 15","Chief Diversity Officer, diversity",CVS - CVS Caremark to Showcase Commitment to Diversity at National Urban League 2012 Annual Conference in New Orleans - 26-Jul-12 - PRN.pdf
CVS Health,Corporate Social Responsibility,"""Our continued investments to local non-profits and our workforce are key to making a meaningful impact on the lives of the people of Ohio,"" said David Casey, Vice President, Workforce Strategies, and Chief Diversity Officer, CVS Health. ""We are committed to working with these organizations to expand the delivery of care and build healthier communities across the state.""",1,58,Chief Diversity Officer,CVS - CVS Health Announces $2.5 Million in New Funding to Help Build Healthier Communities in Ohio - 16-Oct-19 - PRN.pdf
CVS Health,Human Interest Groups,"""At CVS Health, we recognize the strong connection between a culturally diverse nursing workforce and the ability to provide quality, culturally competent patient care,"" said David Casey, Vice President, Workforce Strategies, and Chief Diversity Officer at CVS Health. ""We value the multicultural communities, customers and patients we serve and we look forward to working closely with NBNA and NAHN, as we continue to help bridge the current nursing shortage in the United States and enhance access to quality care to underserved populations."" | ""CVS Health and NBNA share the common goal of supporting the development of African American nurses which is reflective of our nation's diversity,"" said Eric J. Williams, DNP, RN, CNE, President, NBNA. ""This new partnership will allow our two organizations to work collaboratively to increase access to care and improve the health of the communities we serve.""",2,"82, 57","Chief Diversity Officer, diversity",CVS - CVS Health Announces Strategic Partnerships with Two National Multicultural Nursing Associations - 19-Jan-16 - PRN.pdf
