identifier,headline,date,source,who_wrote_the_piece,subject,relevant_text,paragraphs,words,keywords
SNBR,Sleep Number Announces Record Second Quarter 2019 Results and Raises Midpoint of Earnings Outlook,25-Jul-19,BW,Sleep Number Corporation,"Webcast, Conference Call, Earnings","Forward-looking Statements  Statements used in this news release relating to future plans, events, financial results or performance are forward-looking statements subject to certain risks and uncertainties including, among others, such factors as current and future general and industry economic trends and consumer confidence; the effectiveness of our marketing messages; the efficiency of our advertising and promotional efforts; our ability to execute our company-controlled distribution strategy; our ability to achieve and maintain acceptable levels of product and service quality, and acceptable product return and warranty claims rates; our ability to continue to improve and expand our product line; consumer acceptance of our products, product quality, innovation and brand image; industry competition, the emergence of additional competitive products, and the adequacy of our intellectual property rights to protect our products and brand from competitive or infringing activities; the potential for claims that our products, processes, advertising, or trademarks infringe the intellectual property rights of others; availability of attractive and cost-effective consumer credit options; pending and unforeseen litigation and the potential for adverse publicity associated with litigation; our manufacturing processes with minimal levels of inventory, which may leave us vulnerable to shortages in supply; our dependence on significant suppliers and our ability to maintain relationships with key suppliers, including several sole-source suppliers; the vulnerability of key suppliers to recessionary pressures, labor negotiations, liquidity concerns or other factors; rising commodity costs and other inflationary pressures; risks inherent in global sourcing activities, including tariffs and the potential for shortages in supply; risks of disruption in the operation of either of our two primary manufacturing facilities; increasing government regulations; the adequacy of our and third party information systems to meet the evolving needs of our business and existing and evolving risks and regulatory standards applicable to data privacy and security; the costs, distractions and potential disruptions to our business related to upgrading our management information systems; the vulnerability of our and third-party information systems to attacks by hackers or other cyber threats that could compromise the security of our systems, result in a data breach or disrupt our business; and our ability to attract, retain and motivate qualified management, executive and other key employees, including qualified retail sales professionals and managers. Additional information concerning these and other risks and uncertainties is contained in the company’s filings with the Securities and Exchange Commission (SEC), including the Annual Report on Form 10-K, and other periodic reports filed with the SEC. The company has no obligation to publicly update or revise any of the forward-looking statements in this news release.",1,421,data breach
SNBR,Sleep Number Announces Record Third Quarter 2019 Results and Raises Earnings Outlook,15-Oct-19,BW,Sleep Number Corporation,"Webcast, Conference Call, Earnings","Forward-looking Statements  Statements used in this news release relating to future plans, events, financial results or performance are forward-looking statements subject to certain risks and uncertainties including, among others, such factors as current and future general and industry economic trends and consumer confidence; the effectiveness of our marketing messages; the efficiency of our advertising and promotional efforts; our ability to execute our company-controlled distribution strategy; our ability to achieve and maintain acceptable levels of product and service quality, and acceptable product return and warranty claims rates; our ability to continue to improve and expand our product line; consumer acceptance of our products, product quality, innovation and brand image; industry competition, the emergence of additional competitive products, and the adequacy of our intellectual property rights to protect our products and brand from competitive or infringing activities; the potential for claims that our products, processes, advertising, or trademarks infringe the intellectual property rights of others; availability of attractive and cost-effective consumer credit options; pending and unforeseen litigation and the potential for adverse publicity associated with litigation; our manufacturing processes with minimal levels of inventory, which may leave us vulnerable to shortages in supply; our dependence on significant suppliers and our ability to maintain relationships with key suppliers, including several sole-source suppliers; the vulnerability of key suppliers to recessionary pressures, labor negotiations, liquidity concerns or other factors; rising commodity costs and other inflationary pressures; risks inherent in global sourcing activities, including tariffs and the potential for shortages in supply; risks of disruption in the operation of either of our two primary manufacturing facilities; increasing government regulations; the adequacy of our and third party information systems to meet the evolving needs of our business and existing and evolving risks and regulatory standards applicable to data privacy and security; the costs, distractions and potential disruptions to our business related to upgrading our management information systems; the vulnerability of our and third-party information systems to attacks by hackers or other cyber threats that could compromise the security of our systems, result in a data breach or disrupt our business; and our ability to attract, retain and motivate qualified management, executive and other key employees, including qualified retail sales professionals and managers. Additional information concerning these and other risks and uncertainties is contained in the company’s filings with the Securities and Exchange Commission (SEC), including the Annual Report on Form 10-K, and other periodic reports filed with the SEC. The company has no obligation to publicly update or revise any of the forward-looking statements in this news release.",1,421,data breach
SNBR,Sleep Number Announces Scientific Advisory Board Members,29-Apr-20,BW,Sleep Number Corporation,"Photo/Multimedia, Personnel","Statements used in this news release relating to future plans, events, financial results or performance are forward-looking statements subject to certain risks and uncertainties including, among others, such factors as current and future general and industry economic trends and consumer confidence; risks inherent in outbreaks of pandemics or contagious diseases, including the COVID-19 pandemic; the effectiveness of our marketing messages; the efficiency of our advertising and promotional efforts; our ability to execute our company-controlled distribution strategy; our ability to achieve and maintain acceptable levels of product and service quality, and acceptable product return and warranty claims rates; our ability to continue to improve and expand our product line; consumer acceptance of our products, product quality, innovation and brand image; industry competition, the emergence of additional competitive products, and the adequacy of our intellectual property rights to protect our products and brand from competitive or infringing activities; claims that our products, processes, advertising, or trademarks infringe the intellectual property rights of others; availability of attractive and cost-effective consumer credit options; pending and unforeseen litigation and the potential for adverse publicity associated with litigation; our manufacturing processes with minimal levels of inventory, which may leave us vulnerable to shortages in supply; our dependence on significant suppliers and third parties and our ability to maintain relationships with key suppliers or third-parties, including several sole-source suppliers or providers of services; rising commodity costs and other inflationary pressures; risks inherent in global sourcing activities, including tariffs, pandemics, strikes, and the potential for shortages in supply; risks of disruption in the operation of our main manufacturing facilities or assembly distribution facilities; increasing government regulation; the adequacy of our and third-party information systems to meet the evolving needs of our business and existing and evolving risks and regulatory standards applicable to data privacy and security; the costs and potential disruptions to our business related to upgrading our management information systems; the vulnerability of our and third-party information systems to attacks by hackers or other cyber threats that could compromise the security of our systems, result in a data breach or disrupt our business; and our ability to attract, retain and motivate qualified management, executive and other key team members, including qualified retail sales professionals and managers. Additional information concerning these and other risks and uncertainties is contained in the company’s filings with the Securities and Exchange Commission (SEC), including the Annual Report on Form 10-K, and other periodic reports filed with the SEC. The company has no obligation to publicly update or revise any of the forward-looking statements in this news release.",1,425,data breach
SNBR,Sleep Number Highlights Business Continuity Endeavors During Pandemic,8-Apr-20,BW,Sleep Number Corporation,"Webcast, Conference Call, Advisory, Earnings","hackers or other cyber threats that could compromise the security of our systems, result in a data breach or disrupt our business; and our ability to attract, retain and motivate qualified management, executive and other key team members, including qualified retail sales professionals and managers. Additional information concerning these and other risks and uncertainties is contained in the company’s filings with the Securities and Exchange Commission (SEC), including the Annual Report on Form 10-K, and other periodic reports filed with the SEC. The company has no obligation to publicly update or revise any of the forward-looking statements in this news release.",1,101,data breach
SNBR,Sleep Number Unveils Award,Winning Innovations at CES 2020 with Climate360™ Smart Bed and New 360® Smart Beds - 06-Jan,20,Sleep Number Corporation,"Photo/Multimedia, Award, Conference, Trade Show, Product/Service","Forward-looking Statements  Statements used in this news release relating to future plans, events, financial results or performance are forward-looking statements subject to certain risks and uncertainties including, among others, such factors as current and future general and industry economic trends and consumer confidence; the effectiveness of our marketing messages; the efficiency of our advertising and promotional efforts; our ability to execute our company-controlled distribution strategy; our ability to achieve and maintain acceptable levels of product and service quality; our ability to continue to improve and expand our product line; consumer acceptance of our products, product quality, innovation and brand image; our manufacturing processes with minimal levels of inventory, which may leave us vulnerable to shortages in supply; our dependence on significant suppliers, including several sole-source suppliers; rising commodity costs and other inflationary pressures; risks inherent in global sourcing activities, including tariffs and the potential for shortages in supply; risks of disruption in the operation of either of our two primary manufacturing facilities; increasing government regulations; and the vulnerability of our and third-party information systems to attacks by hackers or other cyber threats that could compromise the security of our systems, result in a data breach or disrupt our business. Additional information concerning these and other risks and uncertainties is",1,209,data breach
SONO,"Sonos, Inc.(SONO",US) Schedules Morgan Stanley Technology Media & Telecom Conference for 3-March-2020 810 PM ET,2,,,,,,
6758,Sony Corp.(6758,JP) Schedules Q4 2010 Guidance Call for 23-May-2011 530 AM ET,23,,,,,,
6758,"Sony Data Breach is Not a Case of Sophisticated Hacking, Says SolPass Security Analyst",23-Dec-14,PRN,SolPass LLC,,"Sony Data Breach is Not a Case of Sophisticated Hacking, Says SolPass Security Analyst   Tuesday, December 23, 2014 03:17:00 PM (GMT) | DENVER, Dec. 23, 2014 /PRNewswire/ -- Reports surrounding the Sony data breach are missing a simple, critical concept. Because user credentials were misused, the Sony breach is similar to the dozens of other recent breaches, from Target to Home Depot to JP Morgan, says Linda S. Millis , a security analyst with government and civilian credentials. | ""We've been told all year long by cybersecurity experts that data breaches like the ones we've seen this year are inevitable. Not so,"" says Millis, who has more than two decades of security analysis service at the National Security Agency, the CIA, the Office of the Director of National Intelligence and the White House. Millis is Senior Vice President, Business Development at SolPass, the developer of an assured identity verification and rights management solution, resulting in a chain of trust to control cyber theft, fraud and hacking.",3,"21, 56, 87",data breach
"6758, SNE",Sony Introduces All New &quot360 Reality Audio&quot Music Experience That Immerses Listeners in a Three,Dimensional Sound Field... - 07-Jan,19,https://www.sony.net/SonyInfo/News/Press/201901/19-002E/index.html,Company Announcements and Releases,"Ole Obermann, Chief Digital Officer & Executive Vice President, Business Development, Warner Music Group, says, “We are always looking for new ways to amplify our artists’ music, and fostering a diversity of listening options is great for our artists and their fans. Sony’s immersive audio tier will add a new dimension to streaming services and offers music lovers a high quality experience they won’t get elsewhere. We are impressed with what we have heard so far, and happy to support the launch of this new technology.”",1,86,Chief digital officer
6758,Sony Introduces All New 360 Reality Audio Music Experience That Immerses Listeners in a Three,Dimensional Sound Field Powered by Object-... - 07,Jan,Sony Corporation,New Products & Services,"Ole Obermann, Chief Digital Officer & Executive Vice President, Business Development, Warner Music Group, says, ""We are always looking for new ways to amplify our artists' music, and fostering a diversity of listening options is great for our artists and their fans. Sony's immersive audio tier will add a new dimension to streaming services and offers music lovers a high quality experience they won't get elsewhere. We are impressed with what we have heard so far, and happy to support the launch of this new technology.""",1,86,Chief digital officer
LUV,Southwest Airlines Announces #12daysofluv Photo Contest!,12-Dec-12,PRN,Southwest Airlines,New Products & Services,"c. Entrants are required to provide truthful information and Southwest will reject and delete any entry that it discovers to be false or fraudulent.  Southwest Airlines will disqualify any entry from individuals who do not meet the eligibility requirements, and Southwest Airlines will also delete any entry received from persons under the age of 13 in compliance with the Children's Online Privacy Protection Act.",1,64,Children's Online Privacy Protection Act
LUV,Southwest Airlines Celebrates LUV Day In A Big Way,-Customers Coast To Coast Surprised With $500 SOUTHWESTGIFTCARDS® - 14,Feb,Southwest Airlines,New Products & Services,"c. Entrants are required to provide truthful information and Sponsor will reject and delete any entry that it discovers to be false or fraudulent. Sponsor will disqualify any entry from individuals who do not meet the eligibility requirements, and will also delete any entry received from persons under the age of 13 in compliance with the Children's Online Privacy Protection Act.",1,61,Children's Online Privacy Protection Act
LUV,Southwest Airlines® And New Kids On The Block Announce NKOTB Party Plane Giveaway To Las Vegas!,24-Jun-14,PRN,Southwest Airlines,"Licensing & Marketing Agreements, New Products & Services","c. Entrants are required to provide truthful information and Southwest Airlines will reject and delete any entry that it discovers to be false or fraudulent.  Southwest Airlines will disqualify any entry from individuals who do not meet the eligibility requirements, and Southwest Airlines will also delete any entry received from persons under the age of 13 in compliance with the Children's Online Privacy Protection Act.",1,65,Children's Online Privacy Protection Act
LUV,Southwest Airlines® Celebrates Success Of The Small Screen As The Official Airline Sponsor Of The ATX Television Festival,6-May-13,PRN,Southwest Airlines,"Licensing & Marketing Agreements, New Products & Services","c. Entrants are required to provide truthful information and Southwest will reject and delete any entry that it discovers to be false or fraudulent.  Southwest Airlines will disqualify any entry from individuals who do not meet the eligibility requirements, and Southwest Airlines will also delete any entry received from persons under the age of 13 in compliance with the Children's Online Privacy Protection Act.",1,64,Children's Online Privacy Protection Act
S,Sprint Appoints Rob Roy Chief Digital Officer to Drive Digital Sales for the Always Connected Customer,5-Dec-16,BW,Sprint,Personnel,"Sprint Appoints Rob Roy Chief Digital Officer to Drive Digital Sales for the Always Connected Customer  Monday, December 05, 2016 03:00:00 PM (GMT) | Rob Roy joins Sprint (NYSE: S) today as Chief Digital Officer to advance the company’s use of online and mobile technology to improve the customer experience. Roy will focus on leveraging multi-touch personalization and marketing automation to build an end-to-end digital customer journey across all device types to deliver a seamless, omnichannel approach for acquiring the always connected customer, driving sales and providing support.",2,"23, 64",Chief digital officer
S,Sprint Expands Digital Efforts with New In,House Agency - 06-Sep,17,Sprint,Product/Service,"“As we continue to transform Sprint, we’re doing things differently and taking bold steps to drive better results and efficiencies, including greatly expanding our digital capabilities,” said Rob Roy, Chief Digital Officer at Sprint. “This emphasis on digital, now with new Sprint-based digital marketing talent, allows us to stay on the cutting edge as we work to better attract and serve our customers.”",1,63,Chief digital officer
SPLS,Staples confirms it is investigating credit card data breach,"Forbes, citing company statement - 21-Oct",14,,"Articles, Reports, Conjecture, Media Summaries, Published Reports","Staples confirms it is investigating credit card data breach - Forbes, citing company statement   Tuesday, October 21, 2014 04:48:00 AM (GMT)",1,21,data breach
SPLS,Staples updates investigation into previously announced data security incident,19-Dec-14,SA,,,"Staples’ data security experts detected that criminals deployed malware to some point-of-sale systems at 115 of its more than 1,400 U.S. retail stores. Overall, the company believes that approximately 1.16M payment cards may have been affected. Specific stores and dates can be found here. Based on its investigation, Staples believes that malware may have allowed access to some transaction data at affected stores, including cardholder names, payment card numbers, expiration dates, and card verification codes. At 113 stores, the malware may have allowed access to this data for purchases made from 10-Aug- 14 through September 16, 2014. At two stores, the malware may have allowed access to data from purchases made from 20-Jul-14 through 16-Sep-14. As a result, Staples is offering free identity protection services, including credit monitoring, identity theft insurance, and a free credit report, to customers who used a payment card at any of the affected stores during the relevant time periods. During the investigation Staples also received reports of fraudulent payment card use related to four stores in Manhattan, New York at various times from April through September 2014. The investigation found no malware or suspicious activity related to the payment systems at those stores. However, Staples is offering free identity protection services, including credit monitoring, identity theft insurance, and a free credit report, to customers who used their payment cards at those stores during specific time periods. StreetAccount notes that the company confirmed in October that it was investigating a credit card data breach. | Staples confirms it is investigating credit card data breach - Forbes, citing company statement",2,"248, 14",data breach
SPLS,"Staples, Inc.(SPLS",US) Schedules Goldman Sachs Global Retailing Conference for 11-September-2013 805 AM ET,26,,,,,,
SPLS,"Staples, Inc.(SPLS",US) Schedules Jefferies Global Consumer Conference for 18-June-2013 1000 AM ET,6,,,,,,
SPLS,"Staples, Inc.(SPLS",US) Schedules Q1 2013 Earnings Call for 22-May-2013 800 AM ET,17,,,,,,
"SBUX, SBUX, US855244109",Starbucks Accelerates Mobile Payment Leadership with Release of Enhanced Starbucks App for iPhone,12-Mar-14,BW,Starbucks Coffee Company,"Product/Service, Photo/Multimedia","“With more than 11 percent of transactions a week now happening with a mobile device in our stores, and nearly 10 million customers currently using our mobile app, we’re thrilled to make the digital experience even easier and more rewarding for our customers and partners,” said Adam Brotman, chief digital officer for Starbucks. “This update to the Starbucks App for iPhone is an important next step in digital innovation at Starbucks and one of the many ways we’ll expand and improve our digital experience in the months to come.”",1,89,Chief digital officer
"SBUX, 07V3WZ",Starbucks Adds Lyft to Growing Network of Companies in Retail's Most Robust Digital Loyalty Ecosystem,22-Jul-15,BW,Starbucks Coffee Company,"Contract/Agreement, Product/Service, Photo/Multimedia","“With Lyft’s presence in 65 cities across the U.S., where we also have Starbucks serving the same communities, we knew this relationship would benefit our partners, Lyft’s drivers as well as our mutual customers that are already coming to Starbucks and using Lyft services,” said Adam Brotman, chief digital officer, Starbucks. “This is a great win win. Our digital loyalty ecosystem will strengthen Lyft’s ability to attract and retain customers in a highly profitable way, while at the same time accelerating the incrementality of redemption of rewards.”",1,87,Chief digital officer
"SBUX, GMCR, 072YRK...","Starbucks and Green Mountain Coffee Roasters Enter Into Expanded, Long",Term Strategic Partnership - 08-May,13,"Green Mountain Coffee Roasters, Inc. and Starbucks Coffee Company","Contract/Agreement, Photo/Multimedia","natural disasters or similar unexpected events, actions of competitors, customer relationships and financial condition, the ability to achieve expected cost savings and margin improvements, the successful acquisition and integration of new businesses, fluctuations in the cost and availability of raw and packaging materials, changes in regulatory requirements, and global economic conditions generally which would include the availability of financing, interest, inflation rates and investment return on retirement plan assets, as well as foreign currency fluctuations, risks associated with our information technology systems, the threat of data breaches or cyber-attacks, and other risks described in the Company's filings with the Securities and Exchange Commission.",1,103,data breach
"SBUX, 072YRK, SBUX",Starbucks Annual Shareholders Meeting Spotlights Record Performance Driven Through the Lens of Humanity,19-Mar-14,BW,Starbucks Coffee Company,"Conference, Event","Starbucks chief digital officer Adam Brotman announced the release of an updated Starbucks mobile app for iPhone®, which will extend the company’s leadership in mobile payment and allow customers to recognize Starbucks partners with a tip directly from the Starbucks app for iPhone® starting today in the U.S. Mobile payment now represents 14 percent of all in-store transactions in the U.S. More than 25 percent of all transactions are made by My Starbucks RewardsTM loyalty members.",1,76,Chief digital officer
"SBUX, SBUX, US855244109",Starbucks Anticipates Busiest Day of the Year for Starbucks Card Purchases,17-Dec-13,BW,Starbucks Coffee Company,"Product/Service, Photo/Multimedia","“One in every 10 American adults received a Starbucks Card last holiday season, and we’re on track for another record performance in Starbucks Card sales, as we celebrate our 13th year of offering Starbucks Cards. We are predicting that this Thursday and next Monday, Dec. 23, will be our busiest days for Cards sales,” said Adam Brotman, chief digital officer for Starbucks.",1,62,Chief digital officer
