identifier,headline,date,source,who_wrote_the_piece,subject,relevant_text,paragraphs,words,keywords
"SBUX, SBUX, US855244109",ADDING MULTIMEDIA Starbucks Introduces Innovative Cross,"Channel, Multi-Brand Loyalty Program and Announces Global Social... - 20",Mar,Starbucks Coffee Company,"Advisory, Earnings, Nonprofit, Photo/Multimedia, Product/Service, Sales, Webcast","The announcement by Adam Brotman, chief digital officer, of an expansion of the company’s loyalty and rewards program, and an industry-first innovation that will enable customers to earn rewards for grocery channel purchases that can be redeemed in Starbucks retail stores and is expected to double the number of customers enrolled in the company’s programs in fiscal 2013. | Starbucks world-class My Starbucks Rewards™ loyalty program continues to resonate with customers, driving increased revenue, traffic and purchases and further differentiating Starbucks from competitors. Adam Brotman, chief digital officer, announced the exciting evolution of the My Starbucks Rewards™ loyalty program into the world’s first cross-channel, multi-brand loyalty program, reflecting further successful execution against the company’s Blueprint for Profitable Growth strategy. Key highlights of the new program:",2,"58, 66",Chief digital officer
S,Apple Business Chat Now Available to Sprint Customers,16-Jan-19,PRN,Sprint,New Products & Services,"""More consumers are embracing quick and easy self-service and digital assistance versus calling customer service through an 800 line,"" said Rob Roy, Sprint chief digital officer. ""Apple Business Chat is an amazing tool for our customers that makes communicating with Sprint fast, easy and stress-free.""",1,45,Chief digital officer
"09MBPH, T, GOOGL...","AT&T, Google, Starbucks Back 'PMA' Wireless Power Ecosystem and Open Standard",29-Oct-12,PRN,Power Matters Alliance,,"Starbucks ""We are always looking for ways to help our customers recharge, both literally and figuratively.  Wireless charging is not only the most convenient and simple way to recharge a mobile device, but it's environmentally friendly – so it makes perfect sense for us to be working with the PMA to create a universal standard for wireless charging,"" said Adam Brotman, chief digital officer of Starbucks.",1,66,Chief digital officer
"AAPL, ABBV, AMZN...",Barron's Summary,3-Feb-18,SA,,"Conjecture, Media Summaries, Barron's Summary, Published Reports","International Trader (Europe):  The increasing frequency of data breaches, along with the EU’s soon-to-hit General Data Protection Regulation, should boost demand for Beazley (BEZ.LN), which insures companies in the event of cyberattacks; The company's valuation does not",1,37,data breach
TFC,BB&T Corp.(BBT,US) Schedules BancAnalysts Association of Boston Conference for 5-November-2015 725 AM ET,29,,,,,,
TFC,BB&T Corp.(BBT,US) Schedules Bank of America Merrill Lynch Banking and Financial Services Conference for 18-November-2015 950 AM ET,10,,,,,,
TFC,BB&T Corp.(BBT,US) Schedules Bank of America Merrill Lynch Future of Financials Conference for 16-November-2016 855 AM ET,9,,,,,,
TFC,BB&T Corp.(BBT,US) Schedules Barclays Global Financial Services Conference for 13-September-2016 1030 AM ET,6,,,,,,
TFC,BB&T Corp.(BBT,US) Schedules Deutsche Bank Global Financial Services Investor Conference for 1-June-2016 1040 AM ET,26,,,,,,
TFC,BB&T Corp.(BBT,US) Schedules Goldman Sachs U.S. Financial Services Conference for 6-December-2016 240 PM ET,30,,,,,,
TFC,BB&T Corp.(BBT,US) Schedules Investor Day for 11-September-2014 900 AM ET,31,,,,,,
TFC,BB&T Corp.(BBT,US) Schedules Morgan Stanley Financials Conference for 13-June-2017 1145 AM ET,6,,,,,,
TFC,BB&T Corp.(BBT,US) Schedules Q2 2016 Earnings Call for 21-July-2016 800 AM ET,27,,,,,,
TFC,BB&T Corp.(BBT,US) Schedules Q3 2017 Earnings Call for 19-October-2017 800 AM ET,3,,,,,,
"S, T, TMUS...",C O R R E C T I O N,#NAME?,Sep,AT&T Inc.; Sprint; T-Mobile; Verizon,,"Developed collaboratively by the four largest U.S. wireless carriers, the prototype reveals the taskforce's approach to multi-factor authentication, which combines the carriers' proprietary, network-based authentication capabilities with other methods to verify a user's identity. Once the user signs up and provides consent, the solution then generates a device-based ID that serves as the user profile at the center of the authentication process.",1,62,Multi-factor authentication
"CPB, GMCR, CPB...",Campbell Soup Company and Green Mountain Coffee Roasters Inc. to Bring Campbell's Soup to Keurig Brewers,4-Sep-13,BW,"Campbell Soup Company and Green Mountain Coffee Roasters, Inc.","Contract/Agreement, Product/Service, Photo/Multimedia","These and other forward-looking statements are based on management's current views and assumptions and involve risks and uncertainties that could significantly affect expected results. Results may be materially affected by external factors such as damage to our reputation or brand name, business interruptions due to natural disasters or similar unexpected events, actions of competitors, customer relationships and financial condition, the ability to achieve expected cost savings and margin improvements, the successful acquisition and integration of new businesses, fluctuations in the cost and availability of raw and packaging materials, changes in regulatory requirements, and global economic conditions generally which would include the availability of financing, interest, inflation rates and investment return on retirement plan assets, as well as foreign currency fluctuations, risks associated with our information technology systems, the threat of data breaches or cyber-attacks, and other risks described in our filings with the Securities and Exchange Commission.",1,147,data breach
"CSCO, 06Z4LS, 0D7N1X","Cisco, Sprint, and Kansas City, MO., Announce Agreement to Deploy Smart+Connected City Framework",8-Jun-15,INW,,,,,,
SPOT,CORRECTING and REPLACING Spotify Technology S.A. Announces Financial Results for Second Quarter 2018,26-Jul-18,BW,Spotify Technology S.A.,"Earnings, Photo/Multimedia","During Q2 we implemented a new data policy which slowed our revenue growth. We course corrected early in Q3 and are seeing a recovery in the business. We did see some GDPR disruption across our European markets during Q2 but seem to be largely past that now. We are, and will remain, GDPR compliant thanks to a terrific cross-functional effort.",1,60,GDPR compliant
"09MBPH, 06VQ9P, SBUX...",Duracell Powermat and Starbucks Expand Wireless Charging in Silicon Valley Area,26-Jul-13,PRNE,,,"""We know that our customers use our cafes in a number of ways beyond buying coffee. For some, it's their home office, for others it's their place to get away and have some time to themselves. More and more customers are using Starbucks as their home base and they are looking to recharge in a number of ways,"" said Adam Brotman, chief digital officer, Starbucks Coffee Company. ""We have seen positive customer response to wireless charging through our tests in Boston, and are pleased to now extend this experience for our customers in the Silicon Valley area.""",1,97,Chief digital officer
"S, 0DNXCV, 0CFXL2","InMobi Acquires U.S. Based Advertising and Data Company, Pinsight Media",17-Oct-18,PRN,InMobi,"Acquisitions, Mergers & Takeovers","""Sprint's partnership with InMobi goes beyond this acquisition. We have been looking for a strategic partner that can deliver the latest digital marketing and mobile advertising technologies, besides having a deep appreciation of regulatory, privacy, and data concerns,"" said Rob Roy, Chief Digital Officer at Sprint. ""This partnership provides Sprint with an innovative partner for driving our marketing success.""",1,59,Chief digital officer
"09MBPH, SBUX, PG",National Rollout of Wireless Charging,by Duracell Powermat - Begins in Starbucks - 12,Jun,Powermat Technologies Ltd.,"Contracts, New Products & Services","""From WiFi and the in-store Starbucks Digital Network to mobile payment and digital music downloads, we have always tried to anticipate our customers' needs early in the adoption curve and provide a world-class solution. We are thrilled to offer our customers that next level of convenience with Powermat wireless charging. Rather than hunting around for an available power outlet, they can seamlessly charge their device while enjoying their favorite food or beverage offering right in our stores,"" said Adam Brotman, chief digital officer at Starbucks. ""We were pleased with the customer response to the pilot tests, and we're now expanding this offering nationally to provide our customers a quality and reliable experience as they use our stores as their respite, their office away from home or as a gathering place with their friends and family.""",1,135,Chief digital officer
"AAL, AC, ALGT...","Ready or not, GDPR takes effect 25",May - WSJ - 24,May,,"Articles, Reports, Conjecture, Media Summaries, Other Regulatory, Published Reports, Regulatory","In a front-page article, the WSJ observes that the General Data Protection Regulation has affected hundreds of thousands of companies, far beyond the Facebook/Google tech giants that have gotten the headlines. Privacy lawyers and consultants tell the WSJ that many companies simply aren't ready; the chief compliance officer for First Solar tells the WSJ that the company underestimated what the law would require of it. Allianz's chief privacy officer tells the WSJ that complying, which has cost the company tens of millions of euros, has been a ""mammoth task;"" Accor's data-protection officer tells the WSJ that listing how the company gathers and processes information will be a ""never-ending process."" A US airline executive, who appointed himself chief data-protection officer, since the law requires one, tells the WSJ that the focus has been on inventorying the personal data for frequent fliers; it's not clear if he's referring to his airline specifically or speaking on behalf of all American airlines. The co-founder of a reservation and guest-information service tells the WSJ that the requirements of the law have surprised some smaller US restaurants, who have information on European tourists who visit and the restaurants therefore need to manage their data as they are tech companies. Editor's note: Though this article seems set to appear in the 25-May print edition of the WSJ, it was published online at 05:30 ET 24-May.",1,228,Chief Privacy Officer
SNBR,Sleep Number Announces First Quarter 2020 Results,22-Apr-20,BW,Sleep Number Corporation Sleep Number Corporation,"Webcast, Conference Call, Earnings","Forward-looking Statements  Statements used in this news release relating to future plans, events, financial results or performance are forward-looking statements subject to certain risks and uncertainties including, among others, such factors as current and future general and industry economic trends and consumer confidence; risks inherent in outbreaks of pandemics or contagious diseases; the effectiveness of our marketing messages; the efficiency of our advertising and promotional efforts; our ability to execute our company-controlled distribution strategy; our ability to achieve and maintain acceptable levels of product and service quality, and acceptable product return and warranty claims rates; our ability to continue to improve and expand our product line; consumer acceptance of our products, product quality, innovation and brand image; industry competition, the emergence of additional competitive products, and the adequacy of our intellectual property rights to protect our products and brand from competitive or infringing activities; claims that our products, processes, advertising, or trademarks infringe the intellectual property rights of others; availability of attractive and cost-effective consumer credit options; pending and unforeseen litigation and the potential for adverse publicity associated with litigation; our manufacturing processes with minimal levels of inventory, which may leave us vulnerable to shortages in supply; our dependence on significant suppliers and third parties and our ability to maintain relationships with key suppliers or third-parties, including several sole- source suppliers or providers of services; rising commodity costs and other inflationary pressures; risks inherent in global sourcing activities, including tariffs, pandemics, strikes, and the potential for shortages in supply; risks of disruption in the operation of our main manufacturing facilities or assembly distribution facilities; increasing government regulation; the adequacy of our and third-party information systems to meet the evolving needs of our business and existing and evolving risks and regulatory standards applicable to data privacy and security; the costs and potential disruptions to our business related to upgrading our management information systems; the vulnerability of our and third-party information systems to attacks by hackers or other cyber threats that could compromise the security of our systems, result in a data breach or disrupt our business; and our ability to attract, retain and motivate qualified management, executive and other key team members, including qualified retail sales professionals and managers. Additional information concerning these and other risks and uncertainties is contained in the company’s filings with the Securities and Exchange Commission (SEC), including the Annual Report on Form 10-K, and other periodic reports filed with the SEC. The company has no obligation to publicly update or revise any of the forward-looking statements in this news release.",1,424,data breach
SNBR,Sleep Number Announces Record First Quarter 2019 Results,17-Apr-19,BW,Sleep Number Corporation,"Earnings, Conference Call, Webcast","Forward-looking Statements Statements used in this news release relating to future plans, events, financial results or performance are forward-looking statements subject to certain risks and uncertainties including, among others, such factors as current and future general and industry economic trends and consumer confidence; the effectiveness of our marketing messages; the efficiency of our advertising and promotional efforts; our ability to execute our company-controlled distribution strategy; our ability to achieve and maintain acceptable levels of product and service quality, and acceptable product return and warranty claims rates; our ability to continue to improve and expand our product line; consumer acceptance of our products, product quality, innovation and brand image; industry competition, the emergence of additional competitive products, and the adequacy of our intellectual property rights to protect our products and brand from competitive or infringing activities; the potential for claims that our products, processes, advertising, or trademarks infringe the intellectual property rights of others; availability of attractive and cost-effective consumer credit options; pending and unforeseen litigation and the potential for adverse publicity associated with litigation; our manufacturing processes with minimal levels of inventory, which may leave us vulnerable to shortages in supply; our dependence on significant suppliers and our ability to maintain relationships with key suppliers, including several sole-source suppliers; the vulnerability of key suppliers to recessionary pressures, labor negotiations, liquidity concerns or other factors; rising commodity costs and other inflationary pressures; risks inherent in global sourcing activities, including tariffs and the potential for shortages in supply; risks of disruption in the operation of either of our two primary manufacturing facilities; increasing government regulations; the adequacy of our and third party information systems to meet the evolving needs of our business and existing and evolving risks and regulatory standards applicable to data privacy and security; the costs, distractions and potential disruptions to our business related to upgrading our management information systems; the vulnerability of our and third-party information systems to attacks by hackers or other cyber threats that could compromise the security of our systems, result in a data breach or disrupt our business; and our ability to attract, retain and motivate qualified management, executive and other key employees, including qualified retail sales professionals and managers. Additional information concerning these and other risks and uncertainties is contained in the company’s filings with the Securities and Exchange Commission (SEC), including the Annual Report on Form 10-K, and other periodic reports filed with the SEC. The company has no obligation to publicly update or revise any of the forward-looking statements in this news release.",1,421,data breach
SNBR,Sleep Number Announces Record Fourth,Quarter and Full-Year 2018 Results - 13,Feb,Sleep Number Corporation,"Earnings, Conference Call, Webcast","Forward-looking Statements Statements used in this news release relating to future plans, events, financial results or performance are forward-looking statements subject to certain risks and uncertainties including, among others, such factors as current and future general and industry economic trends and consumer confidence; the effectiveness of our marketing messages; the efficiency of our advertising and promotional efforts; our ability to execute our company-controlled distribution strategy; our ability to achieve and maintain acceptable levels of product and service quality, and acceptable product return and warranty claims rates; our ability to continue to improve and expand our product line; consumer acceptance of our products, product quality, innovation and brand image; industry competition, the emergence of additional competitive products, and the adequacy of our intellectual property rights to protect our products and brand from competitive or infringing activities; the potential for claims that our products, processes, advertising, or trademarks infringe the intellectual property rights of others; availability of attractive and cost-effective consumer credit options; pending and unforeseen litigation and the potential for adverse publicity associated with litigation; our manufacturing processes with minimal levels of inventory, which may leave us vulnerable to shortages in supply; our dependence on significant suppliers and our ability to maintain relationships with key suppliers, including several sole-source suppliers; the vulnerability of key suppliers to recessionary pressures, labor negotiations, liquidity concerns or other factors; rising commodity costs and other inflationary pressures; risks inherent in global sourcing activities, including tariffs and the potential for shortages in supply; risks of disruption in the operation of either of our two primary manufacturing facilities; increasing government regulations; the adequacy of our and third party information systems to meet the evolving needs of our business and existing and evolving risks and regulatory standards applicable to data privacy and security; the costs, distractions and potential disruptions to our business related to upgrading our management information systems; the vulnerability of our and third-party information systems to attacks by hackers or other cyber threats that could compromise the security of our systems, result in a data breach or disrupt our business; and our ability to attract, retain and motivate qualified management, executive and other key employees, including qualified retail sales professionals and managers. Additional information concerning these and other risks and uncertainties is contained in the company’s filings with the Securities and Exchange Commission (SEC), including the Annual Report on Form 10-K, and other periodic reports filed with the SEC. The company has no obligation to publicly update or revise any of the forward-looking statements in this news release.",1,421,data breach
SNBR,Sleep Number Announces Record Fourth,Quarter and Full-Year 2019 Results - 19,Feb,Sleep Number Corporation,"Webcast, Conference Call, Earnings","Forward-looking Statements  Statements used in this news release relating to future plans, events, financial results or performance are forward-looking statements subject to certain risks and uncertainties including, among others, such factors as current and future general and industry economic trends and consumer confidence; the effectiveness of our marketing messages; the efficiency of our advertising and promotional efforts; our ability to execute our company-controlled distribution strategy; our ability to achieve and maintain acceptable levels of product and service quality, and acceptable product return and warranty claims rates; our ability to continue to improve and expand our product line; consumer acceptance of our products, product quality, innovation and brand image; industry competition, the emergence of additional competitive products, and the adequacy of our intellectual property rights to protect our products and brand from competitive or infringing activities; claims that our products, processes, advertising, or trademarks infringe the intellectual property rights of others; availability of attractive and cost-effective consumer credit options; pending and unforeseen litigation and the potential for adverse publicity associated with litigation; our manufacturing processes with minimal levels of inventory, which may leave us vulnerable to shortages in supply; our dependence on significant suppliers and third parties and our ability to maintain relationships with key suppliers or third-parties, including several sole-source suppliers or providers of services; rising commodity costs and other inflationary pressures; risks inherent in global sourcing activities, including tariffs, pandemics, strikes, and the potential for shortages in supply; risks of disruption in the operation of our main manufacturing facilities or assembly distribution facilities; increasing government regulation; the adequacy of our and third-party information systems to meet the evolving needs of our business and existing and evolving risks and regulatory standards applicable to data privacy and security; the costs and potential disruptions to our business related to upgrading our management information systems; the vulnerability of our and third-party information systems to attacks by hackers or other cyber threats that could compromise the security of our systems, result in a data breach or disrupt our business; and our ability to attract, retain and motivate qualified management, executive and other key team members, including qualified retail sales professionals and managers. Additional information concerning these and other risks and uncertainties is contained in the company’s filings with the Securities and Exchange Commission (SEC), including the Annual Report on Form 10-K, and other periodic reports filed with the SEC. The company has no obligation to publicly update or revise any of the forward-looking statements in this news release.",1,414,data breach
