identifier,headline,date,source,who_wrote_the_piece,subject,relevant_text,paragraphs,words,keywords
UBSG,1Q18 Net Profit up 19% YoY to CHF 1.5bn,23-Apr-18,BW,UBS,,"In the first quarter, UBS announced and started work on integrating environmental, social and governance (ESG) criteria into nearly all of Asset Management's actively managed equity and fixed income portfolios. The firm also announced the launch of the UBS Global Gender Equality ETF, a joint collaboration between Asset Management and Global Wealth Management as part of UBS's commitment to sustainable and impact investing. The ETF is the first of its kind combining gender equality and sustainability. It will dedicate 5% of its management fee to philanthropic projects via the UBS Optimus Foundation to support the empowerment of women and girls.",1,100,gender equality
TFCFA,21st Century Fox anticipating settlements with some accusers in Roger Ailes harassment probe,#NAME?,Aug,,"Articles, Reports, Conjecture, Media Summaries, Published Reports  Related Stories:","The WSJ, citing people familiar with the matter, reports that the number of women who have come forward in the ongoing investigation reaches into the double-digits. Victims of sexual harassment have three years from the time of the misconduct to sue in New York state and New York City, and settling within that three year window could forestall further litigation, the article notes.",1,63,sexual harassment
"TFCFA, 064H26",21st Century Fox Establishes the Fox News Workplace Professionalism and Inclusion Council,20-Nov-17,BW,21st Century Fox,Product/Service,"The Council was created through more than a year of engagement by 21CF with its shareholder, the City of Monroe Employees’ Retirement System, to address a complaint filed today by the shareholder in the State of Delaware. The matter has now been resolved by the parties, reflecting 21CF and Fox News’ affirmative commitment to a business practice and corporate value of zero tolerance for sexual harassment, race discrimination, and all other forms of discrimination prohibited by law, and a corporate policy that creates a safe, productive and welcoming workplace for all employees. The settlement also includes payment of $90 million, less any court awarded attorneys’ fees and expenses, from third party insurers to 21CF. | Honorable Barbara Jones, former judge in the U.S. District Court for the Southern District of New York, she runs a practice on corporate monitorships, compliance issues, internal investigations and arbitrations and mediations. Judge Jones chaired the Response Systems to Adult Sexual Assault Crimes Panel, created by Congress in the National Defense Authorization Act for 2013, aimed at assessing the investigation, prosecution, and adjudication of sexual assaults in the military. | Virgil Smith, who served as Vice President of Talent Acquisition and Diversity at the Gannett Company, is currently Principal Consultant of the Smith Edwards Group, LLC, and consultant for the Asian American Journalists Association.",3,"114, 69, 34","sexual assault, sexual harassment, diversity"
TFCFA,21st Century Fox issues statement regarding reports regarding Roger Ailes,#NAME?,Jul,,"Corporate Actions, Management Changes  Related Stories:","StreetAccount notes that NY Magazine reported earlier this afternoon that the Murdochs have decided to remove Ailes, citing two sources briefed on a sexual harassment investigation of Ailes.",1,28,sexual harassment
"7203, TM",Al Smith Named Toyota's New Social Innovation Group Vice President,10-Apr-17,PRN,Toyota Motor North America,,"""I'm thrilled Al has joined Toyota's Social Innovation team, bringing with him a deep understanding of the principles and behaviors that underlie the Toyota Way, including respect for people,"" said Chris Reynolds, executive vice president, corporate resources and chief diversity officer, TMNA. ""Al's experience in financial services, sales, operations, and customer service lay the foundation we need in Social Innovation to better serve our stakeholders – from team members, dealers, investors, local communities and customers."" | PLANO, Texas, April 10, 2017 /PRNewswire/ -- Albert (Al) Smith, Jr. has been named group vice president, Social Innovation for Toyota Motor North America (TMNA). He is responsible for Toyota's diversity and inclusion, shared impact, and environmental sustainability functions across North America . | ""Social innovation and diversity is a vital part of Toyota's promise to give back to the communities in which we operate and respect all people,"" said Smith. ""I am honored to take on this role, and look forward to leading key Social Innovation programs, such as in STEAM-focused education, Buckle up for Life, and TeenDrive365.""",3,"75, 43, 55","Chief Diversity Officer, diversity, Diversity and Inclusion"
TRU,Americans Support Law Enforcement's Use of Data Fusion Tools to Help Solve Crimes Faster,17-Oct-16,INW,,Law Enforcement,"Violent crimes (murder, battery, sexual assault) Finding missing and abducted children Vices (illegal gambling, prostitution, etc) Identity theft Insurance fraud",1,20,sexual assault
TFC,BB&T Corp.(BBT,US) Schedules BancAnalysts Association of Boston Conference for 7-November-2019 810 AM ET,25,,,,0,0,
TFC,BB&T Corp.(BBT,US) Schedules Q2 2019 Earnings Call for 18-July-2019 800 AM ET,10,,,,0,0,
UL,"Catalyst Award Honors Global Initiatives at Alcoa Inc., The Coca","Cola Company, and Unilever for Advancing Women and Business - 19-Mar",13,http://t.co/qZBA4vblNh,Company Announcements and Releases,"ABOUT THE CATALYST AWARD The Catalyst Award annually honors innovative organizational approaches with proven, measurable results that address the recruitment, development, and advancement of all women, including diverse women. Since 1987, Catalyst has recognized 82 initiatives at 76 organizations from around the world. These groundbreaking diversity and inclusion programs have changed workplaces, communities, and lives. | Alcoa Inc.’s initiative,  Building Opportunities for Women in a “Hard Hat” Company , breaks down barriers in a male-dominated industry and achieves greater gender representation through an aggressive diversity agenda that develops women supervisors and leaders in Alcoa’s refineries, smelters, and factories worldwide. “Talent is the only truly sustainable advantage,” said Alcoa Chairman and CEO Klaus Kleinfeld. “To get the best talent, you must have diversity of thought, experience, skills and background. We are extremely proud to be one of the first ‘hard hat’ companies to earn the prestigious Catalyst Award, and we plan to build on this achievement and extend diverse talent deeper into our organization in the future.” | The Coca-Cola Company’s  Global Women’s Initiative: Women as the Real Drivers of the 21 st  Century is a strategic, internal and external initiative focused on fueling the advancement of women as dynamic leaders and entrepreneurs across the organization and in communities throughout the globe. “We are truly honored to receive this prestigious award which validates that we are on the right track toward empowering women inside our company and across our value chain,” said Muhtar Kent , Chairman and CEO, The Coca- Cola Company. “We are proud to be recognized for our accomplishments, but we realize there is still a great deal of work to do to reach our goal of achieving true diversity.” | Unilever builds on its strong foundation of cultural diversity and multinational expertise with its  Global Reach With Local Roots: Creating a Gender-Balanced Workforce in Different Cultural Contexts initiative, which accelerates the advancement of high-potential women across different regions by promoting a culture of inclusion and creating flexible “anytime, anywhere” work-life programs. Unilever CEO Paul Polman said, “We are delighted to be recognized by Catalyst for our long-standing commitment to gender balance. From our successful mentoring program to our rollout of flexible working, I am very encouraged by the progress we are making to help both men and women at Unilever reach their full potential. To achieve our company’s ambition of doubling the size of our business while reducing our environmental impact and increasing our positive social impact, it is crucial that we build a diverse and engaged workforce where everybody can develop to his or her full potential. The benefits of having a gender-balanced organization are plain to see; it helps power creativity and innovation, deepens the talent pool and allows us to better serve our diverse consumer base.”",4,"55, 110, 114, 179","diversity, Diversity and Inclusion"
DIS,Disney Empowers Aspiring Young Filmmakers To Create Global #DreamBigPrincess Video Series Celebrating Female Trailblazers,9-Jul-18,PRN,"Disney Parks, Experiences and Consumer Products","Corporate Social Responsibility, Human Interest Groups","About Girl Up Girl Up is a global leadership development initiative, positioning girls to be leaders in the movement for gender equality. With resources in five languages and more than 2,200 Girl Up Clubs in over 100 countries, we've trained 40,000 girls of all backgrounds to create tangible change for girls everywhere. Girl Up provides leadership training and gives girls tools to become gender equality advocates and activists. Through our programs, girls broaden their social impact skill set, receive a platform to tell their stories, and apply STEM for social good. Our girl leaders create real policy change at local and national levels, raise millions of dollars to support United Nations programs that reach tens of thousands of girls around the world, and build community-based movements. Girl Up is an initiative of the UN Foundation, working across a global community of partners to achieve gender equality worldwide. Learn more at GirlUp.org.",1,151,gender equality
DIS,Disney Institute Hosts First,Ever Customer Experience Summit at Walt Disney World Resort - 05-May,16,Disney Institute,,"George A. Kalogridis, president, Walt Disney World Resort. Karl Holz, president, New Vacation Operations and Disney Cruise Line. Paul Richardson, senior vice president, human resources, ESPN and chief diversity officer, The Walt Disney Company.",1,34,Chief Diversity Officer
"DIS, 0700QQ",Disney Supports Young Leaders with Half,a-Million Dollar Commitment to the Asian & Pacific Islander American Scholarship Fund - 20,Oct,The Walt Disney Company,"Product/Service, Nonprofit","“Disney is proud to support young Asian and Pacific Islander leaders in achieving their dreams of a higher education,” said Paul Richardson, chief diversity officer, The Walt Disney Company. “By giving these promising students the resources and tools they need to earn a college degree, we enable them to create a better, brighter future for us all.”",1,57,Chief Diversity Officer
"DIS, 074NPH, 064X9Y",Disney's Empowering #DreamBigPrincess Photography Campaign to Be Exhibited at United Nations Headquarters in New York,9-Nov-17,BW,Disney Consumer Products,"Product/Service, Photo/Multimedia","The campaign brought the #DreamBigPrincess message to life in a multitude of ways, including highlighting women who’ve achieved success in the face of adversity, young Girl Up Teen Advisors who’ve already helped make a positive impact on the world, and girls at play who illustrate the importance of imagination in childhood. Thousands of people also posted their own inspiring images using #DreamBigPrincess, a select number of which will be exhibited alongside the original photographs at the United Nations and supported by UNICEF, which works to protect children’s rights, to help meet their basic needs and to expand their opportunities to reach their full potential. A core component is to advance gender equality and the rights of girls.",1,117,gender equality
"7203, TM, 07T8MY",DiversityInc Honors Toyota as a Top 50 Company for Diversity,3-May-13,BW,Toyota,Award,"Highlights of Toyota’s recent investments in corporate diversity and inclusion include: | This news comes on the heels of other accolades and honors for Toyota’s corporate diversity and inclusion efforts. It also received the prestigious “Corporation of the Year” award from the National Minority Supplier Development Council (NMSDC). Additionally, Toyota is a member of The Billion Dollar Roundtable, which recognizes business with more than $1 billion in annual spending with certified ethnic and women-owned suppliers. | DiversityInc Honors Toyota as a Top 50 Company for Diversity  Friday, May 03, 2013 05:00:00 PM (GMT) | DiversityInc announced it has named Toyota one of its Top 50 Companies for Diversity®. This list recognizes businesses for their ongoing commitments to diversity in four primary areas: CEO commitment, human capital, supplier diversity, and corporate and organizational communications. Toyota placed 48 out of almost 900 companies vying for inclusion on this year’s list, from industries as diverse as banking, manufacturing, retail and consulting. | “We are honored to be included as a Top 50 Company for Diversity by DiversityInc,” said Jim Lentz, Chief Executive Officer, Toyota North America Region. “At Toyota, we believe inclusiveness and diversity are essential to our business and act as a strong catalyst to drive our success.” | ""Toyota Motor North America's increasing emphasis on creating a diverse talent pipeline has paid off,” added DiversityInc CEO Luke Visconti. | In addition to recognizing Toyota as a Top 50 Company for Diversity, DiversityInc also is honoring the company with its inaugural award of Top Company for Employee Engagement. The publication also ranked Toyota eighth on its list of Top 10 Companies for LGBT Employees. | About DiversityInc | DiversityInc was founded in 1998 as a web-based publication, and a print publication was launched in 2002. To see the full ranking of the 2012 DiversityInc Top 50 Companies for Diversity as well as more information on the methodology, visit www.DiversityInc.com/top50.",9,"11, 63, 17, 64, 47, 20, 44, 2, 41","diversity, Diversity and Inclusion"
"S.XX1, TM","DoSomething.org Teams Up With Sprint, Toyota, And Olivia Munn To Fight Texting And Driving Through A Unique Campaign Called Thumb Wars",29-May-13,PRN,DoSomething.org,"Corporate Social Responsibility, Not For Profit Organizations, Human Interest Groups","""At Toyota, we are deeply committed to helping teen drivers stay safe,"" said Latondra Newton, Toyota group vice president of philanthropy and chief diversity officer. ""We are very excited to partner with DoSomething.org on this year's Thumb Wars to raise awareness of the dangers of distracted driving with teens in a memorable and engaging way.""",1,55,Chief Diversity Officer
"ULVR, UL",Dove and Dove Men+Care accelerate action towards unlocking the power of gender equality,5-Jun-19,CNW,Unilever Canada,,"Dove Men+Care, in partnership with global gender justice organization  Promundo, is launching new proprietary research and an accompanying global white paper, which looks at the impact of paternity leave on gender equality and the many benefits that employers, parents and society as a whole get when men are involved caregivers and have greater access to paid leave. | Promundo is a global leader in promoting gender justice. It believes that working with men and boys to transform harmful gender norms and unequal power dynamics is a critical part of the solution to achieving gender equality. For the empowerment of women and girls to continue advancing, men and boys must see themselves as partners in the process.  | Dove and Dove Men+Care accelerate action towards unlocking the power of gender equality   Wednesday, June 05, 2019 02:00:00 PM (GMT) | VANCOUVER, June 5, 2019 /CNW/ - At this year's  Women Deliver Conference – the world's largest conference on gender equality and the health, rights and wellbeing of girls and women – leading Unilever brands Dove and Dove Men+Care are demonstrating how they are taking accelerated action towards unlocking the power of gender equality, driving progress and change through a number of new initiatives. | Empowering women and girls is one of the most effective ways to accelerate sustainable development and unlock economic growth.1 However, despite being a fundamental human right and a necessary foundation for a peaceful, prosperous and sustainable world, gender equality remains hundreds of years away, in many cases thanks to harmful norms and stereotypes, including unconscious bias. | Globally, women spend significantly more time than men – sometimes up to ten times as much – on unpaid care, volunteer, and domestic work. The existence of a paternity leave policy alongside the encouragement of men to be involved caregivers is a proven solution to support the redistribution of unpaid care work, a significant enabler of gender equality. New research across seven countries (Argentina, Brazil, Canada, Japan, Netherlands, UK, and US) finds that 85 percent3 of fathers say that they would be willing to do anything to be very involved in the early weeks and months of caring for their newly born or adopted child, yet face significant barriers in doing so: | Dove Men+Care's global white paper  Unleashing Men's Power To Care Through Paternity Leave  builds on the findings of State of the World's Fathers  – a biennial study examining global issues surrounding care work – produced by Promundo, which explores the actions required to unstereotype and provide expanded opportunities for men's care, and to advance gender equality. This includes improving access to and uptake of paid paternity leave globally. | In addition, Dove Men+Care and Promundo will launch the Paternity Leave Corporate Task Force , a member-led and owned alliance that aims to identify, promote and bring to scale commercially and societally sustainable solutions that will result in improved access and uptake of paternity leave for all men. The Task Force brings together progressive companies under one vision: their aspiration to help create a world in which dads are enabled and empowered to take paternity leave, so the benefits of men's care and greater gender equality are felt at home, at work and in society more widely. | 1.  Portray women with honesty, diversity and respect. We feature women of different ages, sizes,",9,"57, 58, 20, 63, 56, 112, 68, 97, 15","gender justice, diversity, gender equality"
"064Z6P, 7203, 07T8MY",Embracing Diversity and Inclusion as a Competitive Advantage in the Marketplace,3-May-18,PRN,Toyota Motor North America,"Corporate Social Responsibility, Human Interest Groups","""Whether it's the diversity of our people, of our product offerings, or wide-ranging ideas we have for the future of mobility, Toyota is building diversity and inclusion into everything we do,"" said Chris Reynolds, executive vice president of corporate resources and chief diversity officer of Toyota Motor North American (TMNA). ""We are proud to be among the DiversityInc's top 25 companies, underscoring our commitment to customers, dealers, team members, suppliers and society."" | Embracing Diversity and Inclusion as a Competitive Advantage in the Marketplace   Thursday, May 03, 2018 01:00:00 PM (GMT) | The DiversityInc Top 50 list, issued yearly since 2001, recognizes the nation's top companies for diversity and inclusion management. These companies excel in such areas as hiring, retaining and promoting women, minorities, people with disabilities, LGBT and veterans. The survey ranked the practices of TMNA and Toyota Financial Services (TFS) together. | This year marks the first time Toyota has cracked the top half on the 2018 DiversityInc Top 50 Companies for Diversity list, earning 25th place. For the past 11 years, the company has been included in the organization's list. In addition, Toyota was recognized for other Diversity & Inclusion initiatives, specifically for the company's achievements in supplier diversity, plus its commitment to hiring LGBT and veteran team members. | ""We know when our organization is well-represented with people of different backgrounds, varying perspectives, and diversity of thought, we will always be better in responding to opportunities and solving challenges,"" said Mike Groff, president and CEO of TFS. The financial arm of the organization recently completed its fourth Diversity & Inclusion Bond Offering in the amount of $1.25 billion, setting a record for the largest corporate bond offering in which in which minority, women, and veteran-owned firms play a lead role. Additionally, TMNA spends over $3 billion directly with over 300 diverse suppliers and Toyota's suppliers spend nearly $1 billion with over 1500 diverse suppliers at the Tier 2 level. | Toyota Earns Top 25 DiversityInc Ranking, Recognition for Supplier Diversity, LGBT Employee and Veterans Programs | NEW YORK , May 3, 2018 /PRNewswire/ -- Embracing diversity in the workforce and ensuring inclusivity have grown to become significant advantages for top-performing companies across the country. Studies have shown such companies have a greater-than-average return for their shareholders, are more productive and innovative. | Special Recognition for Supplier, LGBT and Veterans Diversity | Companies on the Veterans list demonstrate diversity-management initiatives that help with recruiting and promoting veterans, measuring percentage of workforce, new hires and managers who are veterans, recruitment efforts aimed at veterans, and hiring practices including accommodations for spouses of veterans, among other areas. | The DiversityInc Top 50 Companies for Diversity rankings assessed four key areas of diversity management: recruitment, talent development, senior leadership commitment and supplier diversity. | About DiversityInc | The mission of DiversityInc is to bring education and clarity to the business benefits of diversity. The DiversityInc Top 50 Companies for Diversity list began in 2001, when many corporations were beginning to understand the business value of diversity-management initiatives. The 2018 Top 50 Companies for Diversity results will be featured on DiversityInc.com and in DiversityInc magazine. DiversityInc is a VA certified veteran-owned business and a USBLN certified business owned by a person with a disability. For more information, visit www.diversityinc.com and follow us on  Facebook, Twitter and LinkedIn @DiversityInc. |  View original content with multimedia: http://www.prnewswire.com/news-releases/embracing-diversity-and-",13,"72, 18, 51, 68, 110, 15, 45, 8, 43, 24, 2, 90, 6","Chief Diversity Officer, diversity, Diversity and Inclusion, Diversity & Inclusion"
"DIS, US254687106","Emily Blunt, Jennifer Lee, Kathleen Kennedy, Jo Malone CBE, Robin Roberts & Victoria Arlen Join Forces with Renowned Athletes, ...",10-Oct-18,BW,The Walt Disney Company,"Product/Service, Photo/Multimedia","gender equality. With resources in five languages and 2,500 Girl Up Clubs in more than 100 countries, we’ve trained 40,000 girls of all backgrounds to create tangible change for girls everywhere. Girl Up provides leadership training and gives girls tools to become gender equality advocates and activists. Through our programs, girls broaden their social impact skill set, benefit from a platform to tell their stories, and apply STEM for social good. Our girl leaders create real policy change at local and national levels, help raise millions of dollars to support United Nations programs that reach tens of thousands of girls around the world, and build community-based movements. Girl Up was founded by the United Nations Foundation in 2010 and continues to work across a global community of partners to achieve gender equality worldwide. Learn more at GirlUp.org.",1,137,gender equality
TFCFA,Federal government expanding investigation of Fox News culture,WSJ - 05-May,17,,"Articles, Reports, Conjecture, Media Summaries, Published Reports","People familiar with the probe tell the WSJ that current and former Fox News employees have been interviewed as authorities try to determine how settlement payments for sexual-harassment allegations were structured and which executives played roles in the payments. One source tells the WSJ that the investigators seem to be interested in intimidation tactics that former CEO Roger Ailes signed off on. The sources tell the WSJ that the investigators are in the securities unit of the US attorney’s office, and no prosecution will necessarily follow. People with knowledge of the matter tell the WSJ that 21st Century Fox CFO John Nallen has met with prosecutors.",1,106,sexual-harassment
TFCFA,Federal government looking into 21st Century Fox's sexual,harassment disclosures - WSJ - 15,Feb,,"Articles, Reports, Conjecture, Media Summaries, Other Regulatory, Published Reports, Regulatory","People familiar with the matter tell the WSJ that the company may not have sufficiently informed investors about claims against former Fox News chairman/CEO Roger Ailes. The sources tell the WSJ that the government is thought to be looking at settlements from before former Fox News anchor Gretchen Carlson's lawsuit last summer. One of the sources tells the WSJ that an internal Fox probe in 2016 apparently found that Fox News had a fund to pay people who claimed sexual harassment, but the fund's name didn't accurately reflect its purpose. A person familiar with the matter tells the WSJ that prosecutors are probably trying to figure out whether the company's nomenclature constituted fraud. The WSJ reports that Fox News says neither it nor 21st Century Fox has been subpoenaed. | Federal government looking into 21st Century Fox's sexual-harassment disclosures - WSJ   Thursday, February 16, 2017 03:00:42 AM (GMT)",2,"129, 18","sexual harassment, sexual-harassment"
