identifier,headline,date,source,who_wrote_the_piece,subject,relevant_text,paragraphs,words,keywords
TRV,Travelers Recognized for Diverse and Inclusive Culture,3-May-17,BW,"The Travelers Companies, Inc.",Award,"The company’s diversity and inclusion efforts reach employees and the community in a number of ways, including: | “Having an environment of total inclusion is essential to our business,” said Fred Colon, Chief Diversity & Inclusion Officer at Travelers. “We’re focused on attracting and retaining the best possible talent, and this recognition speaks to our level of commitment to fostering a diverse, inclusive and engaged workforce.” | Named a Noteworthy Company by DiversityInc for fifth consecutive year | The Travelers Companies, Inc. (NYSE: TRV) today announced that it has been named to the list of Noteworthy Companies by DiversityInc for the fifth consecutive year. Companies are chosen based on an annual survey that measures talent pipeline and development, leadership accountability and supplier diversity. More than 1,800 companies participated in this year’s survey. | Employee-led diversity networks focused on attracting, retaining and developing all Travelers employees. | Appreciating Differences, a live half-day diversity education training program that all employees attend to examine their personal biases and engage in learning strategies to become diversity change agents. | For more information about diversity at Travelers, visit travelers.com/diversity. To learn more about the DiversityInc survey, click here.",7,"17, 48, 10, 54, 12, 28, 18","diversity, Diversity and Inclusion, Diversity & Inclusion"
TRV,Travelers Recognized for Diverse and Inclusive Culture,24-Feb-20,BW,"The Travelers Companies, Inc.",Award,"For more information about diversity and inclusion at Travelers, visit travelers.com/diversity. | “We’re focused on creating a workplace that brings together people with different backgrounds and ensuring that our employees feel valued, respected, supported and empowered,” said Fred Colon, Chief Diversity & Inclusion Officer at Travelers. “From our hiring efforts to our training and development programs, we’re fostering an inclusive culture where all employees have the opportunity to thrive.” | Diversity Networks:  The company supports eight Diversity Networks, which are employee-led groups focused on attracting, retaining and developing all employees through networking, mentorship and community volunteer opportunities. Its LGBT & Allies network was launched in 2012 to raise awareness of LGBT-related issues through education, networking and business initiatives.  | Appreciating Differences: Travelers requires all employees to complete an interactive diversity education program to help them better understand how to leverage differences for shared success.  | Inclusive Leadership Performance Objectives: All managers’ annual performance objectives include two diversity-related goals: to purposefully foster a work environment where all employees are included and appreciated, and to attract, retain, engage and develop employees from all cultures and backgrounds.  | Diversity Speaks: The company sponsors events designed to create a culture that embraces the power of difference. The events feature employees and guest speakers who share personal stories and provide different experiences and viewpoints.",6,"11, 57, 48, 25, 39, 34","diversity, Diversity and Inclusion, Diversity & Inclusion"
TRV,Travelers Reports First Quarter 2020 Net Income per Diluted Share of $2.33 and Return on Equity of 9.4%,21-Apr-20,BW,"The Travelers Companies, Inc.","Webcast, Conference Call, Earnings","the Company’s outlook and its future results of operations and financial condition (including, among other things, anticipated premium volume, premium rates, renewal premium changes, underwriting margins and underlying underwriting margins, net and core income, investment income and performance, loss costs, return on equity, core return on equity and expected current returns, and combined ratios and underlying combined ratios); the impact of COVID-19 and related economic conditions, including the Company’s assessment of the vulnerability of certain categories of investments to the economic disruptions associated with COVID-19; share repurchase plans; future pension plan contributions; the sufficiency of the Company’s asbestos and other reserves; the impact of emerging claims issues as well as other insurance and non-insurance litigation; the potential benefit associated with the Company’s ability to recover on its subrogation claims; the cost and availability of reinsurance coverage; catastrophe losses; the impact of investment (including changes in interest rates), economic (including inflation, changes in tax law, changes in commodity prices and fluctuations in foreign currency exchange rates) and underwriting market conditions; strategic and operational initiatives to improve profitability and competitiveness; the Company’s competitive advantages; new product offerings; the impact of new or potential regulations imposed or to be imposed by the United States or other nations, including tariffs or other barriers to international trade; and the impact of developments in the tort environment, such as increased attorney involvement in insurance claims and legislation allowing victims of sexual abuse to file or proceed with claims that otherwise would have been time-barred.",1,248,sexual abuse
TRV,Travelers Reports Record Net and Core Income per Diluted Share in Fourth Quarter 2019,23-Jan-20,BW,"The Travelers Companies, Inc.","Webcast, Conference Call, Earnings, Dividend","the Company’s outlook and its future results of operations and financial condition (including, among other things, anticipated premium volume, premium rates, renewal premium changes, underwriting margins and underlying underwriting margins, net and core income, investment income and performance, loss costs, return on equity, core return on equity and expected current returns, and combined ratios and underlying combined ratios); share repurchase plans; future pension plan contributions; the sufficiency of the Company’s asbestos and other reserves; the impact of emerging claims issues as well as other insurance and non-insurance litigation; the potential benefit associated with the Company’s ability to recover on its subrogation claims; the cost and availability of reinsurance coverage; catastrophe losses; the impact of investment (including changes in interest rates), economic (including inflation, changes in tax law, changes in commodity prices and fluctuations in foreign currency exchange rates) and underwriting market conditions; strategic and operational initiatives to improve profitability and competitiveness; the Company’s competitive advantages; new product offerings; the impact of new or potential regulations imposed or to be imposed by the United States or other nations, including tariffs or other barriers to international trade; and the impact of developments in the tort environment, such as increased attorney involvement in insurance claims and legislation allowing victims of sexual abuse to file or proceed with claims that otherwise would have been time-barred.",1,221,sexual abuse
TRV,"Travelers Reports Second Quarter 2019 Net Income per Diluted Share of $2.10, up 9%, and Return on Equity of 9.0%",23-Jul-19,BW,"The Travelers Companies, Inc.","Webcast, Conference Call, Earnings",the impact of legislation enacted or to be enacted by states allowing victims of sexual abuse to file or proceed with claims that otherwise would have been time-barred.,1,28,sexual abuse
TRV,"Travelers Reports Strong First Quarter 2019 Net Income per Diluted Share of $2.99, up 24%, and Return on Equity of 13.5%",18-Apr-19,BW,"The Travelers Companies, Inc.","Dividend, Earnings, Conference Call, Webcast",the impact of legislation enacted or to be enacted by states allowing victims of sexual abuse to file or proceed with claims that otherwise would have been time-barred.,1,28,sexual abuse
TRV,Travelers Reports Third Quarter 2019 Net Income per Diluted Share of $1.50 and Return on Equity of 6.2%,22-Oct-19,BW,"The Travelers Companies, Inc.","Earnings, Conference Call, Webcast","the impact of developments in the tort environment, including legislation enacted or to be enacted by states allowing victims of sexual abuse to file or proceed with claims that otherwise would have been time-barred.",1,34,sexual abuse
TZOO,Travelzoo and Tina Brown Respond to News That Women Lose Ground on New Board Seats for First Time in 8 Years,21-Jun-17,PRN,Travelzoo,Human Interest Groups,"NEW YORK , June 21, 2017 /PRNewswire/ -- In response to the 2017 Board Monitor released yesterday by executive search firm Heidrick & Struggles showing that gender equality has taken a step back in the board rooms of Fortune 500 companies, Tina Brown CBE , creator of the Women in the World Summit, and Travelzoo's chairman Ralph Bartel expressed their regret and astonishment. Heidrick & Struggles' report found that last year the number of open board seats awarded to women declined for the first time since 2009. Travelzoo recently announced that is has become the only U.S. listed company to have 80% of its board of director seats held by women.",1,111,gender equality
TZOO,Travelzoo Partners with Lean In Canada to Advance Diversity and Inclusion in the Workplace,27-Jun-19,PRN,Travelzoo,"Contracts, Corporate Social Responsibility","""We are thrilled to be partnering with Lean In Canada,"" said Lara Barlow , General Manager of Travelzoo in Canada. ""Gender equality at work place continues to be an important issue, and one that we cannot wait to act on. At Travelzoo, we thrive to provide equal opportunities for all employees by creating an open-minded, inclusive and diverse working environment."" | ""We always look to partner with organizations that share our values, and we are very excited about partnering with Travelzoo,"" said Beverly Altberg, Board President of Lean In Canada. ""We love to work with companies that are committed to advancing gender equality and we look forward to supporting the team at Travelzoo in setting a high bar for the industry."" | ""We are proud of Travelzoo's track record around gender equality,"" added Barlow. ""We believe that a more diverse workforce will stimulate higher levels of creativity, and this will enable us to better serve our members with more inspiring ideas and irresistible travel offers."" | Travelzoo Partners with Lean In Canada to Advance Diversity and Inclusion in the Workplace   Thursday, June 27, 2019 04:30:00 PM (GMT) | TORONTO, June 27, 2019 /PRNewswire/ -- Travelzoo® (NASDAQ: TZOO), a global publisher of exclusive offers and experiences for members, has announced a new partnership with nonprofit organization Lean In Canada as part of its long-standing commitment to advancing diversity and inclusion in the workplace. | To support diversity and inclusion in the workplace, please join the Travelzoo family today! | Through its work with Lean In Canada, Travelzoo seeks to empower employees across its  Vancouver and Toronto offices with the advanced knowledge and tools needed to succeed in the workplace. This includes training for employees on topics such as unconscious bias, as well as participation in the Lean In Canada Mentorship Program which gives junior female employees at Travelzoo rare access to mentors in executive leadership roles in other industries, to encourage diversity of thought. | In May 2017, Travelzoo announced it had become the only U.S.-listed company to have 80% of its board seats held by women—the highest female-to-male ratio of any NASDAQ- or NYSE-listed company. This landmark news was marked by a panel discussion featuring Travelzoo's female board members and moderated by Tina Brown—an event that won Gold at the Stevie Awards for Women in Business later that year. Travelzoo's dedication to diversity continues with the announcement of its partnership with Lean In Canada. | partners-with-lean-in-canada-to-advance-diversity-and-inclusion-in-the-workplace-300876305.html",9,"60, 60, 43, 21, 44, 14, 75, 80, 1","diversity, Diversity and Inclusion, gender equality"
TFCFA,Twenty,"First Century Fox, Inc.  CtW Investment Group - Activist Campaign to Remove Directors Announced - 12",Oct,,,"On 10-12-2017, CtW Investment Group sent a letter to Twenty-First Century Fox, Inc.'s board and expressed  disappointment with the board's failure to address the ethics crisis perpetuated by the leadership of Fox News. CtW  requested the company to create a Corporate Responsibility and Compliance Committee which would review  human capital management practices at FOX and its subsidiaries, and to develop a board refreshment plan,  including Roderick Eddington's resignation, addition of two directors, reducing insiders to increase independence in  addition to increasing the board's gender diversity. CtW noted the financial, regulatory, and reputational costs  associated with the crisis, including the $50 million settlement paid to sexual harassment and discriminations claims  in FY2017, and criticized the company's lax corporate controls as well as the board's slow response to the scandal.  CtW said that it would be unable to support the re-election of the Audit Committee members if the company would  not commit to the suggested changes before 10-26-2017.",1,156,sexual harassment
TFCFA,Twenty,"First Century Fox, Inc.  CtW Investment Group - Company Makes Material Announcement Regarding Activist Campaign - 15",Nov,,,"On 10-12-2017, CtW Investment Group sent a letter to Twenty-First Century Fox, Inc.'s board and expressed  disappointment with the board's failure to address the ethics crisis perpetuated by the leadership of Fox News. CtW  requested the company to create a Corporate Responsibility and Compliance Committee which would review  human capital management practices at FOX and its subsidiaries, and to develop a board refreshment plan,  including Roderick Eddington's resignation, addition of two directors, reducing insiders to increase independence in  addition to increasing the board's gender diversity. CtW noted the financial, regulatory, and reputational costs  associated with the crisis, including the $50 million settlement paid to sexual harassment and discriminations claims  in FY2017, and criticized the company's lax corporate controls as well as the board's slow response to the scandal.  CtW said that it would be unable to support the re-election of the Audit Committee members if the company would  not commit to the suggested changes before 10-26-2017.",1,156,sexual harassment
"TFCFA, TFCF",TWENTY,"FIRST CENTURY FOX INVESTIGATION INITIATED BY FORMER LOUISIANA ATTORNEY GENERAL  Kahn Swick & Foti, LLC Investigates the Off... - 31-Mar",17,"Kahn Swick & Foti, LLC",,"Throughout 2016, a series of high-profile sexual harassment complaints were lodged against former head of Fox News Roger Ailes and other Fox executives, resulting in litigation and/or significant settlements paid by Fox, including sexual harassment lawsuits filed by former Fox News anchor Gretchen Carlson and former The Five host Andrea Tantaros . The events culminated with Mr. Ailes resignation on  July 21, 2016 and, more recently, with an ongoing grand jury investigation being brought by the U.S. Attorney's office for the Southern District of New York .",1,87,sexual harassment
"TFCFA, TFCF",TWENTY,"FIRST CENTURY FOX INVESTIGATION INITIATED by Former Louisiana Attorney General Kahn Swick & Foti, LLC Investigates the Offic... - 14-Apr",17,"Kahn Swick & Foti, LLC",Lawsuit,"Throughout 2016, a series of high-profile sexual harassment complaints were lodged against former head of Fox News Roger Ailes and other Fox executives, resulting in litigation and/or significant settlements paid by Fox, including sexual harassment lawsuits filed by former Fox News anchor Gretchen Carlson and former The Five host Andrea Tantaros. The events culminated with Mr. Ailes resignation on July 21, 2016 and, more recently, an ongoing grand jury investigation by the U.S. Attorney’s office for the Southern District of New York. | Then, on April 3, 2017, an additional lawsuit was filed by Fox News contributor Julie Roginsky against Ailes for sexual harassment and against Ailes and other executives for retaliation for raising the issue. | Additionally, on April 1, 2017, The New York Times  reported that Fox paid $13 million to settle sexual harassment allegations against Bill O’Reilly, host of Fox’s No. 1 program The O’Reilly Factor, raised by five women, two of which came after Ailes resigned in 2016. Following this report, more than 60 advertisers suspended ads from O’Reilly’s show.",3,"82, 33, 57",sexual harassment
"TFCFA, TFCF",TWENTY,"FIRST CENTURY FOX INVESTIGATION INITIATED by Former Louisiana Attorney General Kahn Swick & Foti, LLC Investigates the Offic... - 17-Mar",17,"Kahn Swick & Foti, LLC",Lawsuit,"Throughout 2016, a series of high-profile sexual harassment complaints were lodged against former head of Fox News Roger Ailes and other Fox executives, resulting in litigation and/or significant settlements paid by Fox, including sexual harassment lawsuits filed by former Fox News anchor Gretchen Carlson and former The Five host Andrea Tantaros. The events culminated with Mr. Ailes resignation on July 21, 2016 and, more recently, with an ongoing grand jury investigation being brought by the U.S. Attorney’s office for the Southern District of New York.",1,85,sexual harassment
"TFCFA, TFCF",TWENTY,"FIRST CENTURY FOX INVESTIGATION INITIATED by Former Louisiana Attorney General Kahn Swick & Foti, LLC Investigates the Offic... - 17-Nov",17,"Kahn Swick & Foti, LLC",Lawsuit,"This revelation comes on the heels of a broad range of complaints of sexual harassment and discrimination over the years made against former Fox executives and employees, including former head of Fox News Roger Ailes and Bill O’Reilly, host of The O’Reilly Factor, which resulted in negative publicity, litigation against the Company and significant settlements paid out by the Company to resolve some of the claims, totaling a reported $85 million, as well as the departure of key executives and personalities.",1,81,sexual harassment
TWTR,"Twitter, Inc.(TWTR",US) Schedules Annual General Meeting for 20-May-2019 330 PM ET,8,,,,0,0,
USB,U.S. Bank Announces Retirements of Bill Parker and Jennie Carlson,4-May-18,BW,U.S. Bank,Personnel,"“I have had the pleasure of working with Bill for decades, and I will miss his insight, counsel and humor. He has been a steadying influence on our Managing Committee for years. He is guided by a belief in doing what is right, and he has shaped our risk organization during a time of tremendous change. The infrastructure he developed will guide us well in the future,” said Andrew Cecere, chairman, president and CEO of U.S. Bank. “Under Jennie’s leadership, we have placed more of an emphasis on the importance of engagement, diversity and inclusion, and talent development. Both Bill and Jennie have assembled strong teams to lead us into the future. I am confident that we will find suitable successors who will carry the mantle they have built as we create value for our shareholders.”",1,136,Diversity and Inclusion
USB,U.S. Bank Announces Winner of National LGBT Debit Card Design Contest,13-Mar-17,BW,U.S. Bank,"Contest, Product/Service, Photo/Multimedia","More than 400 artists nationally submitted original designs to the bank’s card contest, which launched in December and ended Jan. 31. The LGBT card design contest was a part of U.S. Bank’s ongoing efforts to show support for different communities and highlight the bank’s emphasis on diversity and inclusion.",1,49,Diversity and Inclusion
USB,U.S. Bank Debuts Pride,Inspired Visa® Debit Card to Celebrate LGBT Community - 06-Jun,17,U.S. Bank,"Product/Service, Photo/Multimedia","Out of more than 400 original designs submitted to U.S. Bank’s LGBT debit card contest earlier this year, the design by Olivia Ogba of Atlanta was the first- place winner and is featured on the card. The contest was a part of the bank’s ongoing efforts to show support for LGBT and other communities, and highlight its emphasis on diversity and inclusion. | “We take pride in creating card designs that are as unique as our customers,” said Lisa Wolf, vice president, customer relationship management, U.S. Bank. “This design is distinctive in that it was created and chosen by the public, and shows our commitment to diversity and inclusion.”",2,"62, 46",Diversity and Inclusion
USB,U.S. Bank Named a 2019 'Leading Disability Employer' by National Organization on Disability,27-Sep-19,BW,U.S. Bank,"Nonprofit, Product/Service, Award, Personnel","For more information on U.S. Bank’s commitment to diversity and inclusion, visit usbank.com/diversity.",1,13,Diversity and Inclusion
USB,U.S. Bank Named a World's Most Ethical Company® by the Ethisphere Institute for Third Consecutive Year,13-Mar-17,BW,U.S. Bank,"Award, Product/Service","“Over the last 11 years we have seen the shift in societal expectations, constant redefinition of laws and regulations and the geo-political climate,” said Ethisphere’s Chief Executive Officer Timothy Erblich. “We have also seen how companies honored as the World’s Most Ethical respond to these challenges. They invest in their local communities, embrace strategies of diversity and inclusion, and implement sustainable business practices. Congratulations to U.S. Bank for its third consecutive recognition as a World's Most Ethical Company.""",1,78,Diversity and Inclusion
USB,U.S. Bank Named One of the Best Places to Work for Disability Inclusion,18-Jul-19,BW,U.S. Bank,"Award, Personnel, Product/Service","For more information on U.S. Bank’s commitment to diversity and inclusion, visit usbank.com/diversity.",1,13,Diversity and Inclusion
USB,U.S. Bank Named to DiversityInc's Top 50 Companies for Diversity List,8-May-19,BW,U.S. Bancorp,"Award, Personnel, Survey, Product/Service","U.S. Bank has been named to DiversityInc’s Top 50 Companies for Diversity List. Since 2001, the list has recognized companies for their exceptional commitment to diversity and inclusion. The list has evolved significantly since its inception, reflecting how rapidly companies are adapting diversity and inclusion strategies. | U.S. Bank Named to DiversityInc’s Top 50 Companies for Diversity List  Wednesday, May 08, 2019 07:30:00 PM (GMT) | The DiversityInc Top 50 list is derived exclusively from corporate survey submissions; more than 1,800 companies participated in 2018. To be considered for a spot in the DiversityInc Top 50, a company must score above average in four areas: talent pipeline, talent development, leadership accountability and supplier diversity. Companies are evaluated within the context of their own industries.",3,"46, 18, 58","diversity, Diversity and Inclusion"
"05MBTR, USB",U.S. Bank Names Ismat Aziz Chief Human Resources Officer,29-Aug-18,BW,U.S. Bank,Personnel,"U.S. Bank announced today that Ismat Aziz will become its new chief human resources officer (CHRO). In this role, Aziz will direct the strategy of the human resources organization including talent acquisition and development, performance management, compensation and benefits, employee relations, employee engagement, and diversity and inclusion.",1,47,Diversity and Inclusion
USB,"U.S. Bank to Rebuild in Minneapolis, Announces Multiple Investments and Initiatives to Address Social and Economic Inequities",5-Jun-20,BW,U.S. Bank,Product/Service,"“We need to be more intentional about creating conditions in which all of our employees can develop leadership, demonstrate creativity and advance professionally,” said Greg Cunningham, chief diversity officer for U.S. Bank. “We are steadfast in our commitment to placing equal value on the potential contributions, unique leadership skills and creativity that come with the black experience. We are making progress but need to continue to improve in this area.” | “George Floyd’s life had meaning and purpose. We need to do what we can to give the heartbreak that has followed meaning and purpose, as well,” Cecere said. “If we are truly going to draw strength from diversity, we have to do better. We have to create opportunities that bridge gaps, that generate economic prosperity, and that allow people to achieve their potential.”",2,"70, 63","Chief Diversity Officer, diversity"
