identifier,headline,date,source,who_wrote_the_piece,subject,relevant_text,paragraphs,words,keywords
USB,U.S. Bank's Proud to Serve Group Recognized for Its Contributions and Achievements,14-Oct-15,BW,U.S. Bank,"Award, Product/Service, Event","About The Association of ERGs & Councils The Association of ERGs & Councils is the premier resource for diversity and inclusion professionals dedicated to increasing the impact, effectiveness and recognition of Employee Resource Groups and Diversity Councils as an essential partner in developing, implementing and maintaining a strategic diversity and inclusion focus within organizations. Since 2005, the Association has provided hundreds of ERGs and Diversity Councils with resources and tools to assist them in starting up, staying motivated and reaching higher levels of effectiveness and performance. Along with PRISM International, Inc., the Association co- presents the annual ERG & Council Conference™ and ERG & Council Honors Award™. For questions or interviews regarding the Association of ERGs & Councils, contact Linda Stokes, president and chief executive officer of PRISM International, Inc., and the Association of ERGs & Councils at (888) 997-7476 or by email at linda@PrismDiversity.com. | U.S. Bank will be recognized during the Seventh Annual Honors Award Dinner on Oct. 14 at the Hilton Alexandria Mark Center Hotel in Virginia. U.S. Bank was one of 538 resource groups and diversity councils that applied.",2,"145, 37","diversity, Diversity and Inclusion"
0B49NF,Uber being investigated by EEOC over gender discrimination,#NAME?,Jul,,"Articles, Reports, Conjecture, Media Summaries, Other Regulatory, Published Reports, Regulatory",,0,0,
0B49NF,Uber Colorado Partners With Blind Institute of Technology to Provide Free Rides for Blind and Visually Impaired Job Seekers,7-Jul-16,INW,,,"""Statistics show that the unemployment and underemployment rate among blind and visually impaired Americans is a staggering 80 percent,"" said Mike Hess, founder and executive director of the Blind Institute of Technology. ""BIT appreciates Uber's support in helping us solve this national diversity and inclusion epidemic so all motivated and qualified BVI candidates receive the same opportunities for employment as everyone else striving to achieve their career aspirations.""",1,68,Diversity and Inclusion
0B49NF,Uber Partners with Leading Organizations to Help Combat Human Trafficking,29-Jan-18,BW,Uber,Product/Service,"Uber has also partnered with Thorn to support their work building technology to defend children from sexual abuse. Thorn builds powerful products, leads new programs, maintains essential resources, and develops awareness campaigns to attack the issue.",1,36,sexual abuse
0B49NF,Uber Pledges $5 Million to Raise Awareness and Prevent Sexual Assault and Domestic Violence,6-Nov-17,BW,Uber,,"Uber Pledges $5 Million to Raise Awareness and Prevent Sexual Assault and Domestic Violence  Monday, November 06, 2017 12:41:00 PM (GMT) | Uber today announced a $5 million commitment over five years as part of its “Driving Change” campaign for sexual assault and domestic violence awareness and prevention initiatives in partnership with groups including Raliance, the National Network to End Domestic Violence and NO MORE. These groups began working with Uber several months ago to begin building these important initiatives. | “Sexual assault and domestic violence are issues that affect millions of people around the world. As members of the communities we serve, we want to work with others to be part of the solution,” said Rachel Holt, vice president US/Canada Operations, Uber. “We’re not only committing major funding for awareness and prevention programs through leading community partners, we are driving meaningful change in this area from the highest levels of our organization on down.” | In collaboration with its partners in the sexual assault and domestic violence space, as part of this commitment, Uber has made some important changes and is using its technology to help drive awareness and prevention of sexual assault and domestic violence to millions globally. Some of the initiatives that have already been implemented include: | Raliance (National Sexual Violence Resource Center (NSVRC), the California Coalition Against Sexual Assault (CALCASA) and the National Alliance to End Sexual Violence (NAESV)): | ""As a member of this partnership, Raliance values the opportunity to make lasting, impactful changes to safety needs not just within Uber, but throughout the entire commuter transportation industry,"" Kristen Houser, spokesperson for Raliance said. “Pairing Uber’s technology expertise with our expertise in sexual assault prevention and response will pave a path for innovative ways to move the needle to end sexual | “Casa de Esperanza appreciates the commitment Uber has made to addressing issues of domestic violence and sexual assault. Uber has embraced a powerful opportunity to create meaningful change by taking steps to improve its organizational capacity and resources internally as they support prevention efforts externally,” said Patricia Tototzintle, CEO of Casa de Esperanza. “A major undertaking takes a major commitment from Uber, and it has shown its support to national and community efforts through current and future partners. This is a time to envision and work toward greater prevention efforts through our partnership.” (casadeesperanza.org) | “We, at Women of Color Network, Inc., are extremely excited for this groundbreaking partnership with Uber and associated organizations,” stated Tonya Lovelace, CEO of Women of Color Network, Inc. “This is an amazing opportunity for WOCN, Inc. and other national culturally specific organizations to support Uber in their quest to directly reach those who are historically marginalized based on race, ethnicity, gender identity, sexual orientation, faith, immigration status and other identities, and who experience sexual assault, domestic violence and other forms of intersecting violence at greater proportions than mainstream communities, but are least likely to feel the impact of funding. We look forward to being a catalyst in this effort.” (wocninc.org) | “As an organization dedicated to getting the issues of domestic violence and sexual assault out of the shadows and encouraging everyone to be part of the solution, this partnership offers huge opportunities to raise awareness, support prevention initiatives, and ensure that potentially lifesaving resources are prominently available,” said Rachel Haas, Managing Director, NO MORE. “NO MORE is committed to working with individuals, organizations or corporations that are truly interested in bringing about change. We’re honored to join in this effort with these leading organizations that have been long-time members of the NO MORE coalition. To make real progress and to address a deeply embedded culture of violence, we want – and in fact need – to be in as many boardrooms, classrooms and living rooms as possible, as well as on the networks and platforms where people live, work and play.” (nomore.org) | Executive leadership training - Engaged its executive leadership team in awareness training facilitated by experts from the National Alliance to End Sexual Violence and the National Network to End Domestic Violence. | The $5 million commitment will fund programmatic partnerships focused on prevention. An initial portion of the funding will go to partners Raliance, the National Network to End Domestic Violence, Women of Color Network, Inc., Casa de Esperanza, A CALL TO MEN, the National Coalition of Anti-Violence Programs and NO MORE. These partners and the funding will also help address critical funding gaps with marginalized communities who are often the most underfunded. | National Network to End Domestic Violence | “The National Network to End Domestic Violence (NNEDV) is proud to work with Uber in its efforts to increase public awareness of domestic violence, and to make changes both internally and externally to help keep riders, drivers, employees and members of our communities safe.” NNEDV Executive Vice President Cindy Southworth said, “At NNEDV, we are dedicated to creating an environment in which violence and abuse no longer exists, and this includes innovations in outreach, public education and strategic collaborations. We are pleased that Uber is committed to becoming an industry leader on this issue.” (nnedv.org)",13,"21, 58, 74, 54, 23, 62, 94, 111, 142, 31, 71, 6, 95","sexual violence, sexual assault, domestic violence"
UBER,Uber releases safety report from the years 2017,2018 - 05-Dec,19,,,The release provides statistics regarding sexual assault and misconduct figures as well as physical assaults and motor vehicle fatalities According to the Executive Summary:,1,24,sexual assault
UBER,"Uber Technologies, Inc.(UBER",US) Schedules Annual General Meeting for 11-May-2020,31,,,,0,0,
0B49NF,Uber's top dealmaker leaves company,WSJ - 23-Oct,18,,"Articles, Reports, Conjecture, Corporate Actions, Management Changes, Media Summaries, Published Reports","The WSJ reports that the resignation of corporate development head Cameron Poetzscher follows a 26-Sep WSJ report on Poetzscher's alleged sexual misconduct in the office. Uber tells the WSJ that Poetzscher's resignation is effective immediately, and CFO Nelson Chai will assume Poetzscher's responsibilities until a replacement is found. People familiar with the matter tell the WSJ that some people on an internal panel who were briefed on a law firm's investigation of Poetzscher felt the company should fire him. StreetAccount notes that Uber has a history of allegedly tolerating sexual harassment.",1,91,sexual harassment
UBSG,UBS 1Q17 Net Profit up 79% to CHF 1.3bn,28-Apr-17,BW,UBS,"Earnings, Conference Call, Webcast","As a recognized sustainability leader, UBS has committed to attract USD 5bn of wealth management client assets over the next five years to support the 17 UN Sustainable Development Goals (UN SDGs). The UN SDGs target the world's biggest challenges, from climate change and healthcare, to gender equality, hunger and education. In March, UBS co-launched the USD 110m Rethink Impact Fund to support innovative female-led companies that use technology to solve the UN SDGs. The launch of the fund coincided with a new UBS white paper on gender-lens investing that calls for systematic, concerted private support for the UN SDG promoting gender equality. | Sustainable investing funds for gender diversity and renewable energy launched",2,"103, 10","diversity, gender equality"
UBSG,UBS 3Q18 PBT +37% YoY to CHF 1.7bn,25-Oct-18,BW,UBS Group AG,Earnings,"The UBS Global Gender Equality ETF launched earlier this year by Global Wealth Management and Asset Management has now surpassed the USD 100m milestone, reflecting the growing importance of sustainability goals such as gender equality for clients. The ETF invests in companies in the Solactive Equileap Global Gender Equality 100 Leaders Index, an equity index of 100 leading global companies with a strong record in gender diversity and sustainability. UBS channels 5% of the ETF’s management fees into philanthropic projects supporting this topic, via the UBS Optimus Foundation. | In August, UBS joined the Climate Bonds Initiative (CBI) Partners Program. UBS's partnership with the CBI will further develop its data capabilities and market-building efforts within green finance and sustainable fixed income and will add diversity and expertise to CBI’s Partners Network. CBI is an international organization working solely to mobilize the largest capital market of all, the USD 100trn bond market, for climate change solutions.",2,"88, 66","diversity, gender equality"
"UBSG, 001BC5",UBS Advisor Kirsten Ismail Named to Working Mother Magazine's 2019 'Top Wealth Advisor Moms' list.,31-Oct-19,BW,WorkingMother.com For the full list and more visit: https://www.workingmother.com/g00/top-wealth-,"Photo/Multimedia, Award","Source: WorkingMother.com For the full list and more visit: https://www.workingmother.com/g00/top-wealth- advisor-moms-2019?i10c.ua=1&i10c.encReferrer=aHR0cHM6Ly93d3cuZ29vZ2xlLmNvbS8%3d&i10c.dv=14 | workplace programs in the areas of women's advancement, parental leave, family support, flexibility and career development. This year, UBS has been ranked first for their gender-neutral parental leave policies.",2,"11, 29","D&I, parental leave"
"UBSG, UBS, UBSN...",UBS and Bloomberg Launch Girls Take Finance in 12 Cities Globally to Inspire Teenage Girls to Be the Next Generation of Lea...,27-Feb-20,BW,UBS and Bloomberg,"Photo/Multimedia, Contract/Agreement, Corporate Social Responsibility, Product/Service","#TOGETHERBAND campaign will launch SDG5, Gender Equality and Women's Empowerment  in March to coincide with the initiative.",1,17,gender equality
"UBSG, UBS, UBSN...",UBS Earns Top Marks in 2017 Corporate Equality Index,5-Dec-16,BW,UBS,Award,"""It is very gratifying to receive this recognition,"" said Denise Hebner, Head of Diversity & Inclusion UBS Americas. ""UBS is committed to providing an inclusive work environment that benefits our clients as well as our employees. By fostering creativity, and tapping unique ideas, experiences and diverse perspectives, we can ensure that we are bringing the very best of UBS to everyone that we work for and with.""",1,67,Diversity & Inclusion
"UBSG, 05K28L, 06D48M","UBS, Bloomberg, and State Street Global Advisors Launch Girls Take Wall Street to Inspire the Next Generation of Female L...",1-Mar-19,BW,UBS,"Contract/Agreement, Product/Service, Photo/Multimedia","""While the financial services industry is more diverse than ever before, there's quite a bit of progress still to be made in transforming it to more accurately reflect today's society,"" said Tom Naratil, President UBS Americas and Co-President UBS Global Wealth Management. ""We're proud to play a part in educating and inspiring these young women as they consider pursuing careers in finance. Together with our partners, we're excited by this unique opportunity to connect with the next generation of female leaders and help close our industry's outdated gender gap."" | State Street Global Advisors commissioned Fearless Girl, now located in front of the New York Stock Exchange, to raise awareness of their push to increase gender diversity on corporate boards. The statue celebrates the spirit of women who are taking charge today, and serves as inspiration for the next generation of female leaders. Fearless Girl ignited a global conversation about the power of women in leadership and inspired more than 300 companies around the world to add women to their boards. | “At Bloomberg, we’ve always been committed to ensuring equal opportunities for women,” said Michael R. Bloomberg, founder of Bloomberg LP and Bloomberg Philanthropies. “We invest in women’s professional development in our offices around the world, and we highlight the progress other companies are making through the Bloomberg Gender-Equality Index. We also connect students with opportunities to learn from successful women in the finance industry. We're glad to be a part of ""Girls Take Wall Street,"" and I'm looking forward to meeting with the group today.""",3,"89, 81, 85","gender gap, diversity, gender-equality"
UBSG,UBS 2018 PBT +19% to USD 6.4bn,22-Jan-19,BW,UBS,,"UBS has come out a leader in a new ranking from Equileap, a gender equality research firm. Their 2018 report, which analyzes the gender diversity data of more than 3,000 large public companies and grades the top 200, ranks UBS 18th globally, first among Swiss firms, and in the top ten of financial companies. | Diversity and inclusion",2,"54, 3","Diversity and Inclusion, gender equality"
ULTA,"Ulta Beauty, Inc.(ULTA",US) Schedules Annual General Meeting for 3-June-2020 1100 AM ET,23,,,,0,0,
ULTA,"Ulta Beauty, Inc.(ULTA",US) Schedules Q1 2018 Earnings Call for 31-May-2018 500 PM ET,17,,,,0,0,
ULTA,"Ulta Beauty, Inc.(ULTA",US) Schedules Q4 2019 Earnings Call for 12-March-2020 500 PM ET,12,,,,0,0,
"UN, UL, 05G05N",Unilever Announces New Initiative in Progress to Helping 1 Billion People Improve Their Health and Wellbeing,14-Oct-12,BW,Unilever,"Contract/Agreement, Nonprofit",,0,0,
"ULVR, UL",Unilever calls on content creators &amp distributors to eradicate stereotypes,20-Jun-18,NEWS_CR,https://www.unilever.com/news/press-releases/2018/unilever-calls-on-content-creators-and-,Company Announcements and Releases,"Aline Santos, Unilever Executive Vice President Global Marketing and Head of Diversity and Inclusion, says “Through our ongoing advertising assessment against Unstereotype criteria we already know that progressive advertising creates 25 percent more branded impact and new data now tells us that progressive ads are also 16 percent more relevant, 21 percent more credible and can drive purchase intent by 18 percent. The economic case is just as tangible as the social case for change, which is why we are expanding the Unstereotype initiative to drive unstereotypical content at scale through new partnerships and mainstream content.” | Simon Fuller comments: “As one of the most socially conscious and largest consumer goods companies today, Unilever brands like Rexona continue to cut through the clutter when it comes to making bold statements with real actions. With Now United I also want to embrace this pioneering spirit, defining new ways to interact with entertainment, celebrating diversity and inclusion with a powerful message of unity and positivity. Through the passionate engagement of music and dance, with Rexona as our partner, we will share all of this positive energy and excitement with our audience on a global scale.” | Aline Santos adds: “As marketers, we have talked for decades about reaching as many people as possible; it’s time we place equal emphasis on representing as many people as possible. That means prioritising greater authenticity in our characters and storylines, and doing more to accurately capture the richness and diversity of the world we live in. From films and TV programmes, to web series and podcasts, we have to work with the entertainment industry to co-create content we’re proud to support with our media investment.”",3,"96, 96, 85","diversity, Diversity and Inclusion"
"UNAT.XX1, ULVR",Unilever Calls on Content Creators and Distributors to Eradicate Stereotypes,19-Jun-18,BW,Unilever,Product/Service,"Aline Santos, Unilever Executive Vice President Global Marketing and Head of Diversity and Inclusion, says “Through our ongoing advertising assessment against Unstereotype criteria we already know that progressive advertising creates 25 percent more branded impact and new data now tells us that progressive ads are also 16 percent more relevant, 21 percent more credible and can drive purchase intent by 18 percent. The economic case is just as tangible as the social case for change, which is why we are expanding the Unstereotype initiative to drive unstereotypical content at scale through new partnerships and mainstream content.” | Simon Fuller comments: “As one of the most socially conscious and largest consumer goods companies today, Unilever brands like Rexona continue to cut through the clutter when it comes to making bold statements with real actions. With Now United I also want to embrace this pioneering spirit, defining new ways to interact with entertainment, celebrating diversity and inclusion with a powerful message of unity and positivity. Through the passionate engagement of music and dance, with Rexona as our partner, we will share all of this positive energy and excitement with our audience on a global scale.” | Aline Santos adds: “As marketers, we have talked for decades about reaching as many people as possible; it’s time we place equal emphasis on representing as many people as possible. That means prioritising greater authenticity in our characters and storylines, and doing more to accurately capture the richness and diversity of the world we live in. From films and TV programmes, to web series and podcasts, we have to work with the entertainment industry to co-create content we’re proud to support with our media investment.”",3,"96, 96, 85","diversity, Diversity and Inclusion"
"ULVR, UN, 001JWY",Unilever Earns Top Marks from Human Rights Campaign,18-Nov-15,BW,Unilever,Survey,"The Human Rights Campaign is America’s largest civil rights organization working to achieve lesbian, gay, bisexual and transgender equality. By inspiring and engaging all Americans, HRC strives to end discrimination against LGBT citizens and realize a nation that achieves fundamental fairness and equality for all. | Unilever supports the LGBT community through its PRIDE Group and diversity and inclusion initiatives including the Ad Council’s “Love Has No Labels” campaign. PRIDE (People Respecting Individuality, Diversity and Equality) is an LGBT Business Resource Group open to all Unilever employees that share a common goal of endorsing respect, individuality, diversity and equality throughout the organization.",2,"45, 56","Diversity and Inclusion, gender equality"
ULVR,Unilever launches new AI,powered talent marketplace - 25-Jun,19,https://www.unilever.com/news/press-releases/2019/unilever-launches-ai-powered-talent-,Company Announcements and Releases,,0,0,
ULVR,Unilever Plc(ULVR,GB) Schedules Barclays CEO Energy Power Conference for 5-September-2018 900 AM ET,30,,,,0,0,
ULVR,Unilever Plc(ULVR,GB) Schedules Bernstein European Strategic Decisions CEO Conference for 26-September-2019 400 AM ET,20,,,,0,0,
ULVR,Unilever Plc(ULVR,GB) Schedules Consumer Analyst Group of New York Conference for 21-February-2019 800 AM ET,3,,,,0,0,
ULVR,Unilever Plc(ULVR,GB) Schedules Deutsche Bank dbAccess Global Consumer Conference for 11-June-2019 230 AM ET,5,,,,0,0,
ULVR,Unilever Plc(ULVR,GB) Schedules Investor Meeting - Day 1 - Morning Session for 13,November,,,,0,0,
ULVR,Unilever Plc(ULVR,GB) Schedules Investor Meeting - Day 2 - Morning Session for 14,November,,,,0,0,
ULVR,Unilever Plc(ULVR,GB) Schedules Investor Meeting for 11-December-2019 800 AM ET,8,,,,0,0,
ULVR,Unilever Plc(ULVR,GB) Schedules Q1 2019 Sales and Revenue Call - Trading Statement for 18-April,2019 300 AM ET,,,,0,0,
"UN, UL, 071MGK",Unilever Recognized as Best Place to Work by Human Rights Campaign,23-Nov-12,BW,Unilever,Award,"Unilever has again been named one of Human Rights Campaign’s “Best Places to Work”, achieving a perfect score of 100 percent on the organization’s 2013 Corporate Equality Index for the fifth year running. The ranking recognizes the company’s commitment to diversity and inclusion in the workplace, marketplace and community. | To achieve a perfect score, companies must have fully inclusive equal employment opportunity policies, provide equal employment benefits, demonstrate organizational LGBT competency, evidence their commitment to equality publicly and exercise responsible citizenship. This year’s Corporate Equality Index tells a powerful story of American businesses working to meet that higher bar. | Unilever supports the LGBT community at work through its PRIDE Network. PRIDE (People Respecting Individuality, Diversity and Equality) is an LGBT Diversity Network open to all Unilever employees that share a common goal of endorsing respect, individuality, diversity, and equality throughout the organization. It creates and maintains an open workplace environment for the LGBT community and helps develop its members by providing both business and social interaction with the purpose of furthering personal growth.",3,"49, 50, 74","Equal Employment Opportunity, diversity, Diversity and Inclusion"
"UL, 064X9Y",Unilever's Leading Detergent Brand OMO Launches Initiative to Help 10m Children Access Quality Education,25-Aug-15,PRNE,,"Corporate Social Responsibility, Government Policies & News, Not For Profit Organizations, Human Interest Groups","Right to Education and Child Friendly Schools: Public awareness campaign to increase the demand for quality education. Early Childhood Education:  Government and partners have the capacity to provide equitable access to quality Early Childhood Education. Teacher Education and Support System:  Pre-service and in-service training, improve retention and quality of learning in certain areas (e.g. remote areas). Quality Education with Equity: Support for inclusive education planning, including marginalised children, out of school, and prompting all duty bearers (civil society, coalitions) to demand quality education for vulnerable children. Adolescents and Gender Equality: Adolescents, especially girls, fully participate and are empowered to be involved in decision making that affects their lives.",1,108,gender equality
UAL,United Airlines Achieves Highest Second,Quarter Pre-Tax Income In Company History - 16,Jul,United Airlines,"Conference Call Announcements, Earnings, Dividends & Forecasts","Received ""Best-of-the-Best"" award for commitment to diversity and inclusion by the National LGBT Chamber of Commerce (NGLCC) and the National Business Inclusion Consortium (NBIC), demonstrating the airline's industry-leading results across all diverse segments and its commitment to building a more diverse economy. Honored with the ""DiversityInc Top 50"" designation, lauding the airline's leadership in promoting diversity through talent development, leadership accountability and a top supplier diversity program. Expect profit sharing for 2019 to be about 20 percent higher per participating employee year-over- year. Hosted more than half of the company's 25,000 flight attendants at 17 separate Backstage 2019 events, which are designed to underscore the important role flight attendants play in delivering great service.",1,114,Diversity and Inclusion
